company,address,industry,website,phone,contact_person,is_hotline,gender,position,email,url
Bao Bì LTP - Công Ty TNHH LTP Global Vina,"Block M1.106, Đường Đào Trí, P. Phú Thuận, Q. 7,","Hóa Mỹ Phẩm - Sản Xuất và Phân Phối__Bao Bì Màng Ghép, Bao Bì Màng Phức Hợp__Bao Bì Mỹ Phẩm__In Bao Bì Nhựa, In Màng Co, Màng Ghép, In ống Đồng__Bao Bì PE, PP, HDPE, LDPE (Dạng Tấm, Cuộn, Túi)__Bao Bì Nhựa__Khẩu Trang Vải, Khẩu Trang Than Hoạt Tính - Sản Xuất và Bán Buôn__Bao Bì Thực Phẩm",www.ltpglobalvina.com.vn,'0907662468__02873004257__02873004746',Hotline,X,,,lhnquoc@ltpglobalvina.com.vn,https://www.yellowpages.vn/lgs/1187850576/bao-bi-ltp-cong-ty-tnhh-ltp-global-vina.html
Bao Bì LTP - Công Ty TNHH LTP Global Vina,"Block M1.106, Đường Đào Trí, P. Phú Thuận, Q. 7,","Hóa Mỹ Phẩm - Sản Xuất và Phân Phối__Bao Bì Màng Ghép, Bao Bì Màng Phức Hợp__Bao Bì Mỹ Phẩm__In Bao Bì Nhựa, In Màng Co, Màng Ghép, In ống Đồng__Bao Bì PE, PP, HDPE, LDPE (Dạng Tấm, Cuộn, Túi)__Bao Bì Nhựa__Khẩu Trang Vải, Khẩu Trang Than Hoạt Tính - Sản Xuất và Bán Buôn__Bao Bì Thực Phẩm",www.ltpglobalvina.com.vn,'0907662468__02873004257__02873004746',Hotline,X,,,lhnquoc@ltpglobalvina.com.vn,https://www.yellowpages.vn/lgs/1187850576/bao-bi-ltp-cong-ty-tnhh-ltp-global-vina.html
Bao Bì Vạn Phát - Công Ty TNHH SX TM Bao Bì Vạn Phát,"C4/5B34 Bùi Thanh Khiết, KP. 3, TT. Tân Túc, H. Bình Chánh,","Bao Bì Màng Ghép, Bao Bì Màng Phức Hợp__Bao Bì Mỹ Phẩm__Bao Bì Nông Nghiệp__In Bao Bì - Công Ty Thiết Kế và In ấn Bao Bì__In Bao Bì Nhựa, In Màng Co, Màng Ghép, In ống Đồng__Màng Seal Nhôm, Màng Nhôm (Lá Mỏng, Vỉ Bấm,.)__Túi Nilon PE, Túi PP, Túi HDPE,.__Bao Bì PE, PP, HDPE, LDPE (Dạng Tấm, Cuộn, Túi)__Bao Bì Nhựa__Túi OPP__Bao PP Dệt__Màng Co PE, LDPE, PVC, POF,.__Bao Bì Thực Phẩm__Bao Bì - Nhà Sản Xuất và Kinh Doanh",www.baobivanphat.com,'0941201949',Bà Doãn Thị Tường Lam,,female,Giám Đốc,congtyvanphat9999@gmail.com,https://www.yellowpages.vn/lgs/1187814771/bao-bi-van-phat-cong-ty-tnhh-sx-tm-bao-bi-van-phat.html
Bao Bì Nhựa Minh Long - Công Ty TNHH Sản Xuất Và Xuất Nhập Khẩu Bao Bì Nhựa Minh Long,"Số 375 Nguyễn Trãi, Q. Thanh Xuân,","Bao Bì - Nhà Sản Xuất và Kinh Doanh__Bao PP Dệt__Bao Bì PE, PP, HDPE, LDPE (Dạng Tấm, Cuộn, Túi)__Bao Tải Dứa",www.baobiminhlong.vn__www.ppwovenbags.bizz.vn,'0966625582__0916193386',Mr. Vũ Văn Minh,,male,Giám Đốc,baobiminhlong218@gmail.com,https://www.yellowpages.vn/lgs/1187922882/bao-bi-nhua-minh-long-cong-ty-tnhh-san-xuat-va-xuat-nhap-khau-bao-bi-nhua-minh-long.html
Mút Xốp KBC - Công Ty TNHH Bao Bì KBC,"DX 058, P. Phú Mỹ, TP. Thủ Dầu Một,","Xốp Hơi, Màng Xốp Hơi__Bao Bì Đồ Điện Tử__Mút Xốp EVA, PU, PE,..Định Hình - Sản Xuất Và Gia Công Theo yêu Cầu__Bao Bì PE, PP, HDPE, LDPE (Dạng Tấm, Cuộn, Túi)__Màng PE Foam (Cuộn, Tấm, Túi, ống,.) - Sản Xuất Và Kinh Doanh__Hạt Nhựa - Nguyên Liệu",www.baobikbc.com,'0916157786',Ms. Thương,,female,,baobikbc@gmail.com,https://www.yellowpages.vn/lgs/1187905908/mut-xop-kbc-cong-ty-tnhh-bao-bi-kbc.html
Mút Xốp KBC - Công Ty TNHH Bao Bì KBC,"DX 058, P. Phú Mỹ, TP. Thủ Dầu Một,","Xốp Hơi, Màng Xốp Hơi__Bao Bì Đồ Điện Tử__Mút Xốp EVA, PU, PE,..Định Hình - Sản Xuất Và Gia Công Theo yêu Cầu__Bao Bì PE, PP, HDPE, LDPE (Dạng Tấm, Cuộn, Túi)__Màng PE Foam (Cuộn, Tấm, Túi, ống,.) - Sản Xuất Và Kinh Doanh__Hạt Nhựa - Nguyên Liệu",www.baobikbc.com,'0916157786',Ms. Thương,,female,,baobikbc@gmail.com,https://www.yellowpages.vn/lgs/1187905908/mut-xop-kbc-cong-ty-tnhh-bao-bi-kbc.html
Bao Bì Hưng Phú - Công Ty TNHH Sản Xuất Và In ấn Bao Bì Hưng Phú,"48/11C Đường Số 10, P. Bình Hưng Hòa B, Q. Bình Tân,","In Túi Nilon, In Túi Xốp__Túi Phân Hủy Sinh Học__In Bao Bì Nhựa, In Màng Co, Màng Ghép, In ống Đồng__Túi Nilon PE, Túi PP, Túi HDPE,.__Bao Bì PE, PP, HDPE, LDPE (Dạng Tấm, Cuộn, Túi)__Bao Bì Nhựa__Túi, Bao Zipper, Ziplock__Túi Đựng Thực Phẩm, Túi Cuộn Đựng Thực Phẩm",www.baobihungphu.net,'0937792788__02866711788',Mr. Hưng,,male,,baobinhuahungphu@gmail.com,https://www.yellowpages.vn/lgs/1187890629/bao-bi-hung-phu-cong-ty-tnhh-san-xuat-va-in-an-bao-bi-hung-phu.html
Bao Bì NhựaTrần Tín - Công Ty TNHH Trần Tín,"Số 102A, Đường Nguyễn Đình Chiểu, KP. Đông A, P. Đông Hoà, TP. Dĩ An,","Băng Keo OPP (Trong, Đục và Màu), Băng Keo Dán Thùng__Dây Đai Nhựa__Túi Nilon PE, Túi PP, Túi HDPE,.__Bao Bì PE, PP, HDPE, LDPE (Dạng Tấm, Cuộn, Túi)__Màng PE Quấn Pallet__Túi, Bao Zipper, Ziplock__Túi Giấy, Túi Giấy Kraft__Màng PE, Màng Chít - Nhà Sản Xuất__Túi Đựng Rác (Túi Đựng Rác y Tế, Công Nghiệp, Màu Đen, Dạng Cuộn)",www.tuinilontrantin.com,'0934198088__0903656663',Hotline,X,,,tuinilontrantin@gmail.com,https://www.yellowpages.vn/lgs/1187829825/bao-bi-nhuatran-tin-cong-ty-tnhh-tran-tin.html
Bao Bì Mạnh Tùng - Công Ty TNHH Mạnh Tùng,"Thôn Minh Khai, TT. Như Quỳnh, H. Văn Lâm,","Màng Phủ Nông Nghiệp, Ngư Nghiệp__Túi Nilon PE, Túi PP, Túi HDPE,.__Bao Bì PE, PP, HDPE, LDPE (Dạng Tấm, Cuộn, Túi)__Bao Bì Nhựa__Bao Bì - Nhà Sản Xuất và Kinh Doanh",www.mtp.com.vn__www.tuinilonpe.bizz.vn,'0903227818__02213985634',Ông Nguyễn Văn Đãng,,male,Giám Đốc,manhtungmtp@gmail.com,https://www.yellowpages.vn/lgs/1187688930/bao-bi-manh-tung-cong-ty-tnhh-manh-tung.html
Bao Bì Sao Việt - Công Ty TNHH In ấn & Bao Bì Sao Việt,"Số 92B, Đường Huỳnh Minh Mương, Tổ 4, ấp 3B, Xã Tân Thạnh Đông, Huyện Củ Chi,","In Bao Bì Nhựa, In Màng Co, Màng Ghép, In ống Đồng__In Bao Bì - Công Ty Thiết Kế và In ấn Bao Bì__Túi Nilon PE, Túi PP, Túi HDPE,.__Bao Bì PE, PP, HDPE, LDPE (Dạng Tấm, Cuộn, Túi)",www.dracoplastics.bizz.vn,'0944652688',Hotline,X,,,bb.saoviet@gmail.com,https://www.yellowpages.vn/lgs/1187900055/bao-bi-sao-viet-cong-ty-tnhh-in-an---bao-bi-sao-viet.html
Công Ty TNHH Sản Xuất Thương Mại Tổng Hợp II,"30C Tân Hóa, P. 1, Q. 11, Tp. Hồ Chí Minh","In Túi Nilon, In Túi Xốp__Túi Phân Hủy Sinh Học__Túi Đựng Rác (Túi Đựng Rác y Tế, Công Nghiệp, Màu Đen, Dạng Cuộn)__In Bao Bì Nhựa, In Màng Co, Màng Ghép, In ống Đồng__Dây Đeo Thẻ, Dây Huân Chương__Túi Nilon PE, Túi PP, Túi HDPE,.__Bao Bì PE, PP, HDPE, LDPE (Dạng Tấm, Cuộn, Túi)__Túi Vải Không Dệt__Bao Bì Thực Phẩm__Bao Bì - Nhà Sản Xuất và Kinh Doanh__Túi Đựng Thực Phẩm, Túi Cuộn Đựng Thực Phẩm",,'02839600361__0908919184',Ông Nguyễn Quốc Cường,,male,,bagth2@gmail.com,https://www.yellowpages.vn/lgs/1187722023/cong-ty-tnhh-san-xuat-thuong-mai-tong-hop-ii.html
Bao Bì Nhựa Thiên Quân - Công Ty TNHH Nhựa Thiên Quân,"92C4 Dương Công Khi, Ấp 6, X. Xuân Thới Sơn, H. Hóc Môn,","Túi Phân Hủy Sinh Học__Túi Nilon PE, Túi PP, Túi HDPE,.__Bao Bì PE, PP, HDPE, LDPE (Dạng Tấm, Cuộn, Túi)__Màng PE, Màng Chít - Nhà Sản Xuất__Túi Đựng Rác (Túi Đựng Rác y Tế, Công Nghiệp, Màu Đen, Dạng Cuộn)",www.baobithienquan.com,'0987134997__02866847343',Ms. Thanh Phương,,female,Kinh Doanh,thanhphuong_phan@yahoo.com,https://www.yellowpages.vn/lgs/119318016/bao-bi-nhua-thien-quan-cong-ty-tnhh-nhua-thien-quan.html
Bao Bì ánh Trinh - Doanh Nghiệp Tư Nhân ánh Trinh,"881 Phạm Văn Đồng, KP. 4, P. Linh Tây, TP. Thủ Đức,","In Túi Nilon, In Túi Xốp__Túi Phân Hủy Sinh Học__Băng Keo, Băng Dính__Túi Nilon PE, Túi PP, Túi HDPE,.__Bao Bì PE, PP, HDPE, LDPE (Dạng Tấm, Cuộn, Túi)__Bao Bì Nhựa__Túi OPP__Túi, Bao Zipper, Ziplock__Túi Giấy, Túi Giấy Kraft__Bao Bì May Mặc__Màng Co PE, LDPE, PVC, POF,.__Túi Đựng Rác (Túi Đựng Rác y Tế, Công Nghiệp, Màu Đen, Dạng Cuộn)",www.tuinilonanhtrinh.com,'02838963013__0908800547',Bà Trần Ngọc Ánh,,female,,anh201080@yahoo.com.vn,https://www.yellowpages.vn/lgs/1187711298/bao-bi-anh-trinh-doanh-nghiep-tu-nhan-anh-trinh.html
Bao Bì Tân Việt Phát - Công Ty TNHH Bao Bì Đóng Gói Tân Việt Phát,"Số 45, Hẻm 34, Tổ 6, KP 3, P. Trảng Dài, TP. Biên Hoà,","Tấm Nhựa Danpla, Thùng Nhựa Danpla__Túi Nilon PE, Túi PP, Túi HDPE,.__Bao Bì PE, PP, HDPE, LDPE (Dạng Tấm, Cuộn, Túi)__Bao Bì Nhựa__Màng PE Foam (Cuộn, Tấm, Túi, ống,.) - Sản Xuất Và Kinh Doanh__Bao Bì Giấy__Túi Khí Chèn Hàng__Bao Bì Nhựa Định Hình, Khay Nhựa Định Hình__Bao Bì - Nhà Sản Xuất và Kinh Doanh",www.baobitanvietphat.com,'02512222622__0974057755__0365120515',Hotline,X,,,tanvietphat.packaging@gmail.com,https://www.yellowpages.vn/lgs/1187810553/bao-bi-tan-viet-phat-cong-ty-tnhh-bao-bi-dong-goi-tan-viet-phat.html
Cường Anh Plastic - Công Ty TNHH Cường Anh HD,"Thái Bình,","Bao Bì Màng Ghép, Bao Bì Màng Phức Hợp__In Bao Bì Nhựa, In Màng Co, Màng Ghép, In ống Đồng__Túi Nilon PE, Túi PP, Túi HDPE,.__Bao Bì PE, PP, HDPE, LDPE (Dạng Tấm, Cuộn, Túi)__Bao Bì Nhựa__Gia Công ép Nhựa, Gia Công ép Nhựa Theo Yêu Cầu",www.cuonganhplastic.vn,'0982227559__0868787885',Hotline,X,,,cuonganhplastic.vn@gmail.com,https://www.yellowpages.vn/lgs/1187929920/cuong-anh-plastic-cong-ty-tnhh-cuong-anh-hd.html
Cường Anh Plastic - Công Ty TNHH Cường Anh HD,"Quảng Ninh,","Bao Bì Màng Ghép, Bao Bì Màng Phức Hợp__In Bao Bì Nhựa, In Màng Co, Màng Ghép, In ống Đồng__Túi Nilon PE, Túi PP, Túi HDPE,.__Bao Bì PE, PP, HDPE, LDPE (Dạng Tấm, Cuộn, Túi)__Bao Bì Nhựa__Gia Công ép Nhựa, Gia Công ép Nhựa Theo Yêu Cầu",www.cuonganhplastic.vn,'0982227559__0868787885',Hotline,X,,,cuonganhplastic.vn@gmail.com,https://www.yellowpages.vn/lgs/1187929932/cuong-anh-plastic-cong-ty-tnhh-cuong-anh-hd.html
Bao Bì Đại Hữu - Công Ty CP Đại Hữu,"Tầng 22, LICOGI13 TOWER, Số 164 Khuất Duy Tiến, P. Nhân Chính, Q. Thanh Xuân,","Bao Bì PE, PP, HDPE, LDPE (Dạng Tấm, Cuộn, Túi)__Bao PP Dệt__Nông Sản__Bao Bì - Nhà Sản Xuất và Kinh Doanh__Hạt Nhựa, Hạt Nhựa Nguyên Sinh",www.daihuu.com.vn,'02438611711__0979272550',Mr. Phát,,male,Phòng kinh doanh,phat.daihuu@gmail.com,https://www.yellowpages.vn/lgs/1317066/bao-bi-dai-huu-cong-ty-cp-dai-huu.html
Cường Anh Plastic - Công Ty TNHH Cường Anh HD,"Khu Đường 5B, X. Cộng Hòa, H. Nam Sách,","Bao Bì Màng Ghép, Bao Bì Màng Phức Hợp__In Bao Bì Nhựa, In Màng Co, Màng Ghép, In ống Đồng__Túi Nilon PE, Túi PP, Túi HDPE,.__Bao Bì PE, PP, HDPE, LDPE (Dạng Tấm, Cuộn, Túi)__Bao Bì Nhựa__Gia Công ép Nhựa, Gia Công ép Nhựa Theo Yêu Cầu",www.cuonganhplastic.vn,'0982227559__0868787885',Hotline,X,,,cuonganhplastic.vn@gmail.com,https://www.yellowpages.vn/lgs/1187929746/cuong-anh-plastic-cong-ty-tnhh-cuong-anh-hd.html
Bao Bì Nilon Nhất Nam - Công Ty TNHH Sản Xuất Thương Mại Nhất Nam,"166H Tổ 35, KP. 5,  P. Trảng Dài, TP. Biên Hòa,","Băng Keo OPP (Trong, Đục và Màu), Băng Keo Dán Thùng__Chai Thủy Tinh, Lọ Thủy Tinh__Túi Nilon PE, Túi PP, Túi HDPE,.__Bao Bì PE, PP, HDPE, LDPE (Dạng Tấm, Cuộn, Túi)__Chỉ May Bao Bì, Chỉ Khâu Bao Bì__Màng PE Foam (Cuộn, Tấm, Túi, ống,.) - Sản Xuất Và Kinh Doanh__Màng PE Quấn Pallet",www.nhatnamco.com.vn,'02516293977__0942998208__0942468478',Ms. Phan Thị Nga,,female,Quản Lý Sản Xuất,phannga475@gmail.com,https://www.yellowpages.vn/lgs/1187809743/bao-bi-nilon-nhat-nam-cong-ty-tnhh-san-xuat-thuong-mai-nhat-nam.html
Công Ty Cổ Phần Bao Bì Phú Mỹ Hà Nội,"Tiểu Khu Phú Mỹ, Thị Trấn Phú Xuyên, H. Phú Xuyên,","Màng Co PE, LDPE, PVC, POF,.__Bao Bì PE, PP, HDPE, LDPE (Dạng Tấm, Cuộn, Túi)__Túi Nilon PE, Túi PP, Túi HDPE,.__Hạt Nhựa Tái Sinh, Tái Chế",,'0972473939__02436876053',Mr. Văn Anh,,male,,thanhbinh2009@gmail.com,https://www.yellowpages.vn/lgs/1187818821/cong-ty-co-phan-bao-bi-phu-my-ha-noi.html
Công Ty TNHH Sản Xuất Thương Mại & Kinh Doanh Tùng Lâm,"Thôn Trung Kỳ, X. Đắc Sở, H. Hoài Đức,","Túi PE Khổ Lớn__Hạt Nhựa - Nguyên Liệu__Túi Nilon PE, Túi PP, Túi HDPE,.__Bao Bì PE, PP, HDPE, LDPE (Dạng Tấm, Cuộn, Túi)",www.baobitunglamvn.com,'02433217128__0963958274',Sale,,,,baobitunglamvn@gmail.com,https://www.yellowpages.vn/lgs/1187789985/cong-ty-tnhh-san-xuat-thuong-mai---kinh-doanh-tung-lam.html
Bao Bì Trần Gia - Công Ty TNHH Sản Xuất Thương Mại Nhựa Trần Gia,"19/2H, Đường 20, KP. 1, P. Bình Hưng Hòa A, Q. Bình Tân,","Bao Bì - Nhà Sản Xuất và Kinh Doanh__Bao PP Dệt__Bao Bì PE, PP, HDPE, LDPE (Dạng Tấm, Cuộn, Túi)",www.trangiaplastic.com.vn,'02822451210__0983425858',Ms. Tuyết,,female,,trangiaplastic@gmail.com,https://www.yellowpages.vn/lgs/1187711289/bao-bi-tran-gia-cong-ty-tnhh-san-xuat-thuong-mai-nhua-tran-gia.html
Nhựa Tân Hoàng Anh - Công Ty TNHH Tân Hoàng Anh,"41/5E Ấp Tam Đông, X. Thới Tam Thôn, H. Hóc Môn,","Màng Phủ Nông Nghiệp, Ngư Nghiệp__Túi Nilon PE, Túi PP, Túi HDPE,.__Bao Bì PE, PP, HDPE, LDPE (Dạng Tấm, Cuộn, Túi)__Bao Bì Nhựa__Túi Đựng Rác (Túi Đựng Rác y Tế, Công Nghiệp, Màu Đen, Dạng Cuộn)",www.tanhoanganh.com.vn,'0903911413__02837104833',Mr. Tân,,male,Giám Đốc,tanhoanganh1973@yahoo.com.vn,https://www.yellowpages.vn/lgs/1066944/nhua-tan-hoang-anh-cong-ty-tnhh-tan-hoang-anh.html
Bao Bì Tân Vĩnh Lợi - Công Ty TNHH Sản Xuất Thương Mại Bao Bì Tân Vĩnh Lợi,"692 Hương Lộ 2, KP. 4, P. Bình Trị Đông A, Q. Bình Tân,","Bao Bì Màng Ghép, Bao Bì Màng Phức Hợp__Túi Nilon PE, Túi PP, Túi HDPE,.__Bao Bì PE, PP, HDPE, LDPE (Dạng Tấm, Cuộn, Túi)__Bao Bì Nhựa__Bao PP Dệt__Bao Bì - Nhà Sản Xuất và Kinh Doanh",www.baobitanvinhloi.com,'0907153253__02837670654',Ông Mã Thiếu Kỳ,,male,,tanvinhloi.co@gmail.com,https://www.yellowpages.vn/lgs/1144056/bao-bi-tan-vinh-loi-cong-ty-tnhh-san-xuat-thuong-mai-bao-bi-tan-vinh-loi.html
Bao Bì Nhựa Nam Thái Sơn - Công Ty CP Xuất Nhập Khẩu Nam Thái Sơn,"934 D3, Đường D, KCN Cát Lái, Quận 2,","Túi Nilon PE, Túi PP, Túi HDPE,.__Bao Bì PE, PP, HDPE, LDPE (Dạng Tấm, Cuộn, Túi)__Bao Bì Nhựa__Bao Bì Thực Phẩm__Hạt Nhựa, Hạt Nhựa Nguyên Sinh",www.namthaison.com.vn,'02837421331',Hotline,X,,,info@namthaison.com.vn,https://www.yellowpages.vn/lgs/1017342/bao-bi-nhua-nam-thai-son-cong-ty-cp-xuat-nhap-khau-nam-thai-son.html
Công Ty TNHH Sản Xuất Thương Mại Xuất Nhập Khẩu Hoàng Việt,"72 Lê Hồng Phong, P. 2, Q. 5,","In Bao Bì - Công Ty Thiết Kế và In ấn Bao Bì__In ấn - Công ty In ấn Và Thiết Kế (In Offset, In Flexo)__Bao Bì PE, PP, HDPE, LDPE (Dạng Tấm, Cuộn, Túi)",www.inhoangviet.com,'02839245927__0346856454',Hotline,X,,,huynhthuylinh1511@yahoo.com,https://www.yellowpages.vn/lgs/1187737098/cong-ty-tnhh-san-xuat-thuong-mai-xuat-nhap-khau-hoang-viet.html
Vipaco - Công Ty TNHH Đầu Tư ứng Dụng Sản Xuất Bao Bì Việt,"Đường D1, KCN Phố Nối A, X. Giai Phạm, H. Yên Mỹ,","Bao Bì Màng Ghép, Bao Bì Màng Phức Hợp__Bao Bì - Nhà Sản Xuất và Kinh Doanh__Túi Nilon PE, Túi PP, Túi HDPE,.__Bao Bì PE, PP, HDPE, LDPE (Dạng Tấm, Cuộn, Túi)",www.vipaco.vn,'0961101786__02213967779__0344335766',Chị Nguyễn Thị Thùy,,,P. Hành Chính Nhân Sự,thuyhcns.vipaco@gmail.com,https://www.yellowpages.vn/lgs/1480818/vipaco-cong-ty-tnhh-dau-tu-ung-dung-san-xuat-bao-bi-viet.html
Tập Viết Tân Thuận Tiến - Công Ty TNHH Sản Xuất Thương Mại Dịch Vụ Tân Thuận Tiến,"KCN. Vĩnh Lộc, LôA54/II, Đường 2D, P. Bình Hưng Hòa B, Q. Bình Tân,","Sổ Viết__Văn Phòng Phẩm - Công Ty Văn Phòng Phẩm__Túi Nilon PE, Túi PP, Túi HDPE,.__Bao Bì PE, PP, HDPE, LDPE (Dạng Tấm, Cuộn, Túi)__Sổ, Vở Viết - Sản Xuất Và Kinh Doanh__In Bao Bì - Công Ty Thiết Kế và In ấn Bao Bì",www.baobitanthuantien.com__www.tanthuantienpaper.com.vn,'02854255331__0903942504',Ông Đỗ Phước Thuận,,male,,phuocthuandottt@gmail.com,https://www.yellowpages.vn/lgs/692481/tap-viet-tan-thuan-tien-cong-ty-tnhh-san-xuat-thuong-mai-dich-vu-tan-thuan-tien.html
Công Ty CP Volga VN,"E8-1 Đường 7, KCN Lê Minh Xuân 3, X. Lê Minh Xuân, H. Bình Chánh,","Khẩu Trang Y Tế - Sản Xuất Và Bán Buôn__Túi Nilon PE, Túi PP, Túi HDPE,.__Bao Bì PE, PP, HDPE, LDPE (Dạng Tấm, Cuộn, Túi)__Bao Bì Nhựa__Gia Công ép Nhựa, Gia Công ép Nhựa Theo Yêu Cầu__Túi Đựng Rác (Túi Đựng Rác y Tế, Công Nghiệp, Màu Đen, Dạng Cuộn)",www.volga.vn__www.volgaplastic.com,'0286270732__0916847168__02862707328',Mr. Tuấn,,male,,tuan@volga.vn,https://www.yellowpages.vn/lgs/1187743179/cong-ty-cp-volga-vn.html
Bao Bì An Phú Minh - Công Ty TNHH MTV An Phú Minh,"Cụm Công Nghiệp Diên Sanh, Thị Trấn Hải Lăng, H. Hải Lăng","Bao Bì - Nhà Sản Xuất và Kinh Doanh__Bao PP Dệt__Bao Bì PE, PP, HDPE, LDPE (Dạng Tấm, Cuộn, Túi)",www.anphuminh.vn,'0914145544__02333670494',Hotline,X,,,anphuminhpp@gmail.com,https://www.yellowpages.vn/lgs/1187834328/bao-bi-an-phu-minh-cong-ty-tnhh-mtv-an-phu-minh.html
Công Ty TNHH Quế Phương,"Km16, TT.Trạm Trôi, H. Hoài Đức,","Hạt Chống ẩm, Túi Chống ẩm__Bao Bì PE, PP, HDPE, LDPE (Dạng Tấm, Cuộn, Túi)",,'0948240575__02433862123',Ms. Hiền,,female,Trưởng phòng Kinh doanh,hientathithu@gmail.com,https://www.yellowpages.vn/lgs/1187741721/cong-ty-tnhh-que-phuong.html
Bao Bì Hoàng Gia Lam Sơn - Công Ty TNHH Hoàng Gia Lam Sơn,"X. Hải Lĩnh, H. Tĩnh Gia,","Bao Bì Màng Ghép, Bao Bì Màng Phức Hợp__Túi Nilon PE, Túi PP, Túi HDPE,.__Bao Bì PE, PP, HDPE, LDPE (Dạng Tấm, Cuộn, Túi)__Bao PP Dệt__Bao Bì - Nhà Sản Xuất và Kinh Doanh__Bao Container, Bao Jumbo, Bao Bigbag",,'0915135626',Mr. Đào Văn Hải,,male,Giám Đốc,hoanggialamson@gmail.com,https://www.yellowpages.vn/lgs/1187680656/bao-bi-hoang-gia-lam-son-cong-ty-tnhh-hoang-gia-lam-son.html
Bao Bì Phạm Hà - Công Ty TNHH Phạm Hà,"140 KP 3, P. Thạnh Xuân, Q. 12,","In Bao Bì Nhựa, In Màng Co, Màng Ghép, In ống Đồng__Túi Nilon PE, Túi PP, Túi HDPE,.__Bao Bì PE, PP, HDPE, LDPE (Dạng Tấm, Cuộn, Túi)__Bao Bì Nhựa__In Bao Bì - Công Ty Thiết Kế và In ấn Bao Bì",,'0903692709__02837168321',Mr. Bình,,male,,phamha7777@yahoo.com.vn,https://www.yellowpages.vn/lgs/1073466/bao-bi-pham-ha-cong-ty-tnhh-pham-ha.html
Bao Bì Tiền Giang - Công Ty Cổ Phần Bao Bì Tiền Giang,"Khu Phố Trung Lương, P. 10, Tp. Mỹ Tho,","Bao PP Dệt__Bao Bì PE, PP, HDPE, LDPE (Dạng Tấm, Cuộn, Túi)",www.tigipack.com.vn,'02733867887__02733855684',P. Nghiệp Vụ Tổng Hợp,,,,baobitigipack@gmail.com,https://www.yellowpages.vn/lgs/1054932/bao-bi-tien-giang-cong-ty-co-phan-bao-bi-tien-giang.html
Bao Bì Hương Sen - Công Ty TNHH Bao Bì Hương Sen,"3/265 Bồ Đề, Q. Long Biên,","Thùng Carton, Thùng Giấy__Bao Bì PE, PP, HDPE, LDPE (Dạng Tấm, Cuộn, Túi)__Bao Jumbo__Bao PP Dệt__Bao Bì - Nhà Sản Xuất và Kinh Doanh",www.vietnamppwovenbag.com,'0943061888',Ms. Kathy Trần,,female,Sales Manager,contact@vietnamppwovenbag.com,https://www.yellowpages.vn/lgs/1187902344/bao-bi-huong-sen-cong-ty-tnhh-bao-bi-huong-sen.html
Bao Bì VLC - Công Ty Cổ Phần Bao Bì VLC,"Lô D1, Khu Công Nghiệp Tràng Duệ, Xã Hồng Phong, Huyện An Dương,","Bao Bì Màng Ghép, Bao Bì Màng Phức Hợp__Bao Bì PE, PP, HDPE, LDPE (Dạng Tấm, Cuộn, Túi)__Bao Bì Nhựa__Bao PP Dệt__Bao Bì - Nhà Sản Xuất và Kinh Doanh",www.vlcpacks.com,'0979288825__02253929659',Ông Nguyễn Đức Dương,,male,Tổng Giám Đốc,ducduong25@gmail.com,https://www.yellowpages.vn/lgs/1187688297/bao-bi-vlc-cong-ty-co-phan-bao-bi-vlc.html
Bao Bì Mực In Việt Nam - Công Ty TNHH Bao Bì Mực In Việt Nam,"TĐS 441, TBĐ số 30, KP. Bình Khánh, P. Khánh Bình, TX. Tân Uyên,","Bao Bì Màng Ghép, Bao Bì Màng Phức Hợp__Bao Bì Nông Nghiệp__Bao Bì PE, PP, HDPE, LDPE (Dạng Tấm, Cuộn, Túi)__Bao Bì May Mặc__Bao Bì - Nhà Sản Xuất và Kinh Doanh",www.vinapackink.com.vn,'02743686750__0903801330',Mr. Triết,,male,,trietleminh9@gmail.com,https://www.yellowpages.vn/lgs/1230015/bao-bi-muc-in-viet-nam-cong-ty-tnhh-bao-bi-muc-in-viet-nam.html
Công Ty TNHH KOHSEI MULTIPACK Việt Nam,"Lô C, KCN Bình Xuyên, H. Bình Xuyên,","Bao Big Bag Cũ__Túi Nilon PE, Túi PP, Túi HDPE,.__Bao Bì PE, PP, HDPE, LDPE (Dạng Tấm, Cuộn, Túi)__Bao Jumbo__Bao Bì - Nhà Sản Xuất và Kinh Doanh__Bao Container, Bao Jumbo, Bao Bigbag",www.kmvfibc.com,'84915205248__84966205248__02113593411',Mr. Nguyễn Hoàng Việt,,male,Nhân viên kinh doanh,business@kmvina.com.vn,https://www.yellowpages.vn/lgs/1187710623/cong-ty-tnhh-kohsei-multipack-viet-nam.html
Bao Bì Nhựa Cường Thịnh Phát - Công Ty TNHH Thương Mại & Sản Xuất Bao Bì Nhựa Cường Thịnh Phát,"309B2/4 Đường Bảy Tấn, ấp 2, X. An Phú Tây, H. Bình Chánh,","Bao Bì Màng Ghép, Bao Bì Màng Phức Hợp__Bao Bì PE, PP, HDPE, LDPE (Dạng Tấm, Cuộn, Túi)__Bao Bì Nhựa",,'02837690518__0903810217',Mr. Bình,,male,,cuongthinhphat2@gmail.com,https://www.yellowpages.vn/lgs/1187736594/bao-bi-nhua-cuong-thinh-phat-cong-ty-tnhh-thuong-mai---san-xuat-bao-bi-nhua-cuong-thinh-phat.html
Bao Bì Kamuri - Công Ty Cổ Phần Kamuri Việt Nam,"NC2, KCN Châu Sơn, H. Phủ Lý,","Bao PP Dệt__Bao Bì PE, PP, HDPE, LDPE (Dạng Tấm, Cuộn, Túi)",www.kamurivietnam.com,'02462822022',P. Kinh Doanh,,,,sale4@kamurivietnam.com,https://www.yellowpages.vn/lgs/1187795607/bao-bi-kamuri-cong-ty-co-phan-kamuri-viet-nam.html
Bao Bì Nhựa SVN - Công Ty TNHH Phát Triển Công Nghệ SVN,"Khu 8, P. Đại Phúc, TP. Bắc Ninh,","Túi OPP__Túi, Bao Zipper, Ziplock__Túi Nilon PE, Túi PP, Túi HDPE,.__Bao Bì PE, PP, HDPE, LDPE (Dạng Tấm, Cuộn, Túi)",,'0986808009__0971059248__0986626020',Ms Đỗ Thị Ca,,female,Trưởng Phòng Kinh Doanh,tieucahht188@gmail.com,https://www.yellowpages.vn/lgs/1187794236/bao-bi-nhua-svn-cong-ty-tnhh-phat-trien-cong-nghe-svn.html
Công Ty TNHH Thái Hiệp,"430/3 Tân Kỳ Tân Quý, P. Sơn Kỳ, Q. Tân Phú,","Dây Nilon__Bao Bì PE, PP, HDPE, LDPE (Dạng Tấm, Cuộn, Túi)",,'0903304931__02839612055',Mr. Chiêu,,male,Giám Đốc,thahico@yahoo.com,https://www.yellowpages.vn/lgs/1187765439/cong-ty-tnhh-thai-hiep.html
Công Ty TNHH Sản Xuất Thương Mại ACEP,"Số 44/14 Đờng Lồ Ồ, Tổ 9, KP. Nội Hóa 1, P. Bình An, TX. Dĩ An,","Túi Nilon PE, Túi PP, Túi HDPE,.__Bao Bì PE, PP, HDPE, LDPE (Dạng Tấm, Cuộn, Túi)",www.acepplastic.com.vn,'0903160689',Hotline,X,,,,https://www.yellowpages.vn/lgs/1187811051/cong-ty-tnhh-san-xuat-thuong-mai-acep.html
Bao Bì ITVN - Công Ty TNHH Thương Mại Và Đầu Tư ITVN,"Km8, QL 21B, Huyện Thanh Oai,","Bao Bì Màng Ghép, Bao Bì Màng Phức Hợp__In Bao Bì Nhựa, In Màng Co, Màng Ghép, In ống Đồng__Bao Bì PE, PP, HDPE, LDPE (Dạng Tấm, Cuộn, Túi)__Bao Bì Nhựa__Bao PP Dệt__In Bao Bì - Công Ty Thiết Kế và In ấn Bao Bì",www.baobiitvn.bizz.vn,'0912353454__02433877377__0243877377',Ông Nguyễn Văn Kiên,,male,Giám Đốc,baobiitvn@gmail.com,https://www.yellowpages.vn/lgs/1187681403/bao-bi-itvn-cong-ty-tnhh-thuong-mai-va-dau-tu-itvn.html
Bao Bì Sài Gòn Xanh - Công Ty TNHH Bao Bì Sài Gòn Xanh,"139/33 Dương Văn Dương, Phường Tân Qúy, Quận Tân Phú,","Bao Bì - Nhà Sản Xuất và Kinh Doanh__Bao Bì PE, PP, HDPE, LDPE (Dạng Tấm, Cuộn, Túi)__Bao Bì Nhựa",www.baobisaigonxanh.com.vn,'02837673091__02837673092',Phòng KD,,,,baobisaigonxanh.com.vn,https://www.yellowpages.vn/lgs/1187829636/bao-bi-sai-gon-xanh-cong-ty-tnhh-bao-bi-sai-gon-xanh.html
Công Ty TNHH Thương Mại Dịch Vụ Khang Huy,"Số 03, Thủ Khoa Huân, P. 8, Q. Tân Bình,","Dụng Cụ Bổ Trợ May__Giấy Pelure (Giấy Chống ẩm, Giấy Hút ẩm)__Giấy Ngành May Mặc, Da Giày__Bao Bì PE, PP, HDPE, LDPE (Dạng Tấm, Cuộn, Túi)__Bìa Lưng, Giấy Bìa Lưng__Giấy Sơ Đồ__Bao Bì - Nhà Sản Xuất và Kinh Doanh__Giấy Cắt Rập, Giấy Dưỡng__Phụ Liệu Đóng Gói May Mặc - Sản Xuất Và Cung Cấp",www.khc.com.vn,'0938837781__0938837782',Hotline,X,,,khanghuy@khc.com.vn,https://www.yellowpages.vn/lgs/1154175/cong-ty-tnhh-thuong-mai-dich-vu-khang-huy.html
Công Ty Cổ Phần Sản Xuất Công Nghiệp Quốc Tế Đạt Thành,"Lô T-2A, Đường Số 4, KCN Long Hậu Mở Rộng, Ấp 3, X. Long Hậu, H. Cần Giuộc,","Màng Phủ Nông Nghiệp, Ngư Nghiệp__Màng PE, Màng Chít - Nhà Sản Xuất__Màng PE Quấn Pallet__Bao Bì PE, PP, HDPE, LDPE (Dạng Tấm, Cuộn, Túi)",www.datthanhplastic.com,'0971885053',Ms. Vy,,female,Quản Lý,havy.phan@datthanhint.com,https://www.yellowpages.vn/lgs/1187905779/cong-ty-co-phan-san-xuat-cong-nghiep-quoc-te-dat-thanh.html
