company,address,industry,website,phone,contact_person,is_hotline,gender,position,email,url
Bao Bì Nhựa á Châu  - Công Ty Cổ Phần Bao Bì Nhựa á Châu,"55/5 Bùi Thị Xuân, P. 5, Q. Tân Bình,","Hạt Nhựa, Hạt Nhựa Nguyên Sinh__Túi Đựng Rác (Túi Đựng Rác y Tế, Công Nghiệp, Màu Đen, Dạng Cuộn)__Túi Nilon PE, Túi PP, Túi HDPE,.__Bao Bì PE, PP, HDPE, LDPE (Dạng Tấm, Cuộn, Túi)",www.baobiachau.com,'0931489929__0903057220__02822289534',Hotline,X,,,asiaplastic.minh3@gmail.com,https://www.yellowpages.vn/lgs/1187715900/bao-bi-nhua-a-chau--cong-ty-co-phan-bao-bi-nhua-a-chau.html
Bao Bì Nhựa Dương An Kỳ - Công Ty TNHH Dương An Kỳ,"67/8J Đường Tân Hiệp 4, Ấp Thới Tây 2, X. Tân hiệp, H. Hóc Môn,","In Túi Nilon, In Túi Xốp__In Bao Bì Nhựa, In Màng Co, Màng Ghép, In ống Đồng__Túi Nilon PE, Túi PP, Túi HDPE,.__Bao Bì PE, PP, HDPE, LDPE (Dạng Tấm, Cuộn, Túi)__Túi, Bao Zipper, Ziplock",www.baobiduonganky.bizz.vn,'0909240848',Ms An,,female,Kinh Doanh,baobiduonganky@gmail.com,https://www.yellowpages.vn/lgs/1187858526/bao-bi-nhua-duong-an-ky-cong-ty-tnhh-duong-an-ky.html
Bao Bì Vạn ánh Dương - Công Ty TNHH MTV Thương Mại Vạn Ánh Dương,"808/5/3/1 Khu Phố 4, Quốc Lộ 13, P. Hiệp Bình Phước, Q. Thủ Đức","Túi Phân Hủy Sinh Học__Túi Nilon PE, Túi PP, Túi HDPE,.__Bao Bì PE, PP, HDPE, LDPE (Dạng Tấm, Cuộn, Túi)__Túi, Bao Zipper, Ziplock__Túi Đựng Rác (Túi Đựng Rác y Tế, Công Nghiệp, Màu Đen, Dạng Cuộn)",www.vananhduong.com.vn,'02873026161__0829345656__0909345656',Ms. Trang Đài,,female,,vananhduongco.ltd@gmail.com,https://www.yellowpages.vn/lgs/1187794851/bao-bi-van-anh-duong-cong-ty-tnhh-mtv-thuong-mai-van-anh-duong.html
Bao Bì Đại Dương Xanh - Công Ty TNHH Sản Xuất Và Thương Mại Bao Bì Đại Dương Xanh,"Số 45, Ngõ 164/41, Phố Vương Thừa Vũ, Khương Trung, Thanh Xuân,","Màng Co PE, LDPE, PVC, POF,.__Bao Bì Nông Nghiệp__Túi Nilon PE, Túi PP, Túi HDPE,.__Bao Bì PE, PP, HDPE, LDPE (Dạng Tấm, Cuộn, Túi)__Bao Bì Nhựa__Màng PE Foam (Cuộn, Tấm, Túi, ống,.) - Sản Xuất Và Kinh Doanh__Bao PP Dệt__Màng PE, Màng Chít - Nhà Sản Xuất",www.baobidaiduongxanh.com.vn,'0358116979__0968745285__0975523285',Hotline,X,,,oceanbluepacking@gmail.com,https://www.yellowpages.vn/lgs/1187752314/bao-bi-dai-duong-xanh-cong-ty-tnhh-san-xuat-va-thuong-mai-bao-bi-dai-duong-xanh.html
Bao Bì Nhựa Cao Dương - Công Ty TNHH Sản Xuất Thương Mại Dịch Vụ Cao Dương,"24/6D Nguyễn Thị Thử, Ấp 3, X. Xuân Thới Sơn, H. Hóc Môn,","Túi Phân Hủy Sinh Học__In Bao Bì Nhựa, In Màng Co, Màng Ghép, In ống Đồng__Túi Nilon PE, Túi PP, Túi HDPE,.__Bao Bì PE, PP, HDPE, LDPE (Dạng Tấm, Cuộn, Túi)__Bao Bì Nhựa__Túi OPP__Túi, Bao Zipper, Ziplock__Túi Đựng Rác (Túi Đựng Rác y Tế, Công Nghiệp, Màu Đen, Dạng Cuộn)__Túi Đựng Thực Phẩm, Túi Cuộn Đựng Thực Phẩm",www.baobicaoduong.bizz.vn__www.baobinhuacaoduong.com,'02837135791__0913675001',Hotline,X,,,caoduong02@gmail.com,https://www.yellowpages.vn/lgs/1187741883/bao-bi-nhua-cao-duong-cong-ty-tnhh-san-xuat-thuong-mai-dich-vu-cao-duong.html
Bao Bì Nhựa Di Đại Hưng - Công Ty TNHH Di Đại Hưng,": 462 & 466 Hồng Bàng, P. 16, Q. 11,","Bao Bì Nông Nghiệp__Túi Nilon PE, Túi PP, Túi HDPE,.__Bao Bì PE, PP, HDPE, LDPE (Dạng Tấm, Cuộn, Túi)__Bao Bì May Mặc__Bao Bì Xuất Khẩu__Túi Đựng Rác (Túi Đựng Rác y Tế, Công Nghiệp, Màu Đen, Dạng Cuộn)",www.tashing.com.vn,'0914713418__02839605800',Mr. Vinh,,male,Phụ trách kinh doanh,vinh.khuu@tashing.com.vn,https://www.yellowpages.vn/lgs/703767/bao-bi-nhua-di-dai-hung-cong-ty-tnhh-di-dai-hung.html
Bao Bì Nilon Kiệt Thành - Công Ty TNHH Sản Xuất Thương Mại Dịch Vụ Kiệt Thành,"351/1 An Dương Vương, P. 10, Q. 6,","Màng Phủ Nông Nghiệp, Ngư Nghiệp__In Túi Nilon, In Túi Xốp__In Bao Bì Nhựa, In Màng Co, Màng Ghép, In ống Đồng__Túi Nilon PE, Túi PP, Túi HDPE,.__Bao Bì PE, PP, HDPE, LDPE (Dạng Tấm, Cuộn, Túi)__Túi Đựng Rác (Túi Đựng Rác y Tế, Công Nghiệp, Màu Đen, Dạng Cuộn)",www.kietthanh.com__www.baobinhuakietthanh.com,'0982086833__02862616910',Mr U Khải Huy,,male,PGĐ Kinh Doanh,xuanthanh.linkedin@gmail.com,https://www.yellowpages.vn/lgs/1187728941/bao-bi-nilon-kiet-thanh-cong-ty-tnhh-san-xuat-thuong-mai-dich-vu-kiet-thanh.html
Màng PE Foam Đức Thuận Phát - Công Ty TNHH Sản Xuất Và Thương Mại Đức Thuận Phát,"Khu Cửa Đồng, TT. Hương Canh, H. Bình Xuyên,","Túi Nilon PE, Túi PP, Túi HDPE,.__Bao Bì PE, PP, HDPE, LDPE (Dạng Tấm, Cuộn, Túi)__Màng PE Foam (Cuộn, Tấm, Túi, ống,.) - Sản Xuất Và Kinh Doanh__Túi, Bao Zipper, Ziplock__Màng PE, Màng Chít - Nhà Sản Xuất",www.sanxuatbaobinilon.com,'0866404464__0968623038',Mr. Nguyễn Đức Điều,,male,Giám Đốc,thuanphat2019.vp@gmail.com,https://www.yellowpages.vn/lgs/1187910771/mang-pe-foam-duc-thuan-phat-cong-ty-tnhh-san-xuat-va-thuong-mai-duc-thuan-phat.html
Bao Bì Vinh - Công Ty CP Nhựa Bao Bì Vinh,"Số 18, Phong Định Cảng, Khối 8, P. Bến Thủy, TP. Vinh,","Bao Xi Măng__Bao Bì PE, PP, HDPE, LDPE (Dạng Tấm, Cuộn, Túi)__Bao Jumbo__Túi OPP__Hạt Nhựa - Nguyên Liệu__Bao Container, Bao Jumbo, Bao Bigbag",www.nhuabaobivinh.com,'02383855524__0965977707__0983838888__0986684433',Mr. Hiếu,,male,,nhuabaobivinh@gmail.com,https://www.yellowpages.vn/lgs/1187707245/bao-bi-vinh-cong-ty-cp-nhua-bao-bi-vinh.html
Bao Bì Nhựa Pridevn Packaging - Công Ty TNHH Pridevn Packaging,"317/5L Ấp Tam Đông 2, Xã Thới Tam Thôn, Huyện Hóc Môn,","Màng Phủ Nông Nghiệp, Ngư Nghiệp__Màng PVC, PET, PP, PS, HIPS__Túi Nilon PE, Túi PP, Túi HDPE,.__Bao Bì PE, PP, HDPE, LDPE (Dạng Tấm, Cuộn, Túi)__Bao Bì Nhựa__Màng Chống Thấm, Màng Chống Thấm HDPE__Màng PE, Màng Chít - Nhà Sản Xuất__Bao Bì - Nhà Sản Xuất và Kinh Doanh__Túi Đựng Thực Phẩm, Túi Cuộn Đựng Thực Phẩm",www.pridevnpackaging.com,'0934629999__02835960168__0944589369',Ông Nguyễn Văn Thông,,male,P. Kinh doanh,pridevn@pridevnpackaging.com,https://www.yellowpages.vn/lgs/1187721273/bao-bi-nhua-pridevn-packaging-cong-ty-tnhh-pridevn-packaging.html
Bao Bì Nhựa Vinh Phát - Công Ty TNHH Sản Xuất Bao Bì Nhựa Vinh Phát,"Số 69/37A Đường Số 16, P. Bình Hưng Hòa A, Q. Bình Tân,","Túi Nilon PE, Túi PP, Túi HDPE,.__Bao Bì PE, PP, HDPE, LDPE (Dạng Tấm, Cuộn, Túi)__Bao Bì Nhựa__Túi OPP__Túi, Bao Zipper, Ziplock__Bao Bì May Mặc__Bao Bì Thực Phẩm__Bao Bì - Nhà Sản Xuất và Kinh Doanh",www.nhuavinhphat.com,'0947854848',Ông Khải Dũng,,male,,khaidung79@gmail.com,https://www.yellowpages.vn/lgs/1187804379/bao-bi-nhua-vinh-phat-cong-ty-tnhh-san-xuat-bao-bi-nhua-vinh-phat.html
Bao Bì Atlantic - Công Ty TNHH Bao Bì Atlantic,"Khu Phố Kếu, X. Đạo Đức, H. Bình Xuyên,","In Túi Nilon, In Túi Xốp__In Bao Bì Nhựa, In Màng Co, Màng Ghép, In ống Đồng__Túi Nilon PE, Túi PP, Túi HDPE,.__Bao Bì PE, PP, HDPE, LDPE (Dạng Tấm, Cuộn, Túi)__Màng PE, Màng Chít - Nhà Sản Xuất__Bao Bì - Nhà Sản Xuất và Kinh Doanh",www.baobiatlantic.com,'0988564998',Ms. Nguyễn Thị Vân Anh,,female,,atlantic2017.ad@gmail.com,https://www.yellowpages.vn/lgs/1187831865/bao-bi-atlantic-cong-ty-tnhh-bao-bi-atlantic.html
Bao Bì Thanh Ngân - Công Ty TNHH Thanh Ngân,"Lô 16, Đường N2, Cụm CN An Xá, Xã Lộc An, TP. Nam Định,","In Bao Bì Nhựa, In Màng Co, Màng Ghép, In ống Đồng__Bao Bì PE, PP, HDPE, LDPE (Dạng Tấm, Cuộn, Túi)__Bao Bì Nhựa__Túi OPP__Bao Bì May Mặc__Bao Bì - Nhà Sản Xuất và Kinh Doanh",www.thanhngan.pro.vn,'0915300700__035032211148',Ms Ngân,,female,Giám đốc,buitrongquan95@gmail.com,https://www.yellowpages.vn/lgs/1187805360/bao-bi-thanh-ngan-cong-ty-tnhh-thanh-ngan.html
Bao Bì Tân Kim Long - Công Ty TNHH Bao Bì Tân Kim Long,"239/60 Khuông Việt, P. Phú Trung, Q. Tân Phú,","In Túi Nilon, In Túi Xốp__In Bao Bì Nhựa, In Màng Co, Màng Ghép, In ống Đồng__Băng Keo, Băng Dính__Túi Nilon PE, Túi PP, Túi HDPE,.__Bao Bì PE, PP, HDPE, LDPE (Dạng Tấm, Cuộn, Túi)__Túi, Bao Zipper, Ziplock__Màng PE, Màng Chít - Nhà Sản Xuất__Túi Đựng Rác (Túi Đựng Rác y Tế, Công Nghiệp, Màu Đen, Dạng Cuộn)",www.baobikimlong.com,'02838615757__02838619245',Ms. Hoàng Vũ Hoài Phương,,female,Giám Đốc,kimlongbaobinhua@gmail.com,https://www.yellowpages.vn/lgs/1187892183/bao-bi-tan-kim-long-cong-ty-tnhh-bao-bi-tan-kim-long.html
Chi nhánh Hà Nam - Công Ty Cổ Phần Thương Mại Và Công Nghệ Minh Phát,"Tỉnh Hà Nam,","áo Mưa Quảng Cáo, áo Mưa Quà Tặng - Sản Xuất Và Bán Buôn__Vải áo Mưa, Ô Dù, Bạt,.( Vải Dù, Vải Nhựa, PVC, PE, PEVA,.)__Túi Nilon PE, Túi PP, Túi HDPE,.__Bao Bì PE, PP, HDPE, LDPE (Dạng Tấm, Cuộn, Túi)__Túi OPP__Bao Bì May Mặc",www.baobiminhphathd.com,'0974111252__0976825223__0987064333',Mr. Nguyễn Viết Nền,,male,,minhphatjsc.vn@gmail.com,https://www.yellowpages.vn/lgs/1187869806/chi-nhanh-ha-nam-cong-ty-co-phan-thuong-mai-va-cong-nghe-minh-phat.html
Bao Bì Nhật Huy - Xưởng Sản Xuất Bao Bì Nhật Huy,"551/56/4C Lê Văn Khương, Tổ 56B, KP. 7, P. Hiệp Thành, Q. 12,","In Bao Bì Nhựa, In Màng Co, Màng Ghép, In ống Đồng__Bao Bì PE, PP, HDPE, LDPE (Dạng Tấm, Cuộn, Túi)",www.baobinhathuy.bizz.vn,'0935182808',Hotline,X,,,khuyen.lethi82@gmail.com,https://www.yellowpages.vn/lgs/1187924616/bao-bi-nhat-huy-xuong-san-xuat-bao-bi-nhat-huy.html
Chi nhánh Bắc Ninh - Công Ty Cổ Phần Thương Mại Và Công Nghệ Minh Phát,"Bắc Ninh,","áo Mưa Quảng Cáo, áo Mưa Quà Tặng - Sản Xuất Và Bán Buôn__Vải áo Mưa, Ô Dù, Bạt,.( Vải Dù, Vải Nhựa, PVC, PE, PEVA,.)__Túi Nilon PE, Túi PP, Túi HDPE,.__Bao Bì PE, PP, HDPE, LDPE (Dạng Tấm, Cuộn, Túi)__Túi OPP__Bao Bì May Mặc",www.baobiminhphathd.com,'0974111252__0976825223__0987064333',Mr. Nguyễn Viết Nền,,male,,minhphatjsc.vn@gmail.com,https://www.yellowpages.vn/lgs/1187900895/chi-nhanh-bac-ninh-cong-ty-co-phan-thuong-mai-va-cong-nghe-minh-phat.html
Bao Bì Nhựa ABM - Công Ty TNHH Phụ Liệu ABM,"199/2 QL 51, Khu 2, Ấp 7, An Phước, Long Thành,","Nhãn Mác Quần áo, Nhãn Mác May Mặc__Giấy Pelure (Giấy Chống ẩm, Giấy Hút ẩm)__In Tem Nhãn, Nhãn Mác, Label__Túi Nilon PE, Túi PP, Túi HDPE,.__Bao Bì PE, PP, HDPE, LDPE (Dạng Tấm, Cuộn, Túi)__Bìa Lưng, Giấy Bìa Lưng__Bao Bì Nhựa__Giấy Đề Can, Decal, Giấy In Nhãn (Dạng Cuộn, Tờ,.)__Mực In Mã Vạch__Bao Bì - Nhà Sản Xuất và Kinh Doanh__May Mặc - Nguyên, Phụ Liệu May Mặc",www.tuinilonabm.bizz.vn,'0703523914__02513600606',Mr. Huấn,,male,Phụ Trách Kinh Doanh,salesnp165@gmail.com,https://www.yellowpages.vn/lgs/1187833422/bao-bi-nhua-abm-cong-ty-tnhh-phu-lieu-abm.html
Chi nhánh Thái Bình - Công Ty Cổ Phần Thương Mại Và Công Nghệ Minh Phát,"Tỉnh Thái Bình,","áo Mưa Quảng Cáo, áo Mưa Quà Tặng - Sản Xuất Và Bán Buôn__Vải áo Mưa, Ô Dù, Bạt,.( Vải Dù, Vải Nhựa, PVC, PE, PEVA,.)__Túi Nilon PE, Túi PP, Túi HDPE,.__Bao Bì PE, PP, HDPE, LDPE (Dạng Tấm, Cuộn, Túi)__Túi OPP__Bao Bì May Mặc",www.baobiminhphathd.com,'0974111252__0976825223__0987064333',Mr. Nguyễn Viết Nền,,male,,minhphatjsc.vn@gmail.com,https://www.yellowpages.vn/lgs/1187869800/chi-nhanh-thai-binh-cong-ty-co-phan-thuong-mai-va-cong-nghe-minh-phat.html
Chi nhánh Hải Dương - Công Ty Cổ Phần Thương Mại Và Công Nghệ Minh Phát,"Lô Số 3, Km 10, Quốc Lộ 392, X. Nhân Quyền, H. Bình Giang,","áo Mưa Quảng Cáo, áo Mưa Quà Tặng - Sản Xuất Và Bán Buôn__Vải áo Mưa, Ô Dù, Bạt,.( Vải Dù, Vải Nhựa, PVC, PE, PEVA,.)__Túi Nilon PE, Túi PP, Túi HDPE,.__Bao Bì PE, PP, HDPE, LDPE (Dạng Tấm, Cuộn, Túi)__Túi OPP__Bao Bì May Mặc",www.baobiminhphathd.com,'0974111252__0976825223__0987064333',Mr. Nguyễn Viết Nền,,male,,minhphatjsc.vn@gmail.com,https://www.yellowpages.vn/lgs/1187867979/chi-nhanh-hai-duong-cong-ty-co-phan-thuong-mai-va-cong-nghe-minh-phat.html
Bao Bì Nhựa Vina Xuma Plastic - Công Ty TNHH Vina Xuma Plastic,"Thôn Đoàn Kết, X. Đại Thắng, H. Vụ Bản,","In Túi Nilon, In Túi Xốp__Túi Nilon PE, Túi PP, Túi HDPE,.__Bao Bì PE, PP, HDPE, LDPE (Dạng Tấm, Cuộn, Túi)__Bao Bì Nhựa__Túi, Bao Zipper, Ziplock__Bao Bì May Mặc",www.vinaxuma.com,'0945199192__0979250240',Mr. Mạnh,X,male,Hotline,,https://www.yellowpages.vn/lgs/1187913063/bao-bi-nhua-vina-xuma-plastic-cong-ty-tnhh-vina-xuma-plastic.html
Bao Bì Dương Gia Việt Nam - Công Ty Cổ Phần Đầu Tư Và Phát Triển Dương Gia Việt Nam,"Số 11, Ngách 56, Ngõ 61, Phố Trạm, Tổ 12, Phường Long Biên, Quận Long Biên,","Bao Bì Màng Ghép, Bao Bì Màng Phức Hợp__Túi Nilon PE, Túi PP, Túi HDPE,.__Bao Bì PE, PP, HDPE, LDPE (Dạng Tấm, Cuộn, Túi)__Dây Rút Nhựa, Dây Thít Nhựa__Màng PE, Màng Chít - Nhà Sản Xuất__May Mặc - Nguyên, Phụ Liệu May Mặc",www.duonggiavnjsc.com,'02432007334__0936114539__0912462658',Hotline,X,,,duonggiavnjsc@gmail.com,https://www.yellowpages.vn/lgs/1187924895/bao-bi-duong-gia-viet-nam-cong-ty-co-phan-dau-tu-va-phat-trien-duong-gia-viet-nam.html
Bao Bì Bình Minh - Công Ty TNHH SX TM DV Bao Bì Bình Minh,"A19 Phan Huy Ích, P. 15, Q. Tân Bình,","Túi PE Khổ Lớn__Túi Phân Hủy Sinh Học__Bao Bì Đồ Điện Tử__Túi Nilon PE, Túi PP, Túi HDPE,.__Bao Bì PE, PP, HDPE, LDPE (Dạng Tấm, Cuộn, Túi)__Bao Bì May Mặc__Túi Đựng Thực Phẩm, Túi Cuộn Đựng Thực Phẩm",www.baobibinhminh.bizz.vn__www.binhminhpackaging.com,'02838153585__0934040899__0834553987',Ms. Lê Hà,,female,,Habinhminh052016@gmail.com,https://www.yellowpages.vn/lgs/1187855919/bao-bi-binh-minh-cong-ty-tnhh-sx-tm-dv-bao-bi-binh-minh.html
Bao Bì Tín Phát - Công Ty CP Đầu Tư Phát Triển Tín Phát,"Lô Số 6, KM 10, QL. 392, X. Nhân Quyền, H. Bình Giang,","Túi OPP__Màng Phủ Nông Nghiệp, Ngư Nghiệp__Bao Bì May Mặc__Bao Bì PE, PP, HDPE, LDPE (Dạng Tấm, Cuộn, Túi)",www.baobitinphat.bizz.vn,'0329033386',Mr. Nam,,male,,nambui.nhuavn@gmail.com,https://www.yellowpages.vn/lgs/1187928213/bao-bi-tin-phat-cong-ty-cp-dau-tu-phat-trien-tin-phat.html
Bao Bì Nhựa Nhân Hằng - Công Ty TNHH Nhân Hằng,"Cụm Công Nghiệp Ba Hàng, X. Nam Đồng, TP. Hải Dương,","Bao Bì Đồ Điện Tử__Màng PVC, PET, PP, PS, HIPS__Túi Nilon PE, Túi PP, Túi HDPE,.__Bao Bì PE, PP, HDPE, LDPE (Dạng Tấm, Cuộn, Túi)__Bao Bì Nhựa__Bao Bì Nhựa Định Hình, Khay Nhựa Định Hình__Bao Bì Thực Phẩm",www.baobinhanhang.bizz.vn__www.baobinhanhang.znn.vn,'02203751229',Ms Xuân Hằng,,female,Thường trực văn phòng,nhanhang.plastic@gmail.com,https://www.yellowpages.vn/lgs/1187690127/bao-bi-nhua-nhan-hang-cong-ty-tnhh-nhan-hang.html
Bao Bì Tân Trung Nghĩa - Công Ty TNHH Tân Trung Nghĩa,"Tổ 13, Khu Phố Tân Lập, Phường Phước Tân , TP.Biên Hoà","Giấy Công Nghiệp (Giấy Ivory, Bristol, Couche,..)__Giấy Ngành May Mặc, Da Giày__Túi Nilon PE, Túi PP, Túi HDPE,.__Bao Bì PE, PP, HDPE, LDPE (Dạng Tấm, Cuộn, Túi)__Bao Bì Nhựa__Giấy Sơ Đồ__Túi OPP__Giấy Kraft, Giấy Bao Bì (Giấy Xeo, Xi Măng, Carton,.)__Màng PE, Màng Chít - Nhà Sản Xuất__Giấy Duplex",www.tantrungnghia.vn,'02513893660__0906139139',Ông Vũ Văn Trung,,male,Giám Đốc,vutrungttn@gmail.com,https://www.yellowpages.vn/lgs/1097526/bao-bi-tan-trung-nghia-cong-ty-tnhh-tan-trung-nghia.html
Vật Liệu Đóng Gói Sao Đỏ Việt Nam - Công Ty TNHH Sản Xuất Và Xuất Nhập Khẩu Sao Đỏ Việt Nam,"Xóm 1, Thôn Lạc Nhuế, Xã Đồng Hóa, Huyện Kim Bảng,","Băng Keo OPP (Trong, Đục và Màu), Băng Keo Dán Thùng__Túi PE Khổ Lớn__Dây Đai Nhựa__Vật Liệu Đóng Gói__Băng Keo, Băng Dính__Băng Keo Bảo Vệ Bề Mặt, Màng Bảo Vệ Bề Mặt__Túi Nilon PE, Túi PP, Túi HDPE,.__Bao Bì PE, PP, HDPE, LDPE (Dạng Tấm, Cuộn, Túi)__Dây Rút Nhựa, Dây Thít Nhựa__Màng PE Quấn Pallet__Túi, Bao Zipper, Ziplock__Màng PE, Màng Chít - Nhà Sản Xuất__Băng Keo Phủ Bề Mặt (kính, mica..)",www.chausonplastic.com.vn,'0917925175__0947750752__0947750753',Mr. Đào Khả Tuyên,,male,Giám Đốc,bangkeotamduc@gmail.com,https://www.yellowpages.vn/lgs/1187842932/vat-lieu-dong-goi-sao-do-viet-nam-cong-ty-tnhh-san-xuat-va-xuat-nhap-khau-sao-do-viet-nam.html
Bao Bì Nhựa Thiện Nhân - Công Ty TNHH Sản Xuất Bao Bì Nhựa Thiện Nhân," 24/ 5C Đường Thới Tam Thôn 14, Ấp Tam Đông , X. Thới Tam Thôn, H. Hóc Môn,","Túi PE Khổ Lớn__Bao Bì Màng Ghép, Bao Bì Màng Phức Hợp__Túi Phân Hủy Sinh Học__In Bao Bì Nhựa, In Màng Co, Màng Ghép, In ống Đồng__Túi Nilon PE, Túi PP, Túi HDPE,.__Bao Bì PE, PP, HDPE, LDPE (Dạng Tấm, Cuộn, Túi)__Bao Bì Nhựa",www.baobithiennhan.bizz.vn__www.baobithiennhan.com.vn,'02836209272__0944139139',Mr. Nguyễn Quang Vinh,,male,,baobithiennhan@gmail.com,https://www.yellowpages.vn/lgs/1187831241/bao-bi-nhua-thien-nhan-cong-ty-tnhh-san-xuat-bao-bi-nhua-thien-nhan.html
Bao Bì Nhựa - Công Ty TNHH HAB Việt Nam,"Thôn Kim Âu, Xã Đặng Xá, H. Gia Lâm,","Pallet Gỗ - Sản Xuất Và Cung Cấp__Bao Bì PE, PP, HDPE, LDPE (Dạng Tấm, Cuộn, Túi)__Bao Bì Nhựa__Hạt Chống ẩm, Túi Chống ẩm__Túi, Bao Zipper, Ziplock__Màng PE, Màng Chít - Nhà Sản Xuất__Hạt Nhựa, Hạt Nhựa Nguyên Sinh",www.baobinilon.com,'0982023808__02436789470',Ông Hoàng Xuân Nam,,male,,baobinilon@gmail.com,https://www.yellowpages.vn/lgs/1187772849/bao-bi-nhua-cong-ty-tnhh-hab-viet-nam.html
Công Ty Cổ Phần Giải Pháp Đóng Gói Hoàng Gia,"Số 34, Đường Nguyễn Chí Thanh, P. Ngọc Khánh, Q. Ba Đình,","Băng Keo OPP (Trong, Đục và Màu), Băng Keo Dán Thùng__Băng Keo Giấy, Băng Dính Giấy__Băng Keo, Băng Dính__Dây Đai Niềng Thùng__Màng PE Quấn Pallet__Hạt Chống ẩm, Túi Chống ẩm__Giấy Duplex__Dây Đai Nhựa__Bao Bì Màng Ghép, Bao Bì Màng Phức Hợp__Vật Liệu Đóng Gói__Băng Dính Dán Nền, Băng Keo Cảnh Báo__Túi Nilon PE, Túi PP, Túi HDPE,.__Băng Keo Sợi Thuỷ Tinh, Băng Keo Cường Lực (filament)__Băng Keo Vải, Băng Dính Vải__Thùng Carton, Thùng Giấy__Giấy Pelure (Giấy Chống ẩm, Giấy Hút ẩm)__Bao Bì PE, PP, HDPE, LDPE (Dạng Tấm, Cuộn, Túi)__Băng Dính Điện, Băng Dính Cách Điện__Màng PE, Màng Chít - Nhà Sản Xuất",www.hoanggiaps.com,'02439189888__0984253666',Ông Võ Phúc Đại,,male,P. Kinh doanh,sales6@hoanggiaps.com,https://www.yellowpages.vn/lgs/1187767626/cong-ty-co-phan-giai-phap-dong-goi-hoang-gia.html
Bao Bì Tân Ngọc Phát - Công Ty Cổ Phần Bao Bì Tân Ngọc Phát,"Số 87 Đường Võ Văn Bích, Xã Tân Thạnh Đông, Huyện Củ Chi,","Màng Phủ Nông Nghiệp, Ngư Nghiệp__Túi Nilon PE, Túi PP, Túi HDPE,.__Bao Bì PE, PP, HDPE, LDPE (Dạng Tấm, Cuộn, Túi)__Bao Bì Nhựa__Túi, Bao Zipper, Ziplock__Màng PE, Màng Chít - Nhà Sản Xuất__Túi Đựng Rác (Túi Đựng Rác y Tế, Công Nghiệp, Màu Đen, Dạng Cuộn)",www.tanngocphat.com,'02822277288',Hotline,X,,,baobinhuatanngocphat@yahoo.com.vn,https://www.yellowpages.vn/lgs/1187760969/bao-bi-tan-ngoc-phat-cong-ty-co-phan-bao-bi-tan-ngoc-phat.html
Bao Bì Minh Nhựt - Công Ty TNHH Bao Bì Minh Nhựt,"268/8 Nguyễn Thái Bình, P. 12, Q. Tân Bình, TPHCM","Túi OPP__Túi Nhựa PVC__Bao Bì May Mặc__Bao Bì PE, PP, HDPE, LDPE (Dạng Tấm, Cuộn, Túi)",www.baobimaymac.com,'0903784871__02838117357',Ông Nguyễn Thiện Mỹ,,male,,nguyenthienmy79@yahoo.com.vn,https://www.yellowpages.vn/lgs/1187724024/bao-bi-minh-nhut-cong-ty-tnhh-bao-bi-minh-nhut.html
Bao Bì Nilon Mai Lệ Văn - Công Ty TNHH Mai Lệ Văn,"615 Quốc Lộ 1A, KP. 4, P. Bình Hưng Hòa, Q. Bình Tân,","Màng Phủ Nông Nghiệp, Ngư Nghiệp__In Bao Bì Nhựa, In Màng Co, Màng Ghép, In ống Đồng__Túi Nilon PE, Túi PP, Túi HDPE,.__Bao Bì PE, PP, HDPE, LDPE (Dạng Tấm, Cuộn, Túi)__Găng Tay Nilon, Găng Tay Xốp - Sản Xuất và Kinh Doanh__Túi Đựng Rác (Túi Đựng Rác y Tế, Công Nghiệp, Màu Đen, Dạng Cuộn)",,'0908246382__02822137768',Mr. Văn,,male,Phòng Kinh Doanh,mlv.co2006@yahoo.com.vn,https://www.yellowpages.vn/lgs/968100/bao-bi-nilon-mai-le-van-cong-ty-tnhh-mai-le-van.html
Túi Sinh Học Minh Sang - Công Ty TNHH Sản Xuất - Thương Mại Minh Sang,"82 Đường 102 Cao Lỗ , Phường 4, Quận 8,","Túi Phân Hủy Sinh Học__Bao Bì PE, PP, HDPE, LDPE (Dạng Tấm, Cuộn, Túi)__Túi OPP__Túi, Bao Zipper, Ziplock__Bao Bì May Mặc",www.­www.baobiminhsang.com,'0909480733__0918670321__02839832290__0906773970',Ms. Trang,,female,,sale@baobiminhsang.com,https://www.yellowpages.vn/lgs/119358474/tui-sinh-hoc-minh-sang-cong-ty-tnhh-san-xuat-thuong-mai-minh-sang.html
Bao Bì Bảo Uyên - Công Ty TNHH MTV Bảo Uyên,"10/45 Khu Phố 3, P. Tam Hòa, TP. Biên Hòa,","Thùng Carton, Thùng Giấy__Vật Liệu Đóng Gói__Dây Đai Nhựa__Băng Keo, Băng Dính__Túi Nilon PE, Túi PP, Túi HDPE,.__Bao Bì PE, PP, HDPE, LDPE (Dạng Tấm, Cuộn, Túi)__Bao Bì Nhựa__Thùng Bế, Hộp Bế__Bao Bì May Mặc__Bao Bì Xuất Khẩu__Màng PE, Màng Chít - Nhà Sản Xuất__Bao Bì - Nhà Sản Xuất và Kinh Doanh",www.baobibaouyen.com.vn,'02518823259__0937001901',Ông Mai Văn Điệp,,male,Trưởng Phòng Kinh Doanh,baouyen291209@gmail.com,https://www.yellowpages.vn/lgs/1187681796/bao-bi-bao-uyen-cong-ty-tnhh-mtv-bao-uyen.html
Bao Bì Kim Long - Công Ty TNHH Sản Xuất Thương Mại Bao Bì Kim Long,"239/58 Khuông Việt, P. Phú Trung, Q. Tân Phú,","In Túi Nilon, In Túi Xốp__Băng Keo, Băng Dính__Túi Nilon PE, Túi PP, Túi HDPE,.__Bao Bì PE, PP, HDPE, LDPE (Dạng Tấm, Cuộn, Túi)__Túi, Bao Zipper, Ziplock__Màng PE, Màng Chít - Nhà Sản Xuất__Túi Đựng Rác (Túi Đựng Rác y Tế, Công Nghiệp, Màu Đen, Dạng Cuộn)",www.baobikimlong.com,'0903907868__02838615757',Ms. Hà Phương,,female,NV Kinh Doanh,baobikimlong@yahoo.com.vn,https://www.yellowpages.vn/lgs/1039437/bao-bi-kim-long-cong-ty-tnhh-san-xuat-thuong-mai-bao-bi-kim-long.html
In Bao Bì 3T - Công Ty TNHH Bao Bì 3T,"281 Bình Long, P. Bình Hưng Hòa A, Q. Bình Tân,","Bao Bì Nông Nghiệp__Màng PVC, PET, PP, PS, HIPS__In Bao Bì Nhựa, In Màng Co, Màng Ghép, In ống Đồng__Bao Bì PE, PP, HDPE, LDPE (Dạng Tấm, Cuộn, Túi)__Bao Bì Thực Phẩm__In Bao Bì - Công Ty Thiết Kế và In ấn Bao Bì",www.baobitantritrung.bizz.vn,'0938296199',Ông Nguyễn Văn Trí,,male,Giám Đốc,congtybaobi3t@gmail.com,https://www.yellowpages.vn/lgs/1187718591/in-bao-bi-3t-cong-ty-tnhh-bao-bi-3t.html
Bao Bì TL Polymer - Công Ty TNHH Bao Bì TL Polymer,"Số 685/92, Tổ 25B, KP4, P. Bửu Long, TP. Biên Hòa,","Băng Keo, Băng Dính__Bao Bì PE, PP, HDPE, LDPE (Dạng Tấm, Cuộn, Túi)__Màng PE Foam (Cuộn, Tấm, Túi, ống,.) - Sản Xuất Và Kinh Doanh__Màng PE Quấn Pallet__Màng PE, Màng Chít - Nhà Sản Xuất__Bao Bì Carton",www.baobitlpolymer.com,'0365695113__0985356694',Hotline,X,,,tlpolymer2019@gmail.com,https://www.yellowpages.vn/lgs/1187892765/bao-bi-tl-polymer-cong-ty-tnhh-bao-bi-tl-polymer.html
Bao Bì  Quốc Anh - Công Ty TNHH Thương Mại Và Bao Bì  Quốc Anh,"Số 12, Ngõ 66, Phố Nghĩa Dũng, P. Phúc Xá, Q. Ba Đình,","Bao Bì Màng Ghép, Bao Bì Màng Phức Hợp__Bao Giấy Kraft__Bao Bì PE, PP, HDPE, LDPE (Dạng Tấm, Cuộn, Túi)__Bao Bì Giấy__Bao Bì Nhựa__Bao Bì - Nhà Sản Xuất và Kinh Doanh__In ấn - Công ty In ấn Và Thiết Kế (In Offset, In Flexo)",www.quocanhprint.vn__www.quocanhprint.bizz.vn,'02436444187__0969668118__02213727986__0936437386',Mr. Quốc Anh,,male,Kinh Doanh,qaprint@gmail.com,https://www.yellowpages.vn/lgs/1187723832/bao-bi--quoc-anh-cong-ty-tnhh-thuong-mai-va-bao-bi--quoc-anh.html
Bao Bì Tâm Thành - Công Ty Cổ Phần Công Nghiệp Tâm Thành," Đường Cổ Loa, Xóm Bãi Uy Nỗ, H. Đông Anh, Hà Nội","Bao Bì Màng Ghép, Bao Bì Màng Phức Hợp__In Bao Bì - Công Ty Thiết Kế và In ấn Bao Bì__Túi Nilon PE, Túi PP, Túi HDPE,.__Bao Bì PE, PP, HDPE, LDPE (Dạng Tấm, Cuộn, Túi)__Bao Bì Nhựa__Túi, Bao Zipper, Ziplock__Bao Bì May Mặc__Bao Bì Thực Phẩm__Túi Đựng Rác (Túi Đựng Rác y Tế, Công Nghiệp, Màu Đen, Dạng Cuộn)__Bao Container, Bao Jumbo, Bao Bigbag",www.tamthanh.com.vn,'0904592386',Hotline,X,,,tamthanhbaobi@gmail.com,https://www.yellowpages.vn/lgs/1187783826/bao-bi-tam-thanh-cong-ty-co-phan-cong-nghiep-tam-thanh.html
Túi Sinh Học Minh Sang - Công Ty TNHH Sản Xuất - Thương Mại Minh Sang,"82 Đường 102 Cao Lỗ , Phường 4, Quận 8,","Túi Phân Hủy Sinh Học__Bao Bì PE, PP, HDPE, LDPE (Dạng Tấm, Cuộn, Túi)__Túi OPP__Túi, Bao Zipper, Ziplock__Bao Bì May Mặc",www.­www.baobiminhsang.com,'0909480733__0918670321__02839832290__0906773970',Ms. Trang,,female,,sale@baobiminhsang.com,https://www.yellowpages.vn/lgs/119358474/tui-sinh-hoc-minh-sang-cong-ty-tnhh-san-xuat-thuong-mai-minh-sang.html
