company,address,industry,website,phone,contact_person,is_hotline,gender,position,email,url
Công Ty TNHH Thiên Hà Long,"59 Đường Số 22, P. Bình Hưng Hòa, Q. Bình Tân,","Túi Nilon PE, Túi PP, Túi HDPE,.__Bao Bì Nhựa__Túi OPP__Bao Bì May Mặc__Bao Bì Thực Phẩm",www.thienhalong.bizz.vn__www.thienhalong.znn.vn,'0978447477__0985590918',Mr. Nguyễn Anh Tuấn,,male,Giám Đốc,thienhalong09@yahoo.com.vn,https://www.yellowpages.vn/lgs/1187722923/cong-ty-tnhh-thien-ha-long.html
Vải Bách Đạt Việt Nam -  Công Ty TNHH Bách Đạt Việt Nam,"Lô A29, Đường Số 5, CCN Phường Uyên Hưng, TX. Tân Uyên,","Vải Lót (Vải Lót Túi, Túi Xách, áo Gió,.)__Quần áo Phòng Sạch, Quần áo Kháng Khuẩn__Vải Không Dệt__Vải Lưới Tricot (Vải Phụ Liệu May Mặc)__Bao Bì May Mặc__May Mặc - Nguyên, Phụ Liệu May Mặc",www.bachdatvietnam.bizz.vn__www.bachdatvietnam.com,'0353129669__02743800820',Bà Lê Thị Lan,,female,P. Giám đốc,betamex@163.com,https://www.yellowpages.vn/lgs/1187753967/vai-bach-dat-viet-nam--cong-ty-tnhh-bach-dat-viet-nam.html
Chi nhánh Bắc Ninh - Công Ty Cổ Phần Thương Mại Và Công Nghệ Minh Phát,"Bắc Ninh,","áo Mưa Quảng Cáo, áo Mưa Quà Tặng - Sản Xuất Và Bán Buôn__Vải áo Mưa, Ô Dù, Bạt,.( Vải Dù, Vải Nhựa, PVC, PE, PEVA,.)__Túi Nilon PE, Túi PP, Túi HDPE,.__Bao Bì PE, PP, HDPE, LDPE (Dạng Tấm, Cuộn, Túi)__Túi OPP__Bao Bì May Mặc",www.baobiminhphathd.com,'0974111252__0976825223__0987064333',Mr. Nguyễn Viết Nền,,male,,minhphatjsc.vn@gmail.com,https://www.yellowpages.vn/lgs/1187900895/chi-nhanh-bac-ninh-cong-ty-co-phan-thuong-mai-va-cong-nghe-minh-phat.html
Chi nhánh Hà Nam - Công Ty Cổ Phần Thương Mại Và Công Nghệ Minh Phát,"Tỉnh Hà Nam,","áo Mưa Quảng Cáo, áo Mưa Quà Tặng - Sản Xuất Và Bán Buôn__Vải áo Mưa, Ô Dù, Bạt,.( Vải Dù, Vải Nhựa, PVC, PE, PEVA,.)__Túi Nilon PE, Túi PP, Túi HDPE,.__Bao Bì PE, PP, HDPE, LDPE (Dạng Tấm, Cuộn, Túi)__Túi OPP__Bao Bì May Mặc",www.baobiminhphathd.com,'0974111252__0976825223__0987064333',Mr. Nguyễn Viết Nền,,male,,minhphatjsc.vn@gmail.com,https://www.yellowpages.vn/lgs/1187869806/chi-nhanh-ha-nam-cong-ty-co-phan-thuong-mai-va-cong-nghe-minh-phat.html
Bao Bì Tâm Thành - Công Ty Cổ Phần Công Nghiệp Tâm Thành," Đường Cổ Loa, Xóm Bãi Uy Nỗ, H. Đông Anh, Hà Nội","Bao Bì Màng Ghép, Bao Bì Màng Phức Hợp__In Bao Bì - Công Ty Thiết Kế và In ấn Bao Bì__Túi Nilon PE, Túi PP, Túi HDPE,.__Bao Bì PE, PP, HDPE, LDPE (Dạng Tấm, Cuộn, Túi)__Bao Bì Nhựa__Túi, Bao Zipper, Ziplock__Bao Bì May Mặc__Bao Bì Thực Phẩm__Túi Đựng Rác (Túi Đựng Rác y Tế, Công Nghiệp, Màu Đen, Dạng Cuộn)__Bao Container, Bao Jumbo, Bao Bigbag",www.tamthanh.com.vn,'0904592386',Hotline,X,,,tamthanhbaobi@gmail.com,https://www.yellowpages.vn/lgs/1187783826/bao-bi-tam-thanh-cong-ty-co-phan-cong-nghiep-tam-thanh.html
Công Ty TNHH Sản Xuất Thương Mại In ấn Bao Bì Hải Âu,"879/38 Hương Lộ 2, KP. 8, P. Bình Trị Đông A, Q. Bình Tân,","Bao Bì Màng Ghép, Bao Bì Màng Phức Hợp__In Túi Nilon, In Túi Xốp__In Bao Bì Nhựa, In Màng Co, Màng Ghép, In ống Đồng__Túi Nilon PE, Túi PP, Túi HDPE,.__Bao Bì Nhựa__Bao Bì May Mặc__Bao Bì Thực Phẩm",www.inbaobihaiau.com__www.baobihaiau.com,'0908706653__0283620556',Mr. Trí,,male,,baobihaiau@gmail.com,https://www.yellowpages.vn/lgs/1187798568/cong-ty-tnhh-san-xuat-thuong-mai-in-an-bao-bi-hai-au.html
Chi nhánh Thái Bình - Công Ty Cổ Phần Thương Mại Và Công Nghệ Minh Phát,"Tỉnh Thái Bình,","áo Mưa Quảng Cáo, áo Mưa Quà Tặng - Sản Xuất Và Bán Buôn__Vải áo Mưa, Ô Dù, Bạt,.( Vải Dù, Vải Nhựa, PVC, PE, PEVA,.)__Túi Nilon PE, Túi PP, Túi HDPE,.__Bao Bì PE, PP, HDPE, LDPE (Dạng Tấm, Cuộn, Túi)__Túi OPP__Bao Bì May Mặc",www.baobiminhphathd.com,'0974111252__0976825223__0987064333',Mr. Nguyễn Viết Nền,,male,,minhphatjsc.vn@gmail.com,https://www.yellowpages.vn/lgs/1187869800/chi-nhanh-thai-binh-cong-ty-co-phan-thuong-mai-va-cong-nghe-minh-phat.html
Bao Bì Hoàng Đăng - Công Ty TNHH SX TM DV Xuất Nhập Khẩu Bao Bì Hoàng Đăng,"166/1/9G1 Lưu Hữu Phước, P. 15, Q. 8,","Màng Co PE, LDPE, PVC, POF,.__Bao Bì Thực Phẩm__Bao Bì May Mặc__Bao Bì Nhựa",www.baobihoangdang.com,'02837580694__0909169222',Ông Nguyễn Duy Linh,,male,Giám Đốc,,https://www.yellowpages.vn/lgs/1187704563/bao-bi-hoang-dang-cong-ty-tnhh-sx-tm-dv-xuat-nhap-khau-bao-bi-hoang-dang.html
Bao Bì Hòa Phát - Công Ty TNHH Sản Xuất - Thương Mại Bao Bì Hòa Phát,"66 Trần Thủ Độ, P. Phú Thạnh, Q. Tân Phú,","Thùng Carton, Thùng Giấy__Bao Bì May Mặc__Bao Bì Nhựa",,'0909576589__02838611808',Mr. Phong,,male,Nhân viên,hoaphatbaobi@gmail.com,https://www.yellowpages.vn/lgs/1187782089/bao-bi-hoa-phat-cong-ty-tnhh-san-xuat-thuong-mai-bao-bi-hoa-phat.html
Chi Nhánh Long An - Công Ty TNHH Sản Xuất Thương Mại In ấn Bao Bì Hải Âu,"265-284, Ấp Chánh, Xã Long Hiệp, Huyện Bến Lức,","Bao Bì Màng Ghép, Bao Bì Màng Phức Hợp__In Túi Nilon, In Túi Xốp__In Bao Bì Nhựa, In Màng Co, Màng Ghép, In ống Đồng__Túi Nilon PE, Túi PP, Túi HDPE,.__Bao Bì Nhựa__Bao Bì May Mặc__Bao Bì Thực Phẩm",www.inbaobihaiau.com__www.baobihaiau.com,'0933323395__0949022809',Mr. Trí,,male,,votrithuc4321@gmail.com,https://www.yellowpages.vn/lgs/1187847384/chi-nhanh-long-an-cong-ty-tnhh-san-xuat-thuong-mai-in-an-bao-bi-hai-au.html
Công Ty CP SX TM DV Quang Anh,"Tầng 1, Ô đất BT4A, P. Phúc Lợi, Q. Long Biên,","Túi OPP__Túi Nilon PE, Túi PP, Túi HDPE,.__Bao Bì May Mặc__Bao Bì Nhựa",www.quanganhjsc.com,'0983211219__0963008315',Ms. Suốt,X,female,Hotline,suot.quanganhjsc@gmail.com,https://www.yellowpages.vn/lgs/1187928384/cong-ty-cp-sx-tm-dv-quang-anh.html
Bao Bì Tuấn  Ngọc - Công Ty TNHH Đầu Tư Thương Mại Và Sản Xuất Bao Bì Tuấn Ngọc,"Số 85, Phố Nguyễn Thái Học, P. Văn Miếu, Q. Đống Đa,","Túi Nilon PE, Túi PP, Túi HDPE,.__Túi OPP__Găng Tay Nilon, Găng Tay Xốp - Sản Xuất và Kinh Doanh__Bao Bì May Mặc__Màng PE, Màng Chít - Nhà Sản Xuất__Hạt Nhựa, Hạt Nhựa Nguyên Sinh",www.tuanngoc.vn,'02437474996',Hotline,X,,,tuanngocsale@gmail.com,https://www.yellowpages.vn/lgs/1187715267/bao-bi-tuan--ngoc-cong-ty-tnhh-dau-tu-thuong-mai-va-san-xuat-bao-bi-tuan-ngoc.html
Nguyên Phụ Liệu May Mặc Hà Thanh Bắc - Công Ty TNHH Thương Mại Hà Thanh Bắc,"D 3-1 Cụm Làng Nghề Triều Khúc, X. Tân Triều, H. Thanh Trì,","Đệm Vai, Đệm Ngực__Mex, Keo, Dựng (Giấy, Vải)__Bao Bì May Mặc__Chỉ May và Chỉ Thêu__Dây Khoá Kéo, Đầu Khóa Kéo - Sản Xuất và Bán Buôn__Khuy, Nút, Cúc (Kim Loại, Nhựa, Gỗ) - Sản Xuất và Bán Buôn__Phụ Liệu May Mặc Nhựa (Dây Nhựa, Khóa Nhựa, Khoen Nhựa,.)__Phụ Liệu Đóng Gói May Mặc - Sản Xuất Và Cung Cấp__May Mặc - Nguyên, Phụ Liệu May Mặc",www.phulieumayvn.com__www.phulieumayhtb.com,'0943398787__0932588868__0979923179',Ông Nguyễn Nam,,male,,nam.nxuan@gmail.com,https://www.yellowpages.vn/lgs/1187754222/nguyen-phu-lieu-may-mac-ha-thanh-bac-cong-ty-tnhh-thuong-mai-ha-thanh-bac.html
Bao Bì Giấy Nam Anh - Công Ty TNHH Bao Bì Công Nghiệp Nam Anh,"Lô CN1, KCN Vừa Và Nhỏ Nguyên Khê, X. Nguyên Khê, H. Đông Anh,","Bao Bì Giấy__Túi Giấy, Túi Giấy Kraft__Bao Bì May Mặc__Bao Bì Thực Phẩm__Bao Bì - Nhà Sản Xuất và Kinh Doanh",,'0936122993__0913192968',Mr. Nguyễn Viết Tuấn,,male,P. Giám Đốc,Tuan007883@gmail.com,https://www.yellowpages.vn/lgs/1187909007/bao-bi-giay-nam-anh-cong-ty-tnhh-bao-bi-cong-nghiep-nam-anh.html
Bao Bì Mực In Việt Nam - Công Ty TNHH Bao Bì Mực In Việt Nam,"TĐS 441, TBĐ số 30, KP. Bình Khánh, P. Khánh Bình, TX. Tân Uyên,","Bao Bì Màng Ghép, Bao Bì Màng Phức Hợp__Bao Bì Nông Nghiệp__Bao Bì PE, PP, HDPE, LDPE (Dạng Tấm, Cuộn, Túi)__Bao Bì May Mặc__Bao Bì - Nhà Sản Xuất và Kinh Doanh",www.vinapackink.com.vn,'02743686750__0903801330',Mr. Triết,,male,,trietleminh9@gmail.com,https://www.yellowpages.vn/lgs/1230015/bao-bi-muc-in-viet-nam-cong-ty-tnhh-bao-bi-muc-in-viet-nam.html
Bao Bì Ngọc Thanh Phước - Công Ty TNHH Bao Bì Ngọc Thanh Phước,"Lô 1 - 11 Khu Công Nghiệp Hố Nai, X. Hố Nai 3 , H. Trảng Bom,","Màng Phủ Nông Nghiệp, Ngư Nghiệp__Túi Nilon PE, Túi PP, Túi HDPE,.__Bao Bì PE, PP, HDPE, LDPE (Dạng Tấm, Cuộn, Túi)__Túi, Bao Zipper, Ziplock__Bao Bì May Mặc__Túi Đựng Rác (Túi Đựng Rác y Tế, Công Nghiệp, Màu Đen, Dạng Cuộn)",www.nhuangocthanhphuoc.com,'0918599979',Hotline,X,,,sales@nhuangocthanhphuoc.com,https://www.yellowpages.vn/lgs/1187768514/bao-bi-ngoc-thanh-phuoc-cong-ty-tnhh-bao-bi-ngoc-thanh-phuoc.html
Bao Bì Nhất Lợi - Công Ty TNHH Sản Xuất-Thương Mại Nhất Lợi,"635 Hồng Bàng, P. 6, Q. 6,",Bao Bì Giấy__Bao Bì May Mặc__Nhựa - Các Công Ty Nhựa__Bao Bì - Nhà Sản Xuất và Kinh Doanh__Bao Bì Carton,www.nhatloi.com,'0903836212__02839605972',Ông Đặng Hữu Thành,,male,,thanh@nhatloi.vn,https://www.yellowpages.vn/lgs/692364/bao-bi-nhat-loi-cong-ty-tnhh-san-xuat-thuong-mai-nhat-loi.html
Nhãn Vàng - Công Ty Thiết Kế - In - Sản Xuất Bao Bì Nhãn Vàng,"22/1 Đường số 41, P. Hiệp Bình Chánh, Q. Thủ Đức,",In Bao Bì - Công Ty Thiết Kế và In ấn Bao Bì__Bao Bì - Nhà Sản Xuất và Kinh Doanh__Bao Bì May Mặc,www.nhanvang.vn,'0903003456__02837266487',Hotline,X,,,,https://www.yellowpages.vn/lgs/1054353/nhan-vang-cong-ty-thiet-ke-in-san-xuat-bao-bi-nhan-vang.html
Công Ty TNHH Sản Xuất Thương Mại Bao Bì Huỳnh Gia Phát,"6/24 Phạm Qúy Thích, P. Tân Quý, Q. Tân Phú,",Bao Bì May Mặc,www.baobihuynhgiaphat.com,'02822497519',,,,,,https://www.yellowpages.vn/lgs/961380/cong-ty-tnhh-san-xuat-thuong-mai-bao-bi-huynh-gia-phat.html
Công Ty TNHH Da Nhựa TM,"Số 5/20 Thư Trung, Đằng Lâm, Q. Hải An,","Bạt Nhựa, Bạt Che Nắng, Bạt Che Mưa__Vải áo Mưa, Ô Dù, Bạt,.( Vải Dù, Vải Nhựa, PVC, PE, PEVA,.)__Bao Bì May Mặc__Da - Đồ Dùng Giả Da",,'0912489539__02253557845',Ông Nguyễn Quốc Thắng,,male,Giám Đốc,tmvaigiada@gmail.com,https://www.yellowpages.vn/lgs/119320785/cong-ty-tnhh-da-nhua-tm.html
Bao Bì Duy Khang - Công Ty TNHH Bao Bì Duy Khang,"Ấp Rừng Sến, X. Mỹ Hạnh Bắc, H. Đức Hòa,","Bao Bì Màng Ghép, Bao Bì Màng Phức Hợp__In Bao Bì Nhựa, In Màng Co, Màng Ghép, In ống Đồng__Bao Bì Nhựa__Màng BOPP__Bao Bì May Mặc__Bao Bì Thực Phẩm__In Bao Bì - Công Ty Thiết Kế và In ấn Bao Bì",www.baobiduykhang.com,'0916883743__0903121968',Hotline 24/7,,,,bbduykhang@gmail.com,https://www.yellowpages.vn/lgs/1187845707/bao-bi-duy-khang-cong-ty-tnhh-bao-bi-duy-khang.html
Công Ty TNHH SX Bao Bì Tân Long Vũ,"Số 537/10 Nguyễn Oanh, KP. 7, P. 17, Q. Gò Vấp,","Bao Bì Màng Ghép, Bao Bì Màng Phức Hợp__In Túi Nilon, In Túi Xốp__Túi Phân Hủy Sinh Học__Túi Nilon PE, Túi PP, Túi HDPE,.__Bao Bì PE, PP, HDPE, LDPE (Dạng Tấm, Cuộn, Túi)__Bao Bì Nhựa__Túi OPP__Túi, Bao Zipper, Ziplock__Bao Bì May Mặc__Bao Bì Thực Phẩm__Túi Đựng Rác (Túi Đựng Rác y Tế, Công Nghiệp, Màu Đen, Dạng Cuộn)",www.tanlongvu.com,'02822101457__0971714578',Hotline,X,,,baobitanlongvu@gmail.com,https://www.yellowpages.vn/lgs/1187842389/cong-ty-tnhh-sx-bao-bi-tan-long-vu.html
Công Ty TNHH Bao Bì Chung Gia,"2FL, LOT II, CN1, KCN Tân Bình, P. Tây Thạnh, Q. Tân Phú,","In Tem Nhãn, Nhãn Mác, Label__Bao Bì Nhựa__Bao Bì Giấy__Bao Bì May Mặc__In Bao Bì Giấy (In Túi Giấy, Thùng Giấy, Hộp Giấy)__In Bao Bì - Công Ty Thiết Kế và In ấn Bao Bì__Bao Bì - Nhà Sản Xuất và Kinh Doanh",www.quadpackaging.com,'02838160554__0944244166',Mr. Hà,,male,,,https://www.yellowpages.vn/lgs/1187752047/cong-ty-tnhh-bao-bi-chung-gia.html
Bao Bì Giấy Minh Đức - Công Ty TNHH Thương Mại Bao Bì Giấy Minh Đức,"Số 108A, Tam Tân, Ấp Bến Đò 2, X. Tân Phú Trung, H. Củ Chi,","Giấy Công Nghiệp (Giấy Ivory, Bristol, Couche,..)__Thùng Carton 7 Lớp__Thùng Carton, Thùng Giấy__Giấy Couche__Giấy Ngành May Mặc, Da Giày__Thùng Carton 5 Lớp__Bao Bì Giấy__Giấy Bìa, Giấy Bìa Cứng (Carton Nén, Carton Board, Giấy Dày,.)__Thùng Carton 3 Lớp__Bao Bì May Mặc__Giấy Kraft, Giấy Bao Bì (Giấy Xeo, Xi Măng, Carton,.)__Bao Bì Carton__Giấy Duplex",www.minhducpacking.bizz.vn,'0972618948__02837960301',Ông Lữ Kiều Hưng,,male,,duc287@vnn.vn,https://www.yellowpages.vn/lgs/1187685453/bao-bi-giay-minh-duc-cong-ty-tnhh-thuong-mai-bao-bi-giay-minh-duc.html
Thùng Carton Phạm Thu - Công Ty TNHH Sản Xuất Thương Mại Phạm Thu,"14/6 Tổ 6, Ấp Thới Tây 1, X. Tân Hiệp, H. Hóc Môn,","Thùng Carton, Thùng Giấy__Thùng Carton 7 Lớp__Bao Bì Dược Phẩm__Thùng Carton 5 Lớp__Thùng Carton 3 Lớp__Bao Bì May Mặc__Bao Bì Carton",www.baobiphamthu.bizz.vn,'02837100405__0903709599',Ông Nguyễn Phạm Thu,,male,,baobiphamthu@gmail.com,https://www.yellowpages.vn/lgs/712557/thung-carton-pham-thu-cong-ty-tnhh-san-xuat-thuong-mai-pham-thu.html
Công Ty TNHH Đầu Tư Dịch Vụ ấn Độ Dương,"Số 7 Ngõ 100 Tây Sơn, Q. Đống Đa,",Bao Bì Thực Phẩm__Bao Bì - Nhà Sản Xuất và Kinh Doanh__Bao Bì May Mặc__Bao Bì Carton,,'02462762031',,,,,,https://www.yellowpages.vn/lgs/1187693511/cong-ty-tnhh-dau-tu-dich-vu-an-do-duong.html
Công Ty TNHH Thương Mại & Dịch Vụ Gia Phú,"529/80 Huỳnh Văn Bánh, P. 14, Q. Phú Nhuận,",May Xuất Khẩu - Dịch Vụ Sản Xuất và Gia Công (Theo đơn đặt hàng)__Bao Bì May Mặc,,'02839905921__0906620632',Trần Phương Trang,,,TP Kinh doanh,trangtran3082503@yahoo.com.vn,https://www.yellowpages.vn/lgs/1187710044/cong-ty-tnhh-thuong-mai---dich-vu-gia-phu.html
Bao Bì Đại Thịnh Phát - Công Ty TNHH Bao Bì Đại Thịnh Phát,": 137 Lương Thế Vinh, P. Tân Thới Hòa, Q. Tân Phú,","Túi Nilon PE, Túi PP, Túi HDPE,.__Bao Bì Nhựa - Máy Móc Và Thiết Bị__Bao Bì Nhựa__Túi OPP__Bao Bì May Mặc",www.daithinhphat.bizz.vn,'0939546379',Hotline,X,,,baobidaithinhphat79@gmail.com,https://www.yellowpages.vn/lgs/1187826117/bao-bi-dai-thinh-phat-cong-ty-tnhh-bao-bi-dai-thinh-phat.html
Công Ty TNHH TM DV Xuất Nhập Khẩu Sản Xuất Bao Bì Minh Anh,"89/22/7 Phan Anh, P. Bình Trị Đông, Q. Bình Tân,","Túi Nhựa PVC__Bao Bì Quà Tặng, Bao Bì Khuyến Mại__Bao Bì May Mặc",www.baobimart.com,'0934081416',Ông Đào Huy Thức,,male,TP Kinh Doanh,baobimart@gmail.com,https://www.yellowpages.vn/lgs/1187778576/cong-ty-tnhh-tm-dv-xuat-nhap-khau-san-xuat-bao-bi-minh-anh.html
Công Ty TNHH Sản Xuất Thương Mại Bao Bì Nhựa Cường Thịnh Phúc,"A5/6c Nguyễn Cữu Phú, ấp 01, X. Tân Kiên, H. Bình Chánh,","Cốc Nhựa Dùng 1 Lần, Hộp Nhựa Dùng 1 Lần,..Các Loại Nhựa Dùng 1 Lần__Bao Bì Thực Phẩm__Bao Bì May Mặc__Bao Bì PE, PP, HDPE, LDPE (Dạng Tấm, Cuộn, Túi)",www.cuongthinhphuc.vn,'0932663789__0280932653789',,,,,,https://www.yellowpages.vn/lgs/1187783508/cong-ty-tnhh-san-xuat-thuong-mai-bao-bi-nhua-cuong-thinh-phuc.html
Trường An - Công Ty TNHH Bao Bì Carton Trường An,"Lô A9, Cụm Công Nghiệp Nhị Xuân,ấp 5, X. Xuân Thới Sơn, H. Hóc Môn,",Bao Bì Nông Nghiệp__Bao Bì Đồ Điện Tử__Bao Bì Hộp__Bao Bì Giấy__Bao Bì May Mặc__Bao Bì Thực Phẩm__Bao Bì - Nhà Sản Xuất và Kinh Doanh__Bao Bì Carton,,'02835950858',,,,,,https://www.yellowpages.vn/lgs/1041435/truong-an-cong-ty-tnhh-bao-bi-carton-truong-an.html
Doanh Nghiệp Sản Xuất Và Kinh Doanh Bao Bì Túi Nilon,"176 Nguyễn Duy, P. 10, Q. 8,","Bao Bì Nông Nghiệp__Túi Nilon PE, Túi PP, Túi HDPE,.__Bao Bì PE, PP, HDPE, LDPE (Dạng Tấm, Cuộn, Túi)__Túi, Bao Zipper, Ziplock__Bao Bì May Mặc",www.baobipebong.com__www.tuiniloncongnghiep.com,'0913273253__0986273253',Mr Phát,,male,,baobiinankhangloi@gmail.com,https://www.yellowpages.vn/lgs/1187783850/doanh-nghiep-san-xuat-va-kinh-doanh-bao-bi-tui-nilon.html
