company,address,industry,website,phone,contact_person,is_hotline,gender,position,email,url
Bao Bì Thiên Hà - Công Ty TNHH In & Sản Xuất Bao Bì Thiên Hà,"Nhà máy: Km30+500, QL 5, Hà Nội - Hải Phòng, X. Bạch Sam, H. Mỹ Hào,","Bao Bì - Nhà Sản Xuất và Kinh Doanh__Màng PVC, PET, PP, PS, HIPS__Bao Bì Nhựa",www.thienhapacking.com,'0988500097__0912004415__02213949130',Ông Nguyễn Thành Chung,,male,Phòng kinh doanh,chungnt@thienhatrading.com,https://www.yellowpages.vn/lgs/1187730489/bao-bi-thien-ha-cong-ty-tnhh-in---san-xuat-bao-bi-thien-ha.html
Bao Bì Gia An -  Công ty TNHH Sản Xuất In ấn Bao Bì Gia Ân,"117/15/8 Đường Hồ Văn Long, KP. 3, P. Tân Tạo, Q. Bình Tân,","Túi Nhựa PVC__In Bao Bì Nhựa, In Màng Co, Màng Ghép, In ống Đồng__Túi Nilon PE, Túi PP, Túi HDPE,.__Bao Bì Nhựa__Túi OPP__Túi, Bao Zipper, Ziplock__Bao Bì May Mặc__In Bao Bì - Công Ty Thiết Kế và In ấn Bao Bì__Bao Bì - Nhà Sản Xuất và Kinh Doanh",www.baobigiaan.com,'0989730607__0937579420',Ông Bùi Văn Phương,,male,Kinh doanh,baobigiaan@gmail.com,https://www.yellowpages.vn/lgs/1187764974/bao-bi-gia-an--cong-ty-tnhh-san-xuat-in-an-bao-bi-gia-an.html
Bao Bì Thuận Phát - Công Ty Cổ Phần Sản Xuất & Thương Mại Thuận Phát,"Số 51, Ngõ 376/12, Đường Bưởi, Q. Ba Đình,","Bao Bì Màng Ghép, Bao Bì Màng Phức Hợp__Túi Nilon PE, Túi PP, Túi HDPE,.__Bao Bì Nhựa",,'02437614256',Hotline,X,,,nhuathuanphat@gmail.com,https://www.yellowpages.vn/lgs/1187691633/bao-bi-thuan-phat-cong-ty-co-phan-san-xuat---thuong-mai-thuan-phat.html
Công Ty TNHH Bao Bì Thảo Việt - Văn Phòng Đại Diện,"36/3 Bàu Cát 1, P. 14, Q. Tân Bình,","Bao Bì Màng Ghép, Bao Bì Màng Phức Hợp__In Bao Bì Nhựa, In Màng Co, Màng Ghép, In ống Đồng__Bao Bì PE, PP, HDPE, LDPE (Dạng Tấm, Cuộn, Túi)__Bao Bì Nhựa__Bao Bì Thực Phẩm",www.thavina.com.vn,'0909631186__02862873265',Ông Lý Quốc Thái,,male,Nhân viên kinh doanh,thaikd@thavina.com.vn,https://www.yellowpages.vn/lgs/1187693745/cong-ty-tnhh-bao-bi-thao-viet-van-phong-dai-dien.html
Bao Bì Trường Giang - Công Ty CP Đầu Tư Sản Xuất XNK Trường Giang,"Số 16, TT. 18, Khu Đấu Giá Tứ Hiệp, X. Ngũ Hiệp, H. Thanh Trì,","Túi Nilon PE, Túi PP, Túi HDPE,.__Bao Bì Nhựa",www.truonggiangig.com,'02436876327__0986156228',Mr. Sáng,,male,Phòng kinh doanh,truonggiangig@gmail.com,https://www.yellowpages.vn/lgs/1187679579/bao-bi-truong-giang-cong-ty-cp-dau-tu-san-xuat-xnk-truong-giang.html
Bao Bì Kiến Nam - Công Ty TNHH Thương Mại Dịch Vụ Sản Xuất Kiến Nam,"Ấp Trung Viết, X. Phước Hiệp, H. Củ Chi,",Bao Bì - Nhà Sản Xuất và Kinh Doanh__Hạt Nhựa - Nguyên Liệu__Bao Bì Nhựa,www.kiennam.com.vn,'0908585554__02837153199',Mr. Nam,,male,,kiennamco@yahoo.com.vn,https://www.yellowpages.vn/lgs/1187863056/bao-bi-kien-nam-cong-ty-tnhh-thuong-mai-dich-vu-san-xuat-kien-nam.html
Bao Bì Poma - Công Ty TNHH Sản Xuất Và Thương Mại Bảo Mã,"Số 21, KCN Tân Tạo, Đường Số 3, P. Tân Tạo A, Q. Bình Tân,","Túi Nilon PE, Túi PP, Túi HDPE,.__Bao Bì Nhựa",www.poma.com.vn,'0966290555__02837540999',Ms. Dương Thị Xi Nê,,female,Trợ lý GĐ,xinepoma@gmail.com,https://www.yellowpages.vn/lgs/714201/bao-bi-poma-cong-ty-tnhh-san-xuat-va-thuong-mai-bao-ma.html
Bao Bì ATP - Công Ty Cổ Phần Bao Bì ATP,"99A, Tổ 3A, KP. 5, P. Mỹ Phước, TX. Bến Cát,","Bao Bì Dược Phẩm__Bao Bì Nhựa - Chai Nhựa, Lọ Nhựa, Hộp Nhựa, Can nhựa__Bao Bì Nhựa",www.chailonhua.net__www.baobivinhtuong.vn,'0902669346__0938640368__02743556860',Ms. Trần Trúc Hà,,female,Sales Manager,vipaco@vipaco.net,https://www.yellowpages.vn/lgs/1187855640/bao-bi-atp-cong-ty-co-phan-bao-bi-atp.html
Bao Bì Trang Tín - Công Ty Cổ Phần Sản Xuất Bao Bì Trang Tín,"VPGD: 21-23 Đường Số 6, P. An Lạc A, Q. Bình Tân,",Bao Bì - Nhà Sản Xuất và Kinh Doanh__Bao Bì Giấy__Bao Bì Nhựa,www.trangtin.vn,'0898150259__02723758822',Mr. Nguyễn Văn Cường,,male,Trưởng phòng HCNS,cuongmin@gmail.com,https://www.yellowpages.vn/lgs/970101/bao-bi-trang-tin-cong-ty-co-phan-san-xuat-bao-bi-trang-tin.html
Bao Bì Đức Anh - Công Ty TNHH Đức Anh,"Số 223. Đường Mạc Đăng Doanh, P. Hưng Đạo, Q. Dương Kinh,","Màng Co PE, LDPE, PVC, POF,.__Bao Bì - Nhà Sản Xuất và Kinh Doanh__Bao Bì Nhựa",www.ducanh.com.vn,'02253633589',Hotline,X,,,ductien@dapack.com.vn,https://www.yellowpages.vn/lgs/1313922/bao-bi-duc-anh-cong-ty-tnhh-duc-anh.html
Bao Bì Tăng Phú - Công Ty TNHH Sản Xuất Thương Mại Dịch Vụ Bao Bì Tăng Phú,"11/3 Tổ 4, Khu Phố Ích Thạnh, P. Trường Thạnh, Q. 9,","Bao Bì Màng Ghép, Bao Bì Màng Phức Hợp__Bao Bì Nhựa",www.tafuco.vn,'0908618321__02837307845',Mr. Trần Huỳnh Đơn,,male,P. Giám Đốc,info@tafuco.vn,https://www.yellowpages.vn/lgs/1039464/bao-bi-tang-phu-cong-ty-tnhh-san-xuat-thuong-mai-dich-vu-bao-bi-tang-phu.html
Bao Bì Sông Đà - Công Ty Cổ Phần Công Nghiệp Thương Mại Sông Đà,"Do Lộ, P. Yên Nghĩa, Q. Hà Đông,",Bao Bì - Nguyên Vật Liệu Bao Bì__Đá Xây Dựng - Khai Thác Và Chế Biến__Bao Xi Măng__Bao Bì Nhựa__Bao PP Dệt,www.stp.com.vn,'02433521290__0966139656',Mr. Nguyễn Trọng Lợi,,male,Phó Tổng GĐ,loinguyentrong@gmail.com,https://www.yellowpages.vn/lgs/1187680140/bao-bi-song-da-cong-ty-co-phan-cong-nghiep-thuong-mai-song-da.html
Nhựa Hanpad - Công Ty Cổ Phần Đầu Tư Hanpad,"Tầng 6 Tòa Nhà ACM, Số 22, Ngõ 42 Vũ Ngọc Phan, P. Láng Hạ, Q. Đống Đa,","Màng Phủ Nông Nghiệp, Ngư Nghiệp__Túi Nilon PE, Túi PP, Túi HDPE,.__Bao Bì Nhựa__Túi Đựng Rác (Túi Đựng Rác y Tế, Công Nghiệp, Màu Đen, Dạng Cuộn)__Túi Đựng Thực Phẩm, Túi Cuộn Đựng Thực Phẩm",www.hanpad.com.vn,'0976909055__02436805588',Ms. Lan Anh,,female,,anna@hanpad.com.vn,https://www.yellowpages.vn/lgs/1187735658/nhua-hanpad-cong-ty-co-phan-dau-tu-hanpad.html
Bao Bì Habeco - Công Ty Cổ Phần Bao Bì Habeco,"Lô 2HA, CCN Nhà Máy Bia Hà Nội Mê Linh, X. Tiền Phong, H. Mê Linh,",Bao Bì - Nhà Sản Xuất và Kinh Doanh__Bao Bì Giấy__Bao Bì Nhựa,www.habeco-p.vn,'02437191638',Hotline,X,,,habeco-packaging@vnn.vn,https://www.yellowpages.vn/lgs/1187735643/bao-bi-habeco-cong-ty-co-phan-bao-bi-habeco.html
Nhựa Phú Hưng Cường - Công Ty TNHH Sản Xuất Thương Mại Phú Hưng Cường,"66/09 Xuân Thới Đông 1, X. Xuân Thới Đông, H. Hóc Môn","Màng Co PE, LDPE, PVC, POF,.__Màng Phủ Nông Nghiệp, Ngư Nghiệp__Bao Bì Nông Nghiệp__Bao Bì Nhựa",www.phcplastic.vn,'02854283668__0908096368',Mr. Dũng,,male,,dungnguyen@phcplastic.vn,https://www.yellowpages.vn/lgs/1187687127/nhua-phu-hung-cuong-cong-ty-tnhh-san-xuat-thuong-mai-phu-hung-cuong.html
Bao Bì Hồng Hà - Công Ty TNHH Xuất Nhập Khẩu Bao Bì Hồng Hà,"205BC Bến Vân Đồn, P. 5, Q. 4,","Màng Seal Nhôm, Màng Nhôm (Lá Mỏng, Vỉ Bấm,.)__Bao Bì - Nhà Sản Xuất và Kinh Doanh__Bao Bì Nhựa",www.honhaco.com,'0907025686__02837542996',Mr. Trần Quang Vĩnh Hoàng,,male,,hoang.tran@honhaco.com,https://www.yellowpages.vn/lgs/1187836992/bao-bi-hong-ha-cong-ty-tnhh-xuat-nhap-khau-bao-bi-hong-ha.html
Bao Bì Nhựa Nguyên Khang - Công Ty TNHH SXTM XNK Bao Bì Nhựa Nguyên Khang,"28/2 Phạm Văn Sáng, X. Xuân Thới Thượng, H. Hóc Môn,","Bao Bì Dược Phẩm__Bao Bì Nhựa - Chai Nhựa, Lọ Nhựa, Hộp Nhựa, Can nhựa__Bao Bì Nhựa",,'02862505327__0903737433',Mr. Vinh,,male,,khangtran_09@yahoo.com,https://www.yellowpages.vn/lgs/1187739744/bao-bi-nhua-nguyen-khang-cong-ty-tnhh-sxtm-xnk-bao-bi-nhua-nguyen-khang.html
Công Ty CP Diệu Thương,"Số 60, Đường Số 5 Cư, X. Bình Thới, P. 8, Q. 11,","Bao Bì Nhựa__áo Mưa - Công Ty áo Mưa, Sản Xuất và Bán Buôn",www.detoco.com,'0909355047__02838584139',Bà Phạm Thị Nhị Linh,,female,Tp. Kinh Doanh,v23@detoco.com,https://www.yellowpages.vn/lgs/1187679432/cong-ty-cp-dieu-thuong.html
Nhựa Song Bàng - Công Ty TNHH Sản Xuất Và Thương Mại Song Bàng,"A5/6C Nguyễn Cửu Phú, X. Tân Kiên, H. Bình Chánh,","Túi Nilon PE, Túi PP, Túi HDPE,.__Bao Bì Nhựa__Nhựa - Máy Móc và Thiết Bị Ngành Nhựa__Túi OPP__Túi, Bao Zipper, Ziplock__Túi Đựng Rác (Túi Đựng Rác y Tế, Công Nghiệp, Màu Đen, Dạng Cuộn)__Hạt Nhựa - Nguyên Liệu",www.songbangplastic.com__www.songbangplastic.com.vn,'0909583908__02837603603',Ms. Nguyễn Thị Thu Trang,,female,,songbang.batnhua@gmail.com,https://www.yellowpages.vn/lgs/1187751156/nhua-song-bang-cong-ty-tnhh-san-xuat-va-thuong-mai-song-bang.html
Bao Bì Đại Á Âu - Công Ty TNHH Đại Á Âu,"A4/26D, Đường Liên Ấp 123, X. Vịnh Lộc, H. Bình Tránh,","Túi Nilon PE, Túi PP, Túi HDPE,.__Bao Bì Nhựa",www.daaplastic.com,'02822287388__0988303828',Ông Trần Ngọc Tân,,male,Giám Đốc,daa138@yahoo.com,https://www.yellowpages.vn/lgs/1187687124/bao-bi-dai-a-au-cong-ty-tnhh-dai-a-au.html
Bao Bì Tân Nam Phong - Công Ty TNHH Tân Nam Phong,"Khu A, KCN Lễ Môn, P. Quảng Hưng, TP. Thanh Hóa,","Bao Bì Màng Ghép, Bao Bì Màng Phức Hợp__Bao Bì Nông Nghiệp__Bao Bì Nhựa__Bao PP Dệt__Bao Bì Thực Phẩm",,'0373913283__02373913283',Mr Hiền,,male,Giám Đốc,tannamphong.tnp@gmail.com,https://www.yellowpages.vn/lgs/1187697834/bao-bi-tan-nam-phong-cong-ty-tnhh-tan-nam-phong.html
Công Ty TNHH SX TM Bao Bì Tân Tiến Phát Tài,"Lô 29, Khu G, Đường D2, KCN An Hạ, X. Phạm Văn Hai, Bình Chánh","Bao Bì Màng Ghép, Bao Bì Màng Phức Hợp__In Bao Bì Nhựa, In Màng Co, Màng Ghép, In ống Đồng__Màng CPP, Màng MCPP__Bao Bì Nhựa__Bao Bì Thực Phẩm",www.tantienphattai.com.vn,'02839781218__09037191860918211009',Hotline,X,,,tantienphattai@gmail.com,https://www.yellowpages.vn/lgs/1039473/cong-ty-tnhh-sx-tm-bao-bi-tan-tien-phat-tai.html
Bao Bì Trang Tín - Công Ty TNHH Trang Tín,"SL5 Cư Xá Phú Lâm A, Đường Kinh Dương Vương , P. 12, Q. 6,",In Bao Bì - Công Ty Thiết Kế và In ấn Bao Bì__Bao Bì Nhựa,www.baobitrangtin.vn,'02837511431__0908262924',Ms. Bích Lan,,female,PGĐ Kinh Doanh,trangtin.tt@gmail.com,https://www.yellowpages.vn/lgs/712227/bao-bi-trang-tin-cong-ty-tnhh-trang-tin.html
Công Ty TNHH Vân Long,"Khu 15A An Trì, P. Hùng Vương, Q. Hồng Bàng,","Bao Bì Nhựa__Nhựa Công Nghiệp - Thùng Nhựa, Khay Nhựa, Sóng Nhựa, Sọt Nhựa__Nhựa - Các Công Ty Nhựa",www.vanlongplastic.com.vn,'02253798886__0936798814',Hotline,X,,,marketing01@vanlongplastic.com.vn,https://www.yellowpages.vn/lgs/1187708013/cong-ty-tnhh-van-long.html
Nhựa LSPack - KPack - Công Ty TNHH LS Pack,"KCN. Tây Bắc Củ Chi, Ấp Bàu Tre 2, X. Tân An Hội, H. Củ Chi,",Bao Bì - Nhà Sản Xuất và Kinh Doanh__Bao Bì Nhựa,www.lspack.com.vn,'02837904744__0938718820',Mr. Trần Công Chiến,,male,,congchien@lspack.com.vn,https://www.yellowpages.vn/lgs/1187849430/nhua-lspack-kpack-cong-ty-tnhh-ls-pack.html
Công Ty Cổ Phần Bao Bì Bình Minh,"42 Kha Vạn Cân, Khu Phố 3, P. Hiệp Bình Chánh, Q. Thủ Đức,",Bao Bì - Nhà Sản Xuất và Kinh Doanh__Bao Bì Giấy__Bao Giấy Kraft__Bao Bì Nhựa,www.baobibinhminh.net,'02866756588__0903174476',Mr Dũng,,male,,sales@baobibinhminh.net,https://www.yellowpages.vn/lgs/1187723754/cong-ty-co-phan-bao-bi-binh-minh.html
Nhựa Tân Đạt Việt - Công Ty TNHH Bao Bì Nhựa Tân Đạt Việt,"128 Lê Hồng Phong, P.3, Q. 5,","Bao Bì Nhựa Định Hình, Khay Nhựa Định Hình__Bao Bì Nhựa",www.tandatviet.com,'02838381620',Hotline,X,,,tandatviet@vnn.vn,https://www.yellowpages.vn/lgs/989244/nhua-tan-dat-viet-cong-ty-tnhh-bao-bi-nhua-tan-dat-viet.html
Bao Bì Tiến Thịnh - Công Ty TNHH Sản Xuất Thương Mại Tiến Thịnh,"Khu Công Nghiệp Vĩnh Lộc, A1/1-A1B/1 Đường 2B, P. Bình Hưng Hòa B, Q. Bình Tân,","Túi Nilon PE, Túi PP, Túi HDPE,.__Bao Bì Nhựa",www.chinsheng.com,'02837653148__02837653147',Ms Ngọc Diễm,,female,,chinshengvn@yahoo.com,https://www.yellowpages.vn/lgs/1021992/bao-bi-tien-thinh-cong-ty-tnhh-san-xuat-thuong-mai-tien-thinh.html
Bao Bì Phạm Hà - Công Ty TNHH Phạm Hà,"140 KP 3, P. Thạnh Xuân, Q. 12,","In Bao Bì Nhựa, In Màng Co, Màng Ghép, In ống Đồng__Túi Nilon PE, Túi PP, Túi HDPE,.__Bao Bì PE, PP, HDPE, LDPE (Dạng Tấm, Cuộn, Túi)__Bao Bì Nhựa__In Bao Bì - Công Ty Thiết Kế và In ấn Bao Bì",,'0903692709__02837168321',Mr. Bình,,male,,phamha7777@yahoo.com.vn,https://www.yellowpages.vn/lgs/1073466/bao-bi-pham-ha-cong-ty-tnhh-pham-ha.html
Bao Bì Nhựa Sopha - Công Ty CP Bao Bì Nhựa Sopha,"Ấp Rừng Sến, X. Mỹ Hạnh Bắc, H. Đức Hòa,",Bao Bì - Nhà Sản Xuất và Kinh Doanh__Bao Bì Nhựa,www.sopha.com.vn,'02862598639__02723774536__0903921922',Mr. Trung,,male,,baoibinhua@sopha.com.vn,https://www.yellowpages.vn/lgs/1113645/bao-bi-nhua-sopha-cong-ty-cp-bao-bi-nhua-sopha.html
Bao Bì Nhựa Trung Sơn - Công Ty Cổ Phần Sản Xuất Thương Mại Dịch Vụ Bao Bì Nhựa Trung Sơn,"Khu Công Nghiệp Lê Minh Xuân, Lô C1-C2,Đường 7, X. Tân Nhựt, H. Bình Chánh,","Bao Bì Nhựa Định Hình, Khay Nhựa Định Hình__Bao Bì Nhựa",www.trungsonplastic.com.vn,'02837660494',Hotline,X,,,trungson101@hcm.fpt.vn,https://www.yellowpages.vn/lgs/1113636/bao-bi-nhua-trung-son-cong-ty-co-phan-san-xuat-thuong-mai-dich-vu-bao-bi-nhua-trung-son.html
Phân Bón Miền Nam - Công Ty CP Phân Bón Miền Nam,"125B Cách Mạng Tháng Tám, P. 5, Q. 3,","Hóa Chất - Sản Xuất & Cung Cấp__Phân Bón Lá__Phân Bón - Công Ty Phân Bón, Sản Xuất và Bán Buôn__Bao Bì Nhựa",www.phanbonmiennam.com.vn,'02838325889__1900555546',Mr. Giang,,male,,giangthong202@gmail.com,https://www.yellowpages.vn/lgs/988233/phan-bon-mien-nam-cong-ty-cp-phan-bon-mien-nam.html
Bao Bì Nhựa 04 - Công Ty Cổ Phần Nhựa 04,"1412 Đại Lộ Võ Văn Kiệt, P. 1, Q. 6,",Túi Khí Chèn Hàng__Bao PP Dệt__Vật Liệu Xây Dựng__Bao Bì Nhựa,www.plastic04.com,'02838552833__0908637615',Mr. Khương,X,male,Hotline,,https://www.yellowpages.vn/lgs/714129/bao-bi-nhua-04-cong-ty-co-phan-nhua-04.html
Bao Bì Nam Long Phát - Công Ty TNHH Sản Xuất Và Thương Mại Nam Long Phát,"Km 1929 Ấp Long Bình, Quốc Lộ 1A, X. Long Hiệp, H. Bến Lức,","Bao Bì - Nhà Sản Xuất và Kinh Doanh__Bao Bì Nhựa - Chai Nhựa, Lọ Nhựa, Hộp Nhựa, Can nhựa__Bao Bì Carton__Bao Bì Nhựa",,'02723890502__0913118662',Ông Trần Quang Tâm,,male,P. Giám Đốc,quangtam2001@yahoo.com,https://www.yellowpages.vn/lgs/717117/bao-bi-nam-long-phat-cong-ty-tnhh-san-xuat-va-thuong-mai-nam-long-phat.html
Tổng Công Ty Công Nghiệp - In - Bao Bì Liksin - TNHH MTV,"159 Kinh Dương Vương, P. 12, Q. 6,",Bao Bì Thực Phẩm__Bao Bì - Nhà Sản Xuất và Kinh Doanh__Bao Bì Nhựa__Bao Bì Giấy,www.liksin.vn,'02837512562',Ms. Nguyễn Thị Ngọc Bích,,female,CV Marketing,ngocbich.mkt@liksin.com,https://www.yellowpages.vn/lgs/1187864211/tong-cong-ty-cong-nghiep-in-bao-bi-liksin-tnhh-mtv.html
Bao Bì Tân Khánh An - Công Ty TNHH MTV Tân Khánh An,"Khu Công Nghiệp Bắc Vinh, Tp. Vinh,",Bao Bì Nông Nghiệp__Bao Giấy Kraft__Bao Bì Nhựa__Thuốc Lá - Nhà Sản Xuất__Bao Bì - Nhà Sản Xuất và Kinh Doanh,www.tankhanhan.khatoco.com,'0903429599__02383514527',Mr. Hà,,male,,phamha1969tka@gmail.com,https://www.yellowpages.vn/lgs/1275120/bao-bi-tan-khanh-an-cong-ty-tnhh-mtv-tan-khanh-an.html
Bao Bì Minh Hoàng - Công Ty TNHH Bao Bì Minh Hoàng,"Lô 2-CN 7 Cụm CN Ngọc Hồi, X. Ngọc Hồi,H. Thanh Trì,","Túi Nilon PE, Túi PP, Túi HDPE,.__Bao Bì Nhựa",,'02436864934__0978900271',Ms Vỹ,,female,Tp Kinh Doanh,packingminhhoang@yahoo.com.vn,https://www.yellowpages.vn/lgs/1293078/bao-bi-minh-hoang-cong-ty-tnhh-bao-bi-minh-hoang.html
Bao Bì Hoàng Đăng - Công Ty TNHH SX TM DV Xuất Nhập Khẩu Bao Bì Hoàng Đăng,"166/1/9G1 Lưu Hữu Phước, P. 15, Q. 8,","Màng Co PE, LDPE, PVC, POF,.__Bao Bì Thực Phẩm__Bao Bì May Mặc__Bao Bì Nhựa",www.baobihoangdang.com,'02837580694__0909169222',Ông Nguyễn Duy Linh,,male,Giám Đốc,,https://www.yellowpages.vn/lgs/1187704563/bao-bi-hoang-dang-cong-ty-tnhh-sx-tm-dv-xuat-nhap-khau-bao-bi-hoang-dang.html
Bao Bì Đức Tấn Sài Gòn - Công Ty TNHH Đức Tấn Sài Gòn,"Km 12, Đường Ngọc Hồi, H. Thanh Trì,","Bao Bì Dược Phẩm__Bao Bì Mỹ Phẩm__Bao Bì Nhựa - Chai Nhựa, Lọ Nhựa, Hộp Nhựa, Can nhựa__Nắp Nhựa, Nút Nhựa__Bao Bì Nhựa__Bao Bì Thực Phẩm",www.ductansaigon.com,'0916008686__02436874170',Mr. Trần Anh Tuấn,,male,Phó Giám Đốc,tuan.tran@ductansaigon.com,https://www.yellowpages.vn/lgs/1304517/bao-bi-duc-tan-sai-gon-cong-ty-tnhh-duc-tan-sai-gon.html
Nhựa Vinh An - Công Ty TNHH Sản Xuất Nhựa Vinh An,"số nhà 2N02 ngõ 40 đường Xuân La, P. Xuân Tảo, Q. Bắc Từ Liêm,","Túi Nhôm__Túi Nilon PE, Túi PP, Túi HDPE,.__Bao Bì Nhựa__Túi, Bao Zipper, Ziplock__Bao Bì - Nhà Sản Xuất và Kinh Doanh",www.vinhanplast.com,'0961395789',Ms. Hương,,female,,vinhanplast@gmail.com,https://www.yellowpages.vn/lgs/1187840160/nhua-vinh-an-cong-ty-tnhh-san-xuat-nhua-vinh-an.html
Công Ty TNHH Sản Xuất Và Thương Mại Minh Hiển Đạt,"453/14 Tân Hòa Đông, P. Bình Trị Đông, Q. Bình Tân,","Túi Nhựa PVC__POSM Quảng Cáo (Wobbler, Booth, Hanger Quảng Cáo,.)__Bao Bì Nhựa",www.baobinhuapvc.com,'0908460395__0934061961__02837517460',Ông Trần Minh Giàu,,male,,minhhiendat@yahoo.com,https://www.yellowpages.vn/lgs/1187707359/cong-ty-tnhh-san-xuat-va-thuong-mai-minh-hien-dat.html
Màng Nhựa Cường Tuấn - Công Ty TNHH Sản Xuất Thương Mại Cường Tuấn,"Ấp 5, X. Đức Hòa Đông, H. Đức Hòa,","Bao Bì Màng Ghép, Bao Bì Màng Phức Hợp__Bao Bì Nhựa__Màng Co PE, LDPE, PVC, POF,.__Bao Bì - Nhà Sản Xuất và Kinh Doanh__Màng In Chuyển Nhiệt",www.cuongtuan.vn,'0903733796__02723817628',Ông Hồng Vĩ Cường,,male,,cuongtuan2010@yahoo.com.vn,https://www.yellowpages.vn/lgs/1187699382/mang-nhua-cuong-tuan-cong-ty-tnhh-san-xuat-thuong-mai-cuong-tuan.html
Công Ty TNHH Sản Xuất In ấn Bao Bì Đình Toàn,"Số 75 Cống Lở, P. 15, Q. Tân Bình,","Bao Bì Màng Ghép, Bao Bì Màng Phức Hợp__Màng Phủ Nông Nghiệp, Ngư Nghiệp__In Túi Nilon, In Túi Xốp__Túi Phân Hủy Sinh Học__In Bao Bì Nhựa, In Màng Co, Màng Ghép, In ống Đồng__Túi Nilon PE, Túi PP, Túi HDPE,.__Bao Bì Nhựa__Găng Tay Nilon, Găng Tay Xốp - Sản Xuất và Kinh Doanh__Túi, Bao Zipper, Ziplock__In Bao Bì - Công Ty Thiết Kế và In ấn Bao Bì__Túi Đựng Rác (Túi Đựng Rác y Tế, Công Nghiệp, Màu Đen, Dạng Cuộn)",www.baobidinhtoan.com,'02822122297__0972378397',Ms. Bùi Hồng Thanh Tâm,,female,,congtybaobidinhtoan@gmail.com,https://www.yellowpages.vn/lgs/1187702634/cong-ty-tnhh-san-xuat-in-an-bao-bi-dinh-toan.html
Nhựa TBM Minh Phát - Công Ty TNHH Sản Xuất Thương Mại TBM Minh Phát,"141-143 Xóm Đất, P. 8, Q. 11,","Nhựa Công Nghiệp - Gia Công Linh Kiện, Chi Tiết, Phụ Tùng..__Nhựa - Các Công Ty Nhựa__Bao Bì Nhựa - Chai Nhựa, Lọ Nhựa, Hộp Nhựa, Can nhựa__Bao Bì Nhựa",www.tbm.com.vn,'02838581816__0982248551',Ông Nguyễn Tấn Lợi,,male,Sales Manager,loi@tbm.com.vn,https://www.yellowpages.vn/lgs/1000518/nhua-tbm-minh-phat-cong-ty-tnhh-san-xuat-thuong-mai-tbm-minh-phat.html
Công Ty TNHH Sản Xuất PVC Triệu Đạt,"964/44 Tân Kỳ Tân Quý, P. Bình Hưng Hòa, Q. Bình Tân,",Túi Nhựa PVC__Bao Bì Nhựa,www.tuinhuapvc.com,'0909102365__0977338084',Hotline,X,,,tuinhuapvc@gmail.com,https://www.yellowpages.vn/lgs/1187824125/cong-ty-tnhh-san-xuat-pvc-trieu-dat.html
Bao Bì Phương Đông - Công Ty TNHH Một Thành Viên Phương Đông,": Liễn Hạ, Đại Xuân, H. Quế Võ,","Túi Nhôm__Túi Phân Hủy Sinh Học__Dây Thun Dệt (Thun Tròn, Thun Bản, Đai Thun,.)__Mút Xốp EVA, PU, PE,..Định Hình - Sản Xuất Và Gia Công Theo yêu Cầu__Màng Seal Nhôm, Màng Nhôm (Lá Mỏng, Vỉ Bấm,.)__Túi Nilon PE, Túi PP, Túi HDPE,.__Bao Bì Nhựa__Màng PE Foam (Cuộn, Tấm, Túi, ống,.) - Sản Xuất Và Kinh Doanh__Màng PE, Màng Chít - Nhà Sản Xuất",www.phuongdongplastic.com,'02223637155__0986079969',Ông Lê Xuân Tiếp,,male,,phuongdong124@gmail.com,https://www.yellowpages.vn/lgs/1187733828/bao-bi-phuong-dong-cong-ty-tnhh-mot-thanh-vien-phuong-dong.html
Công Ty CP SX TM DV Quang Anh,"Tầng 1, Ô đất BT4A, P. Phúc Lợi, Q. Long Biên,","Túi OPP__Túi Nilon PE, Túi PP, Túi HDPE,.__Bao Bì May Mặc__Bao Bì Nhựa",www.quanganhjsc.com,'0983211219__0963008315',Ms. Suốt,X,female,Hotline,suot.quanganhjsc@gmail.com,https://www.yellowpages.vn/lgs/1187928384/cong-ty-cp-sx-tm-dv-quang-anh.html
Công Ty TNHH Sản Xuất & Thương Mại Hòa Thành Đạt,"137/13-15 Nguyễn Chí Thanh, P. 16, Q. 11,","Túi Nilon PE, Túi PP, Túi HDPE,.__Bao Bì Nhựa",,'0839691034__02839691034',Ông Lý Đức Thành,,male,Giám Đốc,,https://www.yellowpages.vn/lgs/701385/cong-ty-tnhh-san-xuat---thuong-mai-hoa-thanh-dat.html
Công Ty TNHH Innovative Shield Việt Nam,"Nhà Xưởng Trà My, Thôn Ngọc Đà, X. Tân Quang, H. Văn Lâm,",Túi Chống Tĩnh Điện__Túi Nhôm__Bao Bì Nhựa,www.innovativeshield.com.vn,'0979678669__02213791188',Ms. Yến,,female,Nhân Viên,yendth@innovativeshield.com.vn,https://www.yellowpages.vn/lgs/1187840178/cong-ty-tnhh-innovative-shield-viet-nam.html
Công Ty CP Tài Nguyên Đông Dương,"105 Tập Thể Đại Học Kinh Tế Quốc Dân, Ngõ Tự Do, P. Đồng Tâm, Q. Hai Bà Trưng,","Túi Đựng Rác (Túi Đựng Rác y Tế, Công Nghiệp, Màu Đen, Dạng Cuộn)__Túi Nilon PE, Túi PP, Túi HDPE,.__Vòng Bi, Bạc Đạn__Bao Bì Nhựa",,'02436285996__0915003505',Hotline,X,,,ngothehoc@gmail.com,https://www.yellowpages.vn/lgs/1187736258/cong-ty-cp-tai-nguyen-dong-duong.html
Công Ty TNHH Sơn Trương,"12B, KP 1, P. Bửu Long, TP. Biên Hòa,","Mạ Kẽm Nhúng Nóng, Nhúng Kẽm__Bao Bì Nhựa__Nhà Xưởng, Nhà Công Nghiệp - Thi Công Nhà Xưởng, Nhà Công Nghiệp__Cơ Khí -  Gia Công và Chế Tạo__Nhà Thép Tiền Chế",www.sontruong.com,'02512210755__0913982757__0909752792',Mr. Sơn,,male,,sontruongstc@gmail.com,https://www.yellowpages.vn/lgs/1187722020/cong-ty-tnhh-son-truong.html
Bao Bì Đông Phương - Công Ty TNHH Nhựa Đông Phương,"Đường 7, KCN Trảng Bàng, H. Trảng Bàng,","Vải Địa Kỹ Thuật__Bao Bì Nhựa__Bao PP Dệt__Bao Container, Bao Jumbo, Bao Bigbag",www.easternpoly.com,'02763897215__0918470920',Mr. Dũng,X,male,Hotline,info@easternpoly.com,https://www.yellowpages.vn/lgs/4520409/bao-bi-dong-phuong-cong-ty-tnhh-nhua-dong-phuong.html
Bao Bì Nhựa Y.G.L - Công Ty TNHH Y.G.L Việt Nam,"Lô E, Đường 2B, KCN Đồng An, P. Bình Hòa, TP. Thuận An,","Xốp Hơi, Màng Xốp Hơi__Bao Bì Nhựa__Màng PE Foam (Cuộn, Tấm, Túi, ống,.) - Sản Xuất Và Kinh Doanh__Khuôn Mẫu__Bao Bì Nhựa Định Hình, Khay Nhựa Định Hình",www.ygl.com.vn,'02743782065__0903881009',Bà Nguyễn Thị Thanh,,female,,thanh-nguyen@ygl.com.vn,https://www.yellowpages.vn/lgs/1202157/bao-bi-nhua-y.g.l-cong-ty-tnhh-y.g.l-viet-nam.html
Công Ty CP ứng Dụng Và Triển Khai Công Nghệ ADT,"Số 11/162 Khương Đình, Q. Thanh Xuân,","ống Cao Su (Bố Vải, Chịu Nhiệt, Mềm, Lõi Thép,..)__Bao Bì Nhựa__Trục, Rulo Cao Su__Gioăng Cao Su, Phớt Cao Su__Cao Su Kỹ Thuật, Sản Phẩm Cao Su Kỹ Thuật__Cao Su - Sản Phẩm Cao Su",www.adtvietnam.vn,'0912727678__02436471323',Mr. Thế,,male,Phòng Kinh Doanh,adt@adtvietnam.vn,https://www.yellowpages.vn/lgs/1187751357/cong-ty-cp-ung-dung-va-trien-khai-cong-nghe-adt.html
Bao Bì Nhựa Cường Thịnh Phát - Công Ty TNHH Thương Mại & Sản Xuất Bao Bì Nhựa Cường Thịnh Phát,"309B2/4 Đường Bảy Tấn, ấp 2, X. An Phú Tây, H. Bình Chánh,","Bao Bì Màng Ghép, Bao Bì Màng Phức Hợp__Bao Bì PE, PP, HDPE, LDPE (Dạng Tấm, Cuộn, Túi)__Bao Bì Nhựa",,'02837690518__0903810217',Mr. Bình,,male,,cuongthinhphat2@gmail.com,https://www.yellowpages.vn/lgs/1187736594/bao-bi-nhua-cuong-thinh-phat-cong-ty-tnhh-thuong-mai---san-xuat-bao-bi-nhua-cuong-thinh-phat.html
Bao Bì Sài Gòn Xanh - Công Ty TNHH Bao Bì Sài Gòn Xanh,"139/33 Dương Văn Dương, Phường Tân Qúy, Quận Tân Phú,","Bao Bì - Nhà Sản Xuất và Kinh Doanh__Bao Bì PE, PP, HDPE, LDPE (Dạng Tấm, Cuộn, Túi)__Bao Bì Nhựa",www.baobisaigonxanh.com.vn,'02837673091__02837673092',Phòng KD,,,,baobisaigonxanh.com.vn,https://www.yellowpages.vn/lgs/1187829636/bao-bi-sai-gon-xanh-cong-ty-tnhh-bao-bi-sai-gon-xanh.html
Công Ty TNHH Kian Joo Can (Việt Nam),"17 Đại Lộ Độc Lập, KCN. Việt Nam-Singapore, TX. Thuận An,","Bao Bì Kim Loại, Hộp Kim Loại__Bao Bì - Nhà Sản Xuất và Kinh Doanh__Bao Bì Giấy__Bao Bì Nhựa",www.kjcf.net,'02743782292',Hotline,X,,,sales@kianjoocan.com.vn,https://www.yellowpages.vn/lgs/967350/cong-ty-tnhh-kian-joo-can--viet-nam-.html
Công Ty CP Dragon Packaging Việt Nam,"Số 93 phố Hòa Bình, P. Quang Trung, Tp. Hải Dương,",Bao Bì Nhựa,,'0912017504',Mr. Đinh Đức Chính,,male,,dinh_duc_chinh@yahoo.com,https://www.yellowpages.vn/lgs/1187884476/cong-ty-cp-dragon-packaging-viet-nam.html
