company,address,industry,website,phone,contact_person,is_hotline,gender,position,email,url
Công Ty TNHH TOSHITAKE,"Nhà Xưởng Số 4, Đường Số 6, KCN Giang Điền, X. Giang Điền, H. Trảng Bom,","Màng PE Foam (Cuộn, Tấm, Túi, ống,.) - Sản Xuất Và Kinh Doanh__Xốp Hơi, Màng Xốp Hơi__Bao Bì - Nhà Sản Xuất và Kinh Doanh__Bao Bì PE, PP, HDPE, LDPE (Dạng Tấm, Cuộn, Túi)",www.toshitakexophoi.com,'02513683121__0914876086',Mr. Phạm Văn Hưng,,male,NVKD,sales1@toshitake.com.vn,https://www.yellowpages.vn/lgs/1187910891/cong-ty-tnhh-toshitake.html
Thùng Carton Tân Thanh Hưng Yên - Công Ty Cổ Phần Tân Thanh Hưng Yên,"Khu Công Nghiệp Phố Nối B, Liêu Xá, Yên Mỹ,","Thùng Carton, Thùng Giấy__Bao Bì Carton 2 Lớp (Thùng, Giấy,..Carton 2 Lớp)__Bao Bì PE, PP, HDPE, LDPE (Dạng Tấm, Cuộn, Túi)__Thùng Carton 5 Lớp__Thùng Carton 3 Lớp__Bao Bì Carton",www.thungcartontanthanh.bizz.vn,'02213974535__0963961216',Hotline,X,,,ketoanbaobi@tanthanh.net,https://www.yellowpages.vn/lgs/1187874921/thung-carton-tan-thanh-hung-yen-cong-ty-co-phan-tan-thanh-hung-yen.html
Bao Bì Hoàng Hưng - Cơ Sở Sản Xuất Bao Bì Hoàng Hưng,"E18/58 Ấp 5, Xã Hưng Long, Huyện Bình Chánh,","Bao Bì Nhựa__Bao PP Dệt__Bao Bì PE, PP, HDPE, LDPE (Dạng Tấm, Cuộn, Túi)__Bao Tải Dứa",www.baobihochiminh.com,'0372740174__0938865691',Mr Hoàng,,male,,tanhoang0174@gmail.com,https://www.yellowpages.vn/lgs/1187843226/bao-bi-hoang-hung-co-so-san-xuat-bao-bi-hoang-hung.html
Công Ty TNHH Sản Xuất Thương Mại Nhựa Lâm Hưng,"B15/16 Ấp 2, X. Vĩnh Lộc B, H. Bình Chánh,","Hạt Nhựa PE__Hạt Nhựa - Nguyên Liệu__Hạt Nhựa ABS__Túi Nilon PE, Túi PP, Túi HDPE,.__Bao Bì PE, PP, HDPE, LDPE (Dạng Tấm, Cuộn, Túi)__Bao Bì Nhựa__Bao PP Dệt__Hạt Nhựa LDPE__Hạt Nhựa PP",www.nhualamhung.znn.vn,'0908199252__02862669118',Ông Lâm Rạng Đông,,male,,baobinhualamhung@gmail.com,https://www.yellowpages.vn/lgs/1187704458/cong-ty-tnhh-san-xuat-thuong-mai-nhua-lam-hung.html
Bao Bì Thủy Hưng Phát - Công Ty TNHH Thủy Hưng Phát,"267/2A Đường Nguyễn Thị Tú, P. Bình Hưng Hòa B, Q. Bình Tân,","Túi OPP__Túi Nilon PE, Túi PP, Túi HDPE,.__Bao Bì PE, PP, HDPE, LDPE (Dạng Tấm, Cuộn, Túi)__Màng PVC, PET, PP, PS, HIPS",www.thuyhungphat.com,'0916236338__02837658229',Mr. Phong,,male,Kinh Doanh,huynh@thuyhungphat.com,https://www.yellowpages.vn/lgs/1187702850/bao-bi-thuy-hung-phat-cong-ty-tnhh-thuy-hung-phat.html
Bao Bì Nhựa Phúc Lai - Công Ty TNHH Phúc Lai,"64 Ấp Tân Thành, Quốc Lộ 1, X. Bắc Sơn, H. Trảng Bom,","In Bao Bì Nhựa, In Màng Co, Màng Ghép, In ống Đồng__Túi Nilon PE, Túi PP, Túi HDPE,.__Bao Bì PE, PP, HDPE, LDPE (Dạng Tấm, Cuộn, Túi)__Bao Bì Nhựa__Bao PP Dệt__Bao Bì - Nhà Sản Xuất và Kinh Doanh",www.baobinhuaphuclai.com,'0914680955__02513869177__0983224524',Ông Lại Đình Sáng,,male,Giám Đốc,baobinhuaphuclai@gmail.com,https://www.yellowpages.vn/lgs/1187699439/bao-bi-nhua-phuc-lai-cong-ty-tnhh-phuc-lai.html
Bao Bì Đồng Phát - Công Ty Cổ Phần Sản Xuất Bao Bì Đồng Phát,"P.1008 nhà N2D, KĐT Trung Hòa Nhân Chính, Q. Thanh Xuân,","Bao Bì PE, PP, HDPE, LDPE (Dạng Tấm, Cuộn, Túi)__Bao Bì Giấy__Bao Bì Nhựa__Màng Co PE, LDPE, PVC, POF,.__Bao Bì - Nhà Sản Xuất và Kinh Doanh",www.dongphatpackaging.com.vn__www.dongphatpackaging.bizz.vn,'02432252669__0979725886__0432252669',Ông Trần Văn Thành,,male,,thanh.dongphat18@gmail.com,https://www.yellowpages.vn/lgs/1187779938/bao-bi-dong-phat-cong-ty-co-phan-san-xuat-bao-bi-dong-phat.html
Bao Bì Tong Yuan - Công Ty Liên Doanh Sản Xuất Bao Bì Tong Yuan,"Số 6, Đường Số 9, Khu Công Nghiệp Sóng Thần 1, TX. Dĩ An,","Túi Nhôm__Bao Bì - Nhà Sản Xuất và Kinh Doanh__Bao Bì PE, PP, HDPE, LDPE (Dạng Tấm, Cuộn, Túi)__Bao Bì Nhựa",,'02743742250__06503742250',Văn Phòng,,,,,https://www.yellowpages.vn/lgs/994218/bao-bi-tong-yuan-cong-ty-lien-doanh-san-xuat-bao-bi-tong-yuan.html
Cơ Sở Bảo Lộc Phát,"Ấp Phú Thọ, Xã Phú Chánh, Thị xã Tân Uyên,","Giấy Phế Liệu__Vải Vụn, Giẻ Lau Máy__Bao Bì PE, PP, HDPE, LDPE (Dạng Tấm, Cuộn, Túi)",,'0792888758__01212888758',Bà Hồ Thị Tiển,,female,,hotien220791@gmail.com,https://www.yellowpages.vn/lgs/1187840853/co-so-bao-loc-phat.html
Bao PP Dệt Tiến Minh - Công Ty TNHH Phát Triển Dịch Vụ & Kinh Doanh Tổng Hợp Tiến Minh,"Số 486 Ngọc Hồi, Thị Trấn Văn Điển, H. Thanh Trì,","Bao Jumbo__Bao PP Dệt__Bao Bì PE, PP, HDPE, LDPE (Dạng Tấm, Cuộn, Túi)__Bao Tải Dứa",www.baobitienminh.bizz.vn,'0916193386',Ông Vũ Văn Minh,,male,,tienminh.ctbb@gmail.com,https://www.yellowpages.vn/lgs/1187840889/bao-pp-det-tien-minh-cong-ty-tnhh-phat-trien-dich-vu---kinh-doanh-tong-hop-tien-minh.html
Công Ty TNHH Nam Phương Tấn Đạt,"572 Nguyễn Văn Khạ, ấp Cây Trắc, X. Phú Hòa Đông, H. Củ Chi,","Thùng Carton 7 Lớp__Thùng Carton 5 Lớp__Bao Bì Nhựa__Bao Bì PE, PP, HDPE, LDPE (Dạng Tấm, Cuộn, Túi)__Thùng Carton 3 Lớp__Bao Bì - Nhà Sản Xuất và Kinh Doanh__Bao Bì Carton",www.namphuongtandat.vn,'0916189739',Mr. Duy,,male,TP. Kinh Doanh,info@namphuongtandat.com,https://www.yellowpages.vn/lgs/1187709840/cong-ty-tnhh-nam-phuong-tan-dat.html
Công Ty TNHH MTV Sản Xuất Thương Mại Hạo Phát,"36C/33 Đường 762 Hồng Bàng, Phường 1, Quận 11,","Bao Bì PE, PP, HDPE, LDPE (Dạng Tấm, Cuộn, Túi)",,'0908750968__0938951088',Bà Trần Thị Thu Hà,,female,,mtvhaophat@gmail.com,https://www.yellowpages.vn/lgs/1187792799/cong-ty-tnhh-mtv-san-xuat-thuong-mai-hao-phat.html
Công Ty CP Môi Trường Và Bao Bì Việt Nam,"TT DV Nông Nghiệp Huyện Mai Sơn, X. Cò Nòi, H. Mai Sơn,","Thùng Carton, Thùng Giấy__Tư Vấn Môi trường - Công Ty Tư Vấn Môi Trường__Bao Bì PE, PP, HDPE, LDPE (Dạng Tấm, Cuộn, Túi)__Bạt Nhựa, Bạt Che Nắng, Bạt Che Mưa__Bao Container, Bao Jumbo, Bao Bigbag",www.vinaenpa.com,'0975746416',Mr. Lê Mạnh Cường,,male,,lemanhcuong89@gmail.com,https://www.yellowpages.vn/lgs/1187893002/cong-ty-cp-moi-truong-va-bao-bi-viet-nam.html
Bao Bì Hoàng Long - Công Ty TNHH Bao Bì Hoàng Long,"Khu Thượng, Xã Tráng Liệt, H. Bình Giang,","Bao Bì Màng Ghép, Bao Bì Màng Phức Hợp__Bao Tải Dứa__Bao Bì PE, PP, HDPE, LDPE (Dạng Tấm, Cuộn, Túi)__Bao Bì Nhựa__Bao PP Dệt",www.baobihoanglong.vn,'0973055055',Ông Nguyễn Việt Dũng,,male,,vietdung77@gmail.com,https://www.yellowpages.vn/lgs/1187794839/bao-bi-hoang-long-cong-ty-tnhh-bao-bi-hoang-long.html
Nhựa Thu Phát - Công Ty TNHH SXTM Nhựa Thu Phát,"Số 13, Đường Số 4, P. Tân Tạo A, Q. Bình Tân,","Túi Nilon PE, Túi PP, Túi HDPE,.__Bao Bì PE, PP, HDPE, LDPE (Dạng Tấm, Cuộn, Túi)__Bao Bì Nhựa__Túi OPP__Hạt Nhựa, Hạt Nhựa Nguyên Sinh",www.nhuathuphat.com,'0945858168',Ms. Hồ Quế Ngân,,female,Giám đốc,nhuathuphat@gmail.com,https://www.yellowpages.vn/lgs/1187863845/nhua-thu-phat-cong-ty-tnhh-sxtm-nhua-thu-phat.html
Cơ Sở Tân Phương Nam,"93 Truông Tre, P. Dĩ An, TX  Dĩ An,","Túi, Bao Zipper, Ziplock__Túi Nilon PE, Túi PP, Túi HDPE,.__Bao Bì PE, PP, HDPE, LDPE (Dạng Tấm, Cuộn, Túi)",www.tanphuongnam.bizz.vn,'0908450474__0909134156__0933790167',Vũ Thị Thu Hiền,,,Kinh Doanh,tanphuongnambd@gmail.com,https://www.yellowpages.vn/lgs/1187716194/co-so-tan-phuong-nam.html
Nông Sản Gia Vị Phương Trang,"130/75 Phạm Văn Hai, P. 2, Q. Tân Bình,","Bao Bì PE, PP, HDPE, LDPE (Dạng Tấm, Cuộn, Túi)__Nông Sản Gia Vị (Gừng, Nghệ, Quế, Hồi, Sả,..)__Nông Sản__Gia Vị - Chế Biến và Kinh Doanh",www.nongsangiavi.vn,'0903833301__0918615401',Ms. Nguyễn Thị Thùy Trang,,female,,nongsangiavi@gmail.com,https://www.yellowpages.vn/lgs/1187884680/nong-san-gia-vi-phuong-trang.html
Bao Bì Nam Việt - Công Ty Bao Bì Nam Việt,"Khu Phố 9, Phường Phú Hòa, TP. Thủ Dầu Một,","Màng Phủ Nông Nghiệp, Ngư Nghiệp__Bao Bì PE, PP, HDPE, LDPE (Dạng Tấm, Cuộn, Túi)__Bao Bì Nhựa__Màng PE, Màng Chít - Nhà Sản Xuất__Bao Bì - Nhà Sản Xuất và Kinh Doanh__Bao Bì Carton",www.namvietbaobi.com.vn,'02743800088__0981540008__02743380088',Trần Thị Việt Linh,,,,baobinamvietbinhduong@gmail.com,https://www.yellowpages.vn/lgs/1187836629/bao-bi-nam-viet-cong-ty-bao-bi-nam-viet.html
Công Ty TNHH Sản Xuất Dịch Vụ Minh Phát,"2/4 Ấp Hưng Lân, Nguyễn Thị Sóc, X. Bà Điểm, H. Hóc Môn,","Đồ Nội Thất Văn Phòng__Đồ Nội Thất - Thiết Kế Và Sản Xuất, Lắp Đặt Đồ Nội Thất__Đồ Nội Thất Gia Đình__Bao Bì PE, PP, HDPE, LDPE (Dạng Tấm, Cuộn, Túi)",www.baobinoithat.com,'0918264016__02838835789',Ms. Xuân,,female,Kinh doanh,mppolybag@yahoo.com,https://www.yellowpages.vn/lgs/695901/cong-ty-tnhh-san-xuat-dich-vu-minh-phat.html
Bao Bì Nhựa Hoài Anh - Công Ty TNHH Đầu Tư Và Thương Mại Hoài Anh,"Số 90/73 Nguyễn Lương Bằng, Đống Đa,","Bao Bì Màng Ghép, Bao Bì Màng Phức Hợp__Bao Bì PE, PP, HDPE, LDPE (Dạng Tấm, Cuộn, Túi)__Bao Bì Nhựa",www.nhuahoaianh.com,'0975092238__02435334285',Mr. Trần Tuấn,,male,Tp. Kinh doanh,kdnhuahoaianh@gmail.com,https://www.yellowpages.vn/lgs/1187790753/bao-bi-nhua-hoai-anh-cong-ty-tnhh-dau-tu-va-thuong-mai-hoai-anh.html
Công Ty Cổ Phần Hóa Chất Nhựa,"Tòa Nhà Plaschem, 562 Nguyễn Văn Cừ, P. Gia Thụy, Q. Long Biên,","Bạt Nhựa, Bạt Che Nắng, Bạt Che Mưa__Bao Xi Măng__Bao Bì PE, PP, HDPE, LDPE (Dạng Tấm, Cuộn, Túi)__Bao Container, Bao Jumbo, Bao Bigbag",www.tuphuongjumbobag.com.vn__www.tuphuongtarpaulin.com.vn,'02438723566',Ông Bùi Tố Minh,,male,,,https://www.yellowpages.vn/lgs/1187737473/cong-ty-co-phan-hoa-chat-nhua.html
Bao Bì Nhựa Phú Ân - Công Ty TNHH Phú Ân,"53/7A Lê Liễu, P. Tân Quý, Q. Tân Phú,","Bao Bì Màng Ghép, Bao Bì Màng Phức Hợp__In Bao Bì Nhựa, In Màng Co, Màng Ghép, In ống Đồng__Bao Bì PE, PP, HDPE, LDPE (Dạng Tấm, Cuộn, Túi)__Bao Bì Nhựa__Túi, Bao Zipper, Ziplock__In Bao Bì - Công Ty Thiết Kế và In ấn Bao Bì__Bao Bì - Nhà Sản Xuất và Kinh Doanh",www.phuanco.com.vn,'0909931802__02835591464__0989198307',Mr. Đào Ngọc Sáng,,male,Nhân viên kinh doanh,baobinhua01@gmail.com,https://www.yellowpages.vn/lgs/1187776050/bao-bi-nhua-phu-an-cong-ty-tnhh-phu-an.html
Tiền Phong - Công Ty Cổ Phần Bao Bì Tiền Phong,"2 An Đà, Q. Ngô Quyền,","Bao Xi Măng__Bao Bì PE, PP, HDPE, LDPE (Dạng Tấm, Cuộn, Túi)__Bao Bì Nhựa",www.baobitienphong.vn,'02253640551__0313640551',Ms Lan,,female,Nv Văn Phòng,,https://www.yellowpages.vn/lgs/740733/tien-phong-cong-ty-co-phan-bao-bi-tien-phong.html
Công Ty TNHH Sản Xuất Thương Mại Hằng Sinh,"243A Quốc Lộ 50, X. Đa Phước, H. Bình Chánh,","Bao Bì - Nhà Sản Xuất và Kinh Doanh__Nhựa - Các Công Ty Nhựa__Bao Bì PE, PP, HDPE, LDPE (Dạng Tấm, Cuộn, Túi)__Bao Bì Nhựa",,'02837780020__0903834660',Ông Lâm Viễn Lương,,male,Giám Đốc,,https://www.yellowpages.vn/lgs/1003539/cong-ty-tnhh-san-xuat-thuong-mai-hang-sinh.html
Công Ty TNHH Sản Xuất Thương Mại XNK Nhựa Phương Nam,"183/26G/1 Tân Hòa Đông, P.14, Q.6","Hạt Nhựa Màu__Phụ Gia Ngành Nhựa (Chống oxi hóa, Kháng UV, Tăng Trắng, Trong,.)__Bao Bì PE, PP, HDPE, LDPE (Dạng Tấm, Cuộn, Túi)__Bột Đá, Bột Đá CaCO3",www.southernplastic.ticc.vn,'__0919013488__02866758108',Ms Diệp,,female,,,https://www.yellowpages.vn/lgs/1187721240/cong-ty-tnhh-san-xuat-thuong-mai-xnk-nhua-phuong-nam.html
Công Ty TNHH ứng Dụng Công Nghệ Và Phát Triển Thương Mại Hoàng Lưu,"Số 39/40/93, Phố Ngọc Trục, Ph. Đại Mỗ, Q. Nam Từ Liêm,","In Bao Bì - Công Ty Thiết Kế và In ấn Bao Bì__Túi Nilon PE, Túi PP, Túi HDPE,.__Bao Bì PE, PP, HDPE, LDPE (Dạng Tấm, Cuộn, Túi)__Túi Giấy, Túi Giấy Kraft",www.hoangluu.com.vn,'0963331162__02437263556',Bà Phạm Thị Mai Hương,,female,,huong.ptm@hoangluu.com.vn,https://www.yellowpages.vn/lgs/1187749836/cong-ty-tnhh-ung-dung-cong-nghe-va-phat-trien-thuong-mai-hoang-luu.html
Bao Bì Khang Lợi - Công Ty TNHH Thương Mại Dịch Vụ Sản Xuất Bao Bì Khang Lợi,"858/22A, QL 1A, Khu Phố 7, P. Bình Trị Đông A, Q. Bình Tân","Bao Bì Màng Ghép, Bao Bì Màng Phức Hợp__Túi Nilon PE, Túi PP, Túi HDPE,.__Bao Bì PE, PP, HDPE, LDPE (Dạng Tấm, Cuộn, Túi)__Bao Bì Nhựa__Túi, Bao Zipper, Ziplock__Bao Bì Thực Phẩm",www.baobikhangloi.bizz.vn__www.baobikhangloi.com.vn,'0902409906__02838777899',Ms.Ngân,,female,,baobikhangloi@gmail.com,https://www.yellowpages.vn/lgs/1187755119/bao-bi-khang-loi-cong-ty-tnhh-thuong-mai-dich-vu-san-xuat-bao-bi-khang-loi.html
Công Ty Việt Đức Phú Thọ,"Thị trấn Lâm Thao, H. Lâm Thao,","Bao Bì PE, PP, HDPE, LDPE (Dạng Tấm, Cuộn, Túi)",,'02103825008',,,,,,https://www.yellowpages.vn/lgs/739350/cong-ty-viet-duc-phu-tho.html
Doanh Nghiệp Tư Nhân Hào Danh,"139 Đường số 16, P. Bình Hưng Hòa, Q. Bình Tân,","Bao Bì PE, PP, HDPE, LDPE (Dạng Tấm, Cuộn, Túi)__Bao Bì Nhựa",,'0912195385',,,,,,https://www.yellowpages.vn/lgs/1187756751/doanh-nghiep-tu-nhan-hao-danh.html
Doanh Nghiệp Tư Nhân Tân Đại Thành,"12/2 Quang Trung, P. 12, Q. Gò Vấp,","Bao Bì PE, PP, HDPE, LDPE (Dạng Tấm, Cuộn, Túi)",,'02839872377',,,,,,https://www.yellowpages.vn/lgs/1021587/doanh-nghiep-tu-nhan-tan-dai-thanh.html
Công Ty TNHH Nhựa Cường Thịnh,"B12/12M Cây Bàng, ấp 2, Tân Kiên, H. Bình Chánh,","Bao Bì PE, PP, HDPE, LDPE (Dạng Tấm, Cuộn, Túi)__Bao Bì Nhựa",,'02837565235__0906406209',Chị Yến,,,,baobinhuacuongthinh@gmail.com,https://www.yellowpages.vn/lgs/1187727270/cong-ty-tnhh-nhua-cuong-thinh.html
Công Ty TNHH SX TM Thái Thịnh,"83/9A Hậu Giang, P. 5, Q. 6,","Dây Đai Nhựa__Băng Keo, Băng Dính__Bao Bì PE, PP, HDPE, LDPE (Dạng Tấm, Cuộn, Túi)",www.giaiphapdonghang.com,'0919233979',Mr. Đình Chương,,male,Giám đốc kinh doanh,thicongredep@gmail.com,https://www.yellowpages.vn/lgs/1187916777/cong-ty-tnhh-sx-tm-thai-thinh.html
Riches Viet Nam - Công Ty TNHH Bao Bì Kỹ Thuật Cao Riches Việt Nam,"Khu Công Nghiệp Amata, 104/1 Lô A, Đường Số 2, P. Long Bình, Tp. Biên Hòa,","Bao Bì PE, PP, HDPE, LDPE (Dạng Tấm, Cuộn, Túi)",,'02513936811',,,,,,https://www.yellowpages.vn/lgs/715518/riches-viet-nam-cong-ty-tnhh-bao-bi-ky-thuat-cao-riches-viet-nam.html
Công Ty TNHH MTV Minh Hoàn Cầu,"Tổ 10, Khu Phước Hải, TT. Long Thành, H. Long Thành,","Thùng Carton, Thùng Giấy__Vật Liệu Đóng Gói__Túi Nilon PE, Túi PP, Túi HDPE,.__Bao Bì PE, PP, HDPE, LDPE (Dạng Tấm, Cuộn, Túi)__Bao Bì Nhựa__Màng PE Quấn Pallet",www.minhhoancau.com.vn,'0902809826__0933613960__02512640534',Hotline,X,,,minhhoancau@gmail.com,https://www.yellowpages.vn/lgs/1187796108/cong-ty-tnhh-mtv-minh-hoan-cau.html
Công ty TNHH MTV Hoàng Công Hưng,"49 đường Thân Công Tài, khu Phước Lý 4, P.Hòa An, Q.Cẩm Lệ,","In Bao Bì Nhựa, In Màng Co, Màng Ghép, In ống Đồng__Bao Bì PE, PP, HDPE, LDPE (Dạng Tấm, Cuộn, Túi)",,'0905541636__0919077981',Ms. Nguyễn Thị Hồng Đào,,female,,hongdao1982@gmail.com,https://www.yellowpages.vn/lgs/1187764158/cong-ty-tnhh-mtv-hoang-cong-hung.html
Mùn Cưa Hoàng Trọng Nghĩa - Công Ty TNHH MTV Thương Mại Dịch Vụ Hoàng Trọng Nghĩa,"111/20B KP. Đông Thành, P. Tân Đông Hiệp, TX. Dĩ An,","Bột Nhang, Bột Làm Nhang__Củi Trấu, Viên Nén Gỗ, Dăm Gỗ, Mùn Cưa__Bao Bì PE, PP, HDPE, LDPE (Dạng Tấm, Cuộn, Túi)",,'0937441990',Mr. Hoàng Văn Tình,,male,,,https://www.yellowpages.vn/lgs/1187898120/mun-cua-hoang-trong-nghia-cong-ty-tnhh-mtv-thuong-mai-dich-vu-hoang-trong-nghia.html
Công Ty TNHH Long Victory,"CN 16, Ô 2B, Đường N3, KCN Sóng Thần 3, P. Phú Tân, TP. Thủ Dầu Một","Bao Bì PE, PP, HDPE, LDPE (Dạng Tấm, Cuộn, Túi)",,'0355996590__02743669962__0825563199',Ms. Trần Thị Vân,,female,Nhân viên Kinh Doanh,dinhtoantw20190301@gmail.com,https://www.yellowpages.vn/lgs/1187907903/cong-ty-tnhh-long-victory.html
Bao Bì Thuận Phát - Công Ty TNHH Đầu Tư Bao Bì Thuận Phát,"53 đường số 9, KDC Himlam, xã Bình Hưng, huyện Bình Chánh,","Bao Bì Màng Ghép, Bao Bì Màng Phức Hợp__Bao Bì Nông Nghiệp__Bao Bì PE, PP, HDPE, LDPE (Dạng Tấm, Cuộn, Túi)__Bao Jumbo__Bao PP Dệt__Bao Bì - Nhà Sản Xuất và Kinh Doanh__Bao Container, Bao Jumbo, Bao Bigbag",www.baobithuanphat.com.vn,'0903992902__0932661077__02862631831',Ms An,,female,,baobinhuathuanphat@gmail.com,https://www.yellowpages.vn/lgs/1187778414/bao-bi-thuan-phat-cong-ty-tnhh-dau-tu-bao-bi-thuan-phat.html
Công Ty TNHH Đầu Tư ứng Dụng Sản Xuất Bao Bì,"11 Hàng Chiếu, Q. Hoàn Kiếm,","Bao Bì PE, PP, HDPE, LDPE (Dạng Tấm, Cuộn, Túi)",,'02438243672',,,,,,https://www.yellowpages.vn/lgs/1302627/cong-ty-tnhh-dau-tu-ung-dung-san-xuat-bao-bi.html
Phúc Hải - Công Ty TNHH Phúc Hải,"329 Gia Phú, P. 1, Q. 6,","Bao Bì PE, PP, HDPE, LDPE (Dạng Tấm, Cuộn, Túi)",,'02839520176',,,,,,https://www.yellowpages.vn/lgs/1018035/phuc-hai-cong-ty-tnhh-phuc-hai.html
Công Ty TNHH SX TM Thái Thịnh,"83/9A Hậu Giang, P. 5, Q. 6,","Dây Đai Nhựa__Băng Keo, Băng Dính__Bao Bì PE, PP, HDPE, LDPE (Dạng Tấm, Cuộn, Túi)",www.giaiphapdonghang.com,'0919233979',Mr. Đình Chương,,male,Giám đốc kinh doanh,thicongredep@gmail.com,https://www.yellowpages.vn/lgs/1187916777/cong-ty-tnhh-sx-tm-thai-thinh.html
Công Ty TNHH Thương Mại Thành Luân,"310 Lê Duẩn, Q. Kiến An,","Túi Phân Hủy Sinh Học__Bao Bì PE, PP, HDPE, LDPE (Dạng Tấm, Cuộn, Túi)__Bao Bì Nhựa",www.baobithanhluan.com,'0961568557__02253542199',Ông Đỗ Thành Luân,,male,,Thanhluan.ltd@gmail.com,https://www.yellowpages.vn/lgs/1187782290/cong-ty-tnhh-thuong-mai-thanh-luan.html
Công Ty TNHH Sản Xuất Thương Mại Hằng Sinh,"243A Quốc Lộ 50, X. Đa Phước, H. Bình Chánh,","Bao Bì - Nhà Sản Xuất và Kinh Doanh__Nhựa - Các Công Ty Nhựa__Bao Bì PE, PP, HDPE, LDPE (Dạng Tấm, Cuộn, Túi)__Bao Bì Nhựa",,'02837780020__0903834660',Ông Lâm Viễn Lương,,male,Giám Đốc,,https://www.yellowpages.vn/lgs/1003539/cong-ty-tnhh-san-xuat-thuong-mai-hang-sinh.html
Doanh Nghiệp Tư Nhân Tam Hợp Thành,"21/4C, KP 6, P. Tam Hiệp, Tp. Biên Hòa,","Bao Bì PE, PP, HDPE, LDPE (Dạng Tấm, Cuộn, Túi)__Bao Bì Nhựa__Khuôn Mẫu__Khuôn Dập (Dập Nóng, Lạnh, Vuốt, Liên Hoàn)__Khuôn Bế, Khuôn dao dập",,'02512222311__0908380207',Ông Lê Công Toàn,,male,Chủ cở sở,toanhopthanh@gmail.com,https://www.yellowpages.vn/lgs/1187706510/doanh-nghiep-tu-nhan-tam-hop-thanh.html
Doanh Nghiệp Tư Nhân Tân Đại Thành,"12/2 Quang Trung, P. 12, Q. Gò Vấp,","Bao Bì PE, PP, HDPE, LDPE (Dạng Tấm, Cuộn, Túi)",,'02839872377',,,,,,https://www.yellowpages.vn/lgs/1021587/doanh-nghiep-tu-nhan-tan-dai-thanh.html
Bao Bì Thuận Phát - Công Ty TNHH Đầu Tư Bao Bì Thuận Phát,"53 đường số 9, KDC Himlam, xã Bình Hưng, huyện Bình Chánh,","Bao Bì Màng Ghép, Bao Bì Màng Phức Hợp__Bao Bì Nông Nghiệp__Bao Bì PE, PP, HDPE, LDPE (Dạng Tấm, Cuộn, Túi)__Bao Jumbo__Bao PP Dệt__Bao Bì - Nhà Sản Xuất và Kinh Doanh__Bao Container, Bao Jumbo, Bao Bigbag",www.baobithuanphat.com.vn,'0903992902__0932661077__02862631831',Ms An,,female,,baobinhuathuanphat@gmail.com,https://www.yellowpages.vn/lgs/1187778414/bao-bi-thuan-phat-cong-ty-tnhh-dau-tu-bao-bi-thuan-phat.html
Công Ty TNHH Bảo Hộ Lao Động Bảo Long,"Tổ 20/20D, Kp. 4, P. Trảng Dài, Tp. Biên Hòa,","áo Mưa Cánh Dơi - Sản Xuất Và Bán Buôn__Bao Bì PE, PP, HDPE, LDPE (Dạng Tấm, Cuộn, Túi)__Bao Jumbo__áo Mưa Bộ__áo Mưa - Công Ty áo Mưa, Sản Xuất và Bán Buôn",www.https://www.facebook.com/BHLDbaolong/,'0888594885__0908807058',Trần Thị Lan Anh,,,GĐ Bán Hàng,baoho.dn@gmail.com,https://www.yellowpages.vn/lgs/1187791716/cong-ty-tnhh-bao-ho-lao-dong-bao-long.html
Lai Trường Sơn - Công Ty TNHH Thương Mại & Sản Xuất Bao Bì Lai Trường Sơn,"730/77 Hương Lộ 2, P. Bình Trị Đông A, Q. Bình Tân,","Bao Bì PE, PP, HDPE, LDPE (Dạng Tấm, Cuộn, Túi)",,'02838775982',,,,,,https://www.yellowpages.vn/lgs/999837/lai-truong-son-cong-ty-tnhh-thuong-mai---san-xuat-bao-bi-lai-truong-son.html
Tân Hoàng Dung - Chi Nhánh Công Ty TNHH Sản Xuất Thương Mại Tân Hoàng Dung,"15 Trần Điện, P. 10, Q. 5,","Bao Bì PE, PP, HDPE, LDPE (Dạng Tấm, Cuộn, Túi)",,'02838558407',,,,,,https://www.yellowpages.vn/lgs/697572/tan-hoang-dung-chi-nhanh-cong-ty-tnhh-san-xuat-thuong-mai-tan-hoang-dung.html
Công Ty TNHH Long Victory,"CN 16, Ô 2B, Đường N3, KCN Sóng Thần 3, P. Phú Tân, TP. Thủ Dầu Một","Bao Bì PE, PP, HDPE, LDPE (Dạng Tấm, Cuộn, Túi)",,'0355996590__02743669962__0825563199',Ms. Trần Thị Vân,,female,Nhân viên Kinh Doanh,dinhtoantw20190301@gmail.com,https://www.yellowpages.vn/lgs/1187907903/cong-ty-tnhh-long-victory.html
Công Ty TNHH Thư Gia Nguyễn,"K171/9/4 Tôn Đản, P. Hoà An, Q. Cẩm Lệ","Văn Phòng Phẩm - Công Ty Văn Phòng Phẩm__Băng Keo, Băng Dính__Bao Bì PE, PP, HDPE, LDPE (Dạng Tấm, Cuộn, Túi)",,'0985041004',Ms. Nguyễn Thị Mỹ Phúc,,female,,thugianguyen0210@gmail.com,https://www.yellowpages.vn/lgs/1187888031/cong-ty-tnhh-thu-gia-nguyen.html
Tiền Phong - Công Ty Cổ Phần Bao Bì Tiền Phong,"2 An Đà, Q. Ngô Quyền,","Bao Xi Măng__Bao Bì PE, PP, HDPE, LDPE (Dạng Tấm, Cuộn, Túi)__Bao Bì Nhựa",www.baobitienphong.vn,'02253640551__0313640551',Ms Lan,,female,Nv Văn Phòng,,https://www.yellowpages.vn/lgs/740733/tien-phong-cong-ty-co-phan-bao-bi-tien-phong.html
Công Ty TNHH Yize Việt Nam,"Khu Liền Kề KCN Quế Võ, X. Phương Liễu, H. Quế Võ,","Bao Bì PE, PP, HDPE, LDPE (Dạng Tấm, Cuộn, Túi)",,'0978956729',,,,,,https://www.yellowpages.vn/lgs/1187885079/cong-ty-tnhh-yize-viet-nam.html
Công Ty TNHH FP Tech Vina,"Số 32, Xóm Đông Ba, Khu Đọ Xá, P. Ninh Xá, TP. Bắc Ninh,","In Bao Bì Nhựa, In Màng Co, Màng Ghép, In ống Đồng__Màng Co PE, LDPE, PVC, POF,.__Bao Bì PE, PP, HDPE, LDPE (Dạng Tấm, Cuộn, Túi)",,'0984932299',Mr Quỳnh,,male,,,https://www.yellowpages.vn/lgs/1187839017/cong-ty-tnhh-fp-tech-vina.html
Công Ty TNHH Bao Bì Tuấn Đạt,"73/5 Tô Ngọc Vân, P. Thanh Xuân, Q. 12,","Bao Bì PE, PP, HDPE, LDPE (Dạng Tấm, Cuộn, Túi)",,'0984227991',Võ Thị Vĩ Hạ,,,,vothiviha@gmail.com,https://www.yellowpages.vn/lgs/1187800659/cong-ty-tnhh-bao-bi-tuan-dat.html
Công Ty Cổ Phần Bao Bì Nhựa Tân Hiệp Lợi,"4343 Nguyễn Cửu Phú, Khu phố 4,  P. Tân Tạo A, Q. Tân Bình,","Bao Bì Màng Ghép, Bao Bì Màng Phức Hợp__Bao Bì Dược Phẩm__Bao Bì PE, PP, HDPE, LDPE (Dạng Tấm, Cuộn, Túi)__Bao Bì Nhựa__Bao Bì Thực Phẩm",www.tanhieploi.com,'0837545213__02837545213',Mr. Song,,male,,duongsong@tanhieploi.com.vn,https://www.yellowpages.vn/lgs/696525/cong-ty-co-phan-bao-bi-nhua-tan-hiep-loi.html
Công Ty Việt Đức Phú Thọ,"Thị trấn Lâm Thao, H. Lâm Thao,","Bao Bì PE, PP, HDPE, LDPE (Dạng Tấm, Cuộn, Túi)",,'02103825008',,,,,,https://www.yellowpages.vn/lgs/739350/cong-ty-viet-duc-phu-tho.html
Công Ty TNHH Sản Xuất Thương Mại Bao Bì Nhựa Cường Thịnh Phúc,"A5/6c Nguyễn Cữu Phú, ấp 01, X. Tân Kiên, H. Bình Chánh,","Cốc Nhựa Dùng 1 Lần, Hộp Nhựa Dùng 1 Lần,..Các Loại Nhựa Dùng 1 Lần__Bao Bì Thực Phẩm__Bao Bì May Mặc__Bao Bì PE, PP, HDPE, LDPE (Dạng Tấm, Cuộn, Túi)",www.cuongthinhphuc.vn,'0932663789__0280932653789',,,,,,https://www.yellowpages.vn/lgs/1187783508/cong-ty-tnhh-san-xuat-thuong-mai-bao-bi-nhua-cuong-thinh-phuc.html
Công Ty TNHH Thương Mại Nguyễn Khánh,"19/4 Khu Phố 2, P. Tân Thới Nhất, Q. 12,","Ly Giấy, Tô Giấy, Cốc Giấy - Sản Xuất và Kinh Doanh__Bao Bì - Nhà Sản Xuất và Kinh Doanh__Bao Bì PE, PP, HDPE, LDPE (Dạng Tấm, Cuộn, Túi)__Bao Bì Nhựa",,'02862561103',Ông Nguyễn Hiệp,,male,Giám Đốc,hiep.vietcoffee@gmail.com,https://www.yellowpages.vn/lgs/1187712297/cong-ty-tnhh-thuong-mai-nguyen-khanh.html
Công Ty Cổ Phần Sài Gòn Asia,"Phòng 606, Khu B, Toà Nhà Indochina, Nguyễn Đình Chiểu, P. Đa Kao, Q. 1,","Bao Giấy Kraft__Bao Bì PE, PP, HDPE, LDPE (Dạng Tấm, Cuộn, Túi)__Túi Vải Không Dệt__Bao PP Dệt__Bao Bì - Nhà Sản Xuất và Kinh Doanh__Bao Container, Bao Jumbo, Bao Bigbag",www.baobimiennam.com,'0907373345',Lê Thanh Tùng,,,,ctcpasia@gmail.com,https://www.yellowpages.vn/lgs/1187716227/cong-ty-co-phan-sai-gon-asia.html
Bao Bì Sen Việt - Công Ty Cổ Phần Bao Bì Sen Việt,"Ấp Voi Lá, TT. Bến Lức, H. Bến Lức,","Bao Bì - Nhà Sản Xuất và Kinh Doanh__Bao PP Dệt__Bao Bì PE, PP, HDPE, LDPE (Dạng Tấm, Cuộn, Túi)",www.senviet.net.vn,'0913944095',Hotline,X,,,info@senviet.net.vn,https://www.yellowpages.vn/lgs/1187863701/bao-bi-sen-viet-cong-ty-co-phan-bao-bi-sen-viet.html
