company,address,industry,website,phone,contact_person,is_hotline,gender,position,email,url
Bao Bì Phương Anh - Công Ty TNHH MTV Sản Xuất Thương Mại Và Dịch Vụ Phương Anh,"Số 237, Tổ 13, Ấp 3, X. Tân Long, H. Phú Giáo,","Bao Bì PE, PP, HDPE, LDPE (Dạng Tấm, Cuộn, Túi)__Bao Bì Nhựa",www.phuonganh.bizz.vn,'02743552180__0375991180__0909145009',Ông Bùi Đăng Khoa,,male,,hangvu237@gmail.com,https://www.yellowpages.vn/lgs/1187752644/bao-bi-phuong-anh-cong-ty-tnhh-mtv-san-xuat-thuong-mai-va-dich-vu-phuong-anh.html
Công Ty TNHH KOHSEI MULTIPACK Việt Nam,"Lô C, KCN Bình Xuyên, H. Bình Xuyên,","Bao Big Bag Cũ__Túi Nilon PE, Túi PP, Túi HDPE,.__Bao Bì PE, PP, HDPE, LDPE (Dạng Tấm, Cuộn, Túi)__Bao Jumbo__Bao Bì - Nhà Sản Xuất và Kinh Doanh__Bao Container, Bao Jumbo, Bao Bigbag",www.kmvfibc.com,'84915205248__84966205248__02113593411',Mr. Nguyễn Hoàng Việt,,male,Nhân viên kinh doanh,business@kmvina.com.vn,https://www.yellowpages.vn/lgs/1187710623/cong-ty-tnhh-kohsei-multipack-viet-nam.html
Bao Bì An Phú - Công Ty TNHH Sản Xuất Bao Bì An Phú,"Số 149/2C Đường 45, P. Hiệp Bình Chánh, Q. Thủ Đức,","Màng PE, Màng Chít - Nhà Sản Xuất__Túi Nilon PE, Túi PP, Túi HDPE,.__Bao Bì PE, PP, HDPE, LDPE (Dạng Tấm, Cuộn, Túi)__Bao Bì Nhựa__Màng PE Quấn Pallet__Nhựa - Dịch Vụ Sản Xuất, Gia Công Theo Yêu Cầu__Bao PP Dệt__Túi, Bao Zipper, Ziplock__Màng Co PE, LDPE, PVC, POF,.__Túi Đựng Rác (Túi Đựng Rác y Tế, Công Nghiệp, Màu Đen, Dạng Cuộn)",www.baobianphu.bizz.vn,'0933335590__0903762562__0888989345__0332222000',Ông Đặng Văn Vũ,,male,,vudangvietnam@yahoo.com.vn,https://www.yellowpages.vn/lgs/1187767740/bao-bi-an-phu-cong-ty-tnhh-san-xuat-bao-bi-an-phu.html
Công Ty TNHH Thái Hiệp,"430/3 Tân Kỳ Tân Quý, P. Sơn Kỳ, Q. Tân Phú,","Dây Nilon__Bao Bì PE, PP, HDPE, LDPE (Dạng Tấm, Cuộn, Túi)",,'0903304931__02839612055',Mr. Chiêu,,male,Giám Đốc,thahico@yahoo.com,https://www.yellowpages.vn/lgs/1187765439/cong-ty-tnhh-thai-hiep.html
Công Ty CP Bao Bì Đồng Phú,"Thôn Đông Khúc, Xã Vĩnh Khúc, Huyện Văn Giang,","Bao Bì PE, PP, HDPE, LDPE (Dạng Tấm, Cuộn, Túi)",www.baobidongphu.vn,'02213980548__0913224780',Nguyễ Thị Mai Phương,,,CT HĐQT,baobidongphu2017@gmail.com,https://www.yellowpages.vn/lgs/1187801388/cong-ty-cp-bao-bi-dong-phu.html
Bao Bì Sài Gòn Xanh - Công Ty TNHH Bao Bì Sài Gòn Xanh,"139/33 Dương Văn Dương, Phường Tân Qúy, Quận Tân Phú,","Bao Bì - Nhà Sản Xuất và Kinh Doanh__Bao Bì PE, PP, HDPE, LDPE (Dạng Tấm, Cuộn, Túi)__Bao Bì Nhựa",www.baobisaigonxanh.com.vn,'02837673091__02837673092',Phòng KD,,,,baobisaigonxanh.com.vn,https://www.yellowpages.vn/lgs/1187829636/bao-bi-sai-gon-xanh-cong-ty-tnhh-bao-bi-sai-gon-xanh.html
Bao Bì Nhựa Cường Thịnh Phát - Công Ty TNHH Thương Mại & Sản Xuất Bao Bì Nhựa Cường Thịnh Phát,"309B2/4 Đường Bảy Tấn, ấp 2, X. An Phú Tây, H. Bình Chánh,","Bao Bì Màng Ghép, Bao Bì Màng Phức Hợp__Bao Bì PE, PP, HDPE, LDPE (Dạng Tấm, Cuộn, Túi)__Bao Bì Nhựa",,'02837690518__0903810217',Mr. Bình,,male,,cuongthinhphat2@gmail.com,https://www.yellowpages.vn/lgs/1187736594/bao-bi-nhua-cuong-thinh-phat-cong-ty-tnhh-thuong-mai---san-xuat-bao-bi-nhua-cuong-thinh-phat.html
Công Ty TNHH Đại Việt Tiến,"Khu phố 1, Phường Tân Định, Thị xã Bến Cát,","Bao Bì PE, PP, HDPE, LDPE (Dạng Tấm, Cuộn, Túi)",,'01672643537',Ngô Khánh Dương,,,Giám Đốc,duongngo1993@gmail.com,https://www.yellowpages.vn/lgs/1187756799/cong-ty-tnhh-dai-viet-tien.html
Bao Bì Tân Thuận Thiên - Công Ty TNHH Sản Xuất Bao Bì Tân Thuận Thiên,"302/15 Phan Huy ích, P. 12, Q. Gò Vấp,","Bao Bì Màng Ghép, Bao Bì Màng Phức Hợp__Túi Nilon PE, Túi PP, Túi HDPE,.__Túi Phân Hủy Sinh Học__Bao Bì PE, PP, HDPE, LDPE (Dạng Tấm, Cuộn, Túi)",www.tanthuanthienco.com,'02862570646__0908979749',Mr. Nguyễn Trí Dũng,,male,,ntridunghcm@gmail.com,https://www.yellowpages.vn/lgs/1187683500/bao-bi-tan-thuan-thien-cong-ty-tnhh-san-xuat-bao-bi-tan-thuan-thien.html
Bao Bì An Phú Minh - Công Ty TNHH MTV An Phú Minh,"Cụm Công Nghiệp Diên Sanh, Thị Trấn Hải Lăng, H. Hải Lăng","Bao Bì - Nhà Sản Xuất và Kinh Doanh__Bao PP Dệt__Bao Bì PE, PP, HDPE, LDPE (Dạng Tấm, Cuộn, Túi)",www.anphuminh.vn,'0914145544__02333670494',Hotline,X,,,anphuminhpp@gmail.com,https://www.yellowpages.vn/lgs/1187834328/bao-bi-an-phu-minh-cong-ty-tnhh-mtv-an-phu-minh.html
Doanh Nghiệp Tư Nhân Thương Mại Và Sản Xuất Trường Thủy,"103 ấp 5, X. Đức Hòa Đông, H. Đức Hòa,","Bao Bì PE, PP, HDPE, LDPE (Dạng Tấm, Cuộn, Túi)__Nhựa Phế Liệu__Hạt Nhựa Tái Sinh, Tái Chế__Nhựa - Các Công Ty Nhựa",www.truongthuy.com,'02723779161__0937719413',Ông Nguyễn Vũ Hải Bằng,,male,Chủ Doanh Nghiệp,haibangplastic@gmail.com,https://www.yellowpages.vn/lgs/1085910/doanh-nghiep-tu-nhan-thuong-mai-va-san-xuat-truong-thuy.html
Bao Bì Hà My - Công Ty TNHH Hà My Vina,"Số 36, Khu Tập Thể Công Ty Xây Lắp I, X. Trưng Trắc, H. Văn Lâm,","Màng PE, Màng Chít - Nhà Sản Xuất__Bao Bì PE, PP, HDPE, LDPE (Dạng Tấm, Cuộn, Túi)",www.baobihamy.com.vn,'0986895172__02213788203',Hotline,X,,,hamyltd@gmail.com,https://www.yellowpages.vn/lgs/1187809983/bao-bi-ha-my-cong-ty-tnhh-ha-my-vina.html
Việt Pe Foam,"Số 392A Đường DDT743B, Tân Đông Hiệp, TX. Dĩ An,","Bao Bì PE, PP, HDPE, LDPE (Dạng Tấm, Cuộn, Túi)",www.vietpefoam.com,'0979866434__0972124007',Mr. An Khang,,male,Nhân viên,khang@vietpefoam.com,https://www.yellowpages.vn/lgs/1187931894/viet-pe-foam.html
Doanh Nghiệp Tư Nhân Thanh Bình,"822/81 Hương Lộ 2, P. Bình Trị Đông A, Q. Bình Tân,","Túi Nilon PE, Túi PP, Túi HDPE,.__Bao Bì PE, PP, HDPE, LDPE (Dạng Tấm, Cuộn, Túi)",,'0934286160__0907775028',Lữ Quốc Phong,,,,qphong22@gmail.com,https://www.yellowpages.vn/lgs/1187777676/doanh-nghiep-tu-nhan-thanh-binh.html
Công Ty TNHH Sản Xuât Thương Mại Dịch Vụ Bao Bì Nhựa Thiên Phú Thịnh,"84/16/18 Khu Phố 7 Đường Tây Lân, P. Bình Trị Đông A, Q. Bình Tân,","Màng Phủ Nông Nghiệp, Ngư Nghiệp__In Túi Nilon, In Túi Xốp__Túi Nilon PE, Túi PP, Túi HDPE,.__Bao Bì PE, PP, HDPE, LDPE (Dạng Tấm, Cuộn, Túi)",www.thienphuthinhplastic.com,'0988645694',Mr. Nguyễn Đăng Hùng,,male,P. Giám Đốc,hungnguyentpt@gmail.com,https://www.yellowpages.vn/lgs/969285/cong-ty-tnhh-san-xuat-thuong-mai-dich-vu-bao-bi-nhua-thien-phu-thinh.html
Công Ty TNHH Sản Xuất Thương Mại Xuất Nhập Khẩu Nam Hoàng,"245E Nguyễn Trãi, P. Nguyễn Cư Trinh, Q. 1,","Bao Bì PE, PP, HDPE, LDPE (Dạng Tấm, Cuộn, Túi)",,'0903886384__02839204316',Ms. Trang,,female,,cherytrang@yahoo.com,https://www.yellowpages.vn/lgs/1187760864/cong-ty-tnhh-san-xuat-thuong-mai-xuat-nhap-khau-nam-hoang.html
Công Ty TNHH Sản Xuất Thương Mại Hựu Giai,"79/1 Trương Phước Phan, KP. 18, p. Bình Trị Đông, Q. Bình Tân,","Túi Nhựa PVC__Màng Co PE, LDPE, PVC, POF,.__Bao Bì PE, PP, HDPE, LDPE (Dạng Tấm, Cuộn, Túi)",www.baobinhua.com.vn,'02836200783__0902616351',Ms. Phụng,,female,,phung.lamngoc28@yahoo.com.vn,https://www.yellowpages.vn/lgs/1187804901/cong-ty-tnhh-san-xuat-thuong-mai-huu-giai.html
In Bao Bì Vũ Khánh - Công Ty TNHH Sản Xuất Thương Mại Dịch Vụ Vũ Khánh,"36/10 đường Đức Hiền, phường Tây Thạnh, quận Tân Phú","Bao Bì Màng Ghép, Bao Bì Màng Phức Hợp__Túi Hút Chân Không__Màng Phủ Nông Nghiệp, Ngư Nghiệp__Màng PVC, PET, PP, PS, HIPS__In Bao Bì Nhựa, In Màng Co, Màng Ghép, In ống Đồng__Màng Seal Nhôm, Màng Nhôm (Lá Mỏng, Vỉ Bấm,.)__Bao Bì PE, PP, HDPE, LDPE (Dạng Tấm, Cuộn, Túi)__Bao Bì Nhựa__Màng BOPP__In Bao Bì Giấy (In Túi Giấy, Thùng Giấy, Hộp Giấy)",www.printingpackaging.bizz.vn,'0903627058',Mr. Lê Hoàng Tân,,male,,lehoangtan78@yahoo.com,https://www.yellowpages.vn/lgs/1187798706/in-bao-bi-vu-khanh-cong-ty-tnhh-san-xuat-thuong-mai-dich-vu-vu-khanh.html
Bao Bì Thy Duy - Công Ty TNHH Sản Xuất Thương Mại Bao Bì Thy Duy,"26/51 Đỗ Quang Đấu, P. Phạm Ngũ Lão, Q. 1,","Bao Bì PE, PP, HDPE, LDPE (Dạng Tấm, Cuộn, Túi)__Túi, Bao Zipper, Ziplock__Bao PP Dệt__Màng Co PE, LDPE, PVC, POF,.__Bao Bì - Nhà Sản Xuất và Kinh Doanh",,'02835025250__0937870887',Ông Nguyễn Tiến Dũng,,male,Giám Đốc,baobithyduy@gmail.com,https://www.yellowpages.vn/lgs/1187719917/bao-bi-thy-duy-cong-ty-tnhh-san-xuat-thuong-mai-bao-bi-thy-duy.html
Công Ty TNHH Sản Xuất Bao Bì Nhựa Hải Yến,"Thôn Liễn Hạ, X. Đại Xuân, H. Quế Võ,","Túi Phân Hủy Sinh Học__Màng PE, Màng Chít - Nhà Sản Xuất__Băng Keo, Băng Dính__Túi Nilon PE, Túi PP, Túi HDPE,.__Bao Bì PE, PP, HDPE, LDPE (Dạng Tấm, Cuộn, Túi)__Màng Co PE, LDPE, PVC, POF,.",www.baobihaiyen.bizz.vn,'0978245576',Ông Nguyễn Văn Thạo,,male,,haiyenplastics@gmail.com,https://www.yellowpages.vn/lgs/1187765235/cong-ty-tnhh-san-xuat-bao-bi-nhua-hai-yen.html
Bao Bì Toàn Phát - Công Ty TNHH Toàn Phát,"Số 74A KP Hòa Long, P. Lái Thiêu, TX. Thuận An,","Bao Bì Màng Ghép, Bao Bì Màng Phức Hợp__Túi PP Dệt__Bao Bì Nông Nghiệp__Bao Bì PE, PP, HDPE, LDPE (Dạng Tấm, Cuộn, Túi)__Bao PP Dệt",www.baobitoanphat.com.vn,'0938515051__02743755360__0909236925',Ms. Trần Thị Bích Thuận,,female,,baobitoanphatbd@gmail.com,https://www.yellowpages.vn/lgs/710238/bao-bi-toan-phat-cong-ty-tnhh-toan-phat.html
Công Ty TNHH Sản Xuất Thương Mại Dịch Vụ Hạnh Chung,"321A Hà Đặc, KP 3, P. Trung Mỹ Tây, Q. 12,","Bao Bì Màng Ghép, Bao Bì Màng Phức Hợp__Túi Nhôm__Bao Bì Nông Nghiệp__In Bao Bì Nhựa, In Màng Co, Màng Ghép, In ống Đồng__Màng CPP, Màng MCPP__Bao Bì PE, PP, HDPE, LDPE (Dạng Tấm, Cuộn, Túi)__Túi, Bao Zipper, Ziplock__In Bao Bì Giấy (In Túi Giấy, Thùng Giấy, Hộp Giấy)__Bao Bì Thực Phẩm",www.baobihanhchung.com,'02862661804__0938498882__0908558920',Mr. Chung,,male,,congtybaobihanhchung@gmail.com,https://www.yellowpages.vn/lgs/1187803041/cong-ty-tnhh-san-xuat-thuong-mai-dich-vu-hanh-chung.html
Bao Bì Nhựa Tiến Phú - Công Ty TNHH SX TM DV Bao Bì Nhựa Tiến Phú,"757/40 Nguyễn Ảnh Thủ, KP. 10, P. Tân Chánh Hiệp, Q. 12,","Màng Co PE, LDPE, PVC, POF,.__Bao Bì Màng Ghép, Bao Bì Màng Phức Hợp__In Túi Nilon, In Túi Xốp__Túi Nhựa PVC__Túi Nilon PE, Túi PP, Túi HDPE,.__Bao Bì PE, PP, HDPE, LDPE (Dạng Tấm, Cuộn, Túi)__Màng PE Quấn Pallet__Túi, Bao Zipper, Ziplock__Màng PE, Màng Chít - Nhà Sản Xuất",www.tienphuplastics.bizz.vn,'0907854450__0914016078__02837153940',Ms Thúy Diễm,,female,,baobitienphu@yahoo.com.vn,https://www.yellowpages.vn/lgs/1187752845/bao-bi-nhua-tien-phu-cong-ty-tnhh-sx-tm-dv-bao-bi-nhua-tien-phu.html
Công Ty Cổ Phần Thương Mại Dịch Vụ Bao Bì Kiến Đức,"Lầu 1, Tòa Nhà Tani - Office, Số 475D Lê Trọng Tấn, P. Sơn Kỳ, Q. Tân Phú,","Màng Co PE, LDPE, PVC, POF,.__Bao Bì PE, PP, HDPE, LDPE (Dạng Tấm, Cuộn, Túi)__Màng PVC, PET, PP, PS, HIPS",www.innoplas.com.vn,'028376571303132__0919086280',Hotline,X,,,,https://www.yellowpages.vn/lgs/1187739609/cong-ty-co-phan-thuong-mai-dich-vu-bao-bi-kien-duc.html
Bao Bì Phương Quân - Công Ty TNHH Sản Xuất Thương Mại Bao Bì Phương Quân,"ấp 4, Xã Long Định, H. Cần Đước,","Dây Đai Nhựa__Túi Nilon PE, Túi PP, Túi HDPE,.__Bao Bì PE, PP, HDPE, LDPE (Dạng Tấm, Cuộn, Túi)__Bao Bì Nhựa__Bao PP Dệt__Bao Bì - Nhà Sản Xuất và Kinh Doanh",,'02723655757',Hotline,X,,,tranvanquan@phuongquan.com,https://www.yellowpages.vn/lgs/1187684964/bao-bi-phuong-quan-cong-ty-tnhh-san-xuat-thuong-mai-bao-bi-phuong-quan.html
Bao Bì Thiên Đức - Công Ty TNHH Bao Bì Thiên Đức,"885/9/32 Nguyễn ảnh Thủ, KP 10, P. Tân Chánh Hiệp, Q. 12,","In Bao Bì Nhựa, In Màng Co, Màng Ghép, In ống Đồng__Vật Liệu Đóng Gói__Túi Nilon PE, Túi PP, Túi HDPE,.__Bao Bì PE, PP, HDPE, LDPE (Dạng Tấm, Cuộn, Túi)",www.baobithienduc.com,'0903789767__02822156670',Ms. Dung,,female,,thienduc2609@gmail.com,https://www.yellowpages.vn/lgs/1048908/bao-bi-thien-duc-cong-ty-tnhh-bao-bi-thien-duc.html
Công Ty Cổ Phần Sản Xuất Kinh Doanh Bao Bì Việt Hưng,"Lô 23, KCN Quảng Phú, P. Quảng Phú, TP. Quảng Ngãi,","Bao Bì PE, PP, HDPE, LDPE (Dạng Tấm, Cuộn, Túi)__Bao Bì Carton",www.baobiviethung.com,'02553811349__0985241215',Mr. Trần Đình Sơn,,male,TP. KHTT,sontran.viethungpackaging@gmail.com,https://www.yellowpages.vn/lgs/1187922045/cong-ty-co-phan-san-xuat-kinh-doanh-bao-bi-viet-hung.html
Bao Bì Liên Hoàn Phát - Công Ty TNHH Bao Bì Liên Hoàn Phát,"Thôn Đại Hoàng, X. Tân Dân, H. An Lão,","Băng Keo, Băng Dính__Túi Nilon PE, Túi PP, Túi HDPE,.__Bao Bì PE, PP, HDPE, LDPE (Dạng Tấm, Cuộn, Túi)__Màng PE Foam (Cuộn, Tấm, Túi, ống,.) - Sản Xuất Và Kinh Doanh__Màng PE, Màng Chít - Nhà Sản Xuất",www.lienhoanphat.vn,'0936014668__02253911391__0961522939',Lê Hải Nam,,,TP. Kinh Doanh,lehainamlhp@gmail.com,https://www.yellowpages.vn/lgs/1187731026/bao-bi-lien-hoan-phat-cong-ty-tnhh-bao-bi-lien-hoan-phat.html
Công Ty Cổ Phần Truyền Thông Và Phát Triển Công Nghệ VIETOPEN,"829 La Thành, Ngọc Khánh, Ba Đình,","In Túi Nilon, In Túi Xốp__Túi Nilon PE, Túi PP, Túi HDPE,.__Bao Bì PE, PP, HDPE, LDPE (Dạng Tấm, Cuộn, Túi)",www.intuidep.com,'0988345546__02485887184',Mr. Dũng,,male,,intuidep@gmail.com,https://www.yellowpages.vn/lgs/1187723919/cong-ty-co-phan-truyen-thong-va-phat-trien-cong-nghe-vietopen.html
Bao Jumbo Tâm Hoàn Cầu - Công Ty TNHH Sản Xuất Bao Bì Nhựa Tâm Hoàn Cầu,"Số 51/1A, Tổ 4, KP3, Phường Trảng Dài, Thành Phố Biên Hoà,","Bao Giấy Kraft__Bao Bì PE, PP, HDPE, LDPE (Dạng Tấm, Cuộn, Túi)__Bao Jumbo__Bao PP Dệt__Bao Container, Bao Jumbo, Bao Bigbag",www.baobinhuatamhoancau.com,'0919485739',Ông Đỗ Minh Kha,,male,Giám Đốc,kha.baobitamhoancau@gmail.com,https://www.yellowpages.vn/lgs/1187762316/bao-jumbo-tam-hoan-cau-cong-ty-tnhh-san-xuat-bao-bi-nhua-tam-hoan-cau.html
Bao Bì Trung Đông - Công Ty Cổ Phần Trung Đông," Cụm Công Nghiệp Tam Phước 1, Xã Tam Phước, TP. Biên Hòa,","Bao Bì Màng Ghép, Bao Bì Màng Phức Hợp__Túi PP Dệt__Bao Giấy Kraft__Bao Tải Dứa__Bao Xi Măng__Túi Nilon PE, Túi PP, Túi HDPE,.__Bao Bì PE, PP, HDPE, LDPE (Dạng Tấm, Cuộn, Túi)__Bao Bì Nhựa__Bao PP Dệt__Bao Container, Bao Jumbo, Bao Bigbag",www.baobitrungdong.com.vn,'02513510046',Phòng Kinh Doanh,,,,sales@baobitrungdong.com.vn,https://www.yellowpages.vn/lgs/661434/bao-bi-trung-dong-cong-ty-co-phan-trung-dong.html
Bao Bì Nhơn Trạch - Công Ty Cổ Phần Bao Bì Nhơn Trạch,"KCN Nhơn Trạch 1, Đường Số 2, X. Phước Thiền, H. Nhơn Trạch,","Bao Xi Măng__Túi Nilon PE, Túi PP, Túi HDPE,.__Bao Bì PE, PP, HDPE, LDPE (Dạng Tấm, Cuộn, Túi)__Bao Bì Nhựa__Bao Jumbo__Bao PP Dệt__Vải PP, Vải PP Dệt__Bao Bì - Nhà Sản Xuất và Kinh Doanh__Hạt Nhựa PP__Bao Container, Bao Jumbo, Bao Bigbag",www.baobinhontrach.com.vn,'02513560128__0906303922',Mr. Lê Quốc Bình,,male,Phó phòng kinh doanh,bbnt@baobinhontrach.com.vn,https://www.yellowpages.vn/lgs/710655/bao-bi-nhon-trach-cong-ty-co-phan-bao-bi-nhon-trach.html
Công Ty TNHH Bao Bì Tổng Hợp Nam Tiến,"349/1/3 Tổ 15, Ấp Bến Sắn, X. Phước Thiền, H. Nhơn Trạch,","Bao Bì - Nhà Sản Xuất và Kinh Doanh__Bao Bì - Máy Móc và Thiết Bị__Bao Bì PE, PP, HDPE, LDPE (Dạng Tấm, Cuộn, Túi)__Bao Container, Bao Jumbo, Bao Bigbag",www.jumbonamtien.com.vn,'0906322483__0944550888',Mr. Nguyên Trọng Hiếu,,male,,tronghieubbnt@gmail.com,https://www.yellowpages.vn/lgs/1187810439/cong-ty-tnhh-bao-bi-tong-hop-nam-tien.html
Công Ty TNHH Hoa Xuân Vina,"36/3D ấp Tiền Lân, X. Bà Điểm, H. Hóc Môn,","Màng Co PE, LDPE, PVC, POF,.__Túi Nilon PE, Túi PP, Túi HDPE,.__Bao Bì PE, PP, HDPE, LDPE (Dạng Tấm, Cuộn, Túi)__Bao Bì Nhựa",,'02835043510__0916586517',Chị Lan,,,,lantuong1406@gmail.com,https://www.yellowpages.vn/lgs/1187709975/cong-ty-tnhh-hoa-xuan-vina.html
Công Ty CP Easypack Việt Nam,"Số 8 Ngách 11, Ngõ 290, P. Kim Mã, Q. Ba Đình,","Bao Bì Màng Ghép, Bao Bì Màng Phức Hợp__Bao Bì Nhựa - Chai Nhựa, Lọ Nhựa, Hộp Nhựa, Can nhựa__Bao Bì PE, PP, HDPE, LDPE (Dạng Tấm, Cuộn, Túi)__Bao Bì Giấy",www.easypack.vn,'0988125649__02433685566',Phạm Thị Nhung,,,Nhân viên,easypack.vn@gmail.com,https://www.yellowpages.vn/lgs/1187840745/cong-ty-cp-easypack-viet-nam.html
Bao Bì Nhựa Ngôi Sao - Công Ty TNHH Sản Xuất - Thương Mại Ngôi Sao,": Đường số 6, KCN Tam Phước, P. Tam Phước, Tp. Biên Hòa,","Túi Phân Hủy Sinh Học__Túi Nilon PE, Túi PP, Túi HDPE,.__Bao Bì PE, PP, HDPE, LDPE (Dạng Tấm, Cuộn, Túi)__Bao Bì Nhựa",www.newstarpaper.vn__www.newstarpaper.bizz.vn,'02513512488__0934066486__0934085486',Hotline công ty,,,,ngoisao@newstarpaper.com.vn,https://www.yellowpages.vn/lgs/1187807226/bao-bi-nhua-ngoi-sao-cong-ty-tnhh-san-xuat-thuong-mai-ngoi-sao.html
Công Ty TNHH 1 Thành Viên  Sản Xuất Thương Mại An Thái Thịnh,"B2/5 ấp 2, X. Qui Đức, H. Bình Chánh,","Bao Bì PE, PP, HDPE, LDPE (Dạng Tấm, Cuộn, Túi)__Hạt Nhựa PP__Hạt Nhựa Tái Sinh, Tái Chế",www.anthaithinhplastic.com,'02837790250__0902454087',Nguyễn Thị Bích Huyền,,,,nangsg83@yahoo.com,https://www.yellowpages.vn/lgs/1196370/cung-ty-tnhh-1-thanh-vion-san-xuat-thuong-mai-an-thai-thinh.html
Doanh Nghiệp Tư Nhân Sản Xuất Và Thương Mại Trường Thủy,"428/6 Lũy Bán Bích, P. Hòa Thuận, Q. Tân Phú,","Hạt Nhựa PE__Bao Bì PE, PP, HDPE, LDPE (Dạng Tấm, Cuộn, Túi)__Nhựa Phế Liệu__Hạt Nhựa Tái Sinh, Tái Chế__Hạt Nhựa PP",www.truongthuy.com,'02838605812__0937719413',Nguyễn Vũ Hải Bằng,,,Quản Lý,haibangplastic@gmail.com,https://www.yellowpages.vn/lgs/1187722158/doanh-nghiep-tu-nhan-san-xuat-va-thuong-mai-truong-thuy.html
Công Ty TNHH Bao Bì Khánh Toàn Phú,"36/9/19/15, Đường Nguyễn Triệu Luật, KP. 3, P. Tân Tạo, Q. Bình Tân,","Bao Bì Hộp__Bao Bì Màng Ghép, Bao Bì Màng Phức Hợp__Bao Bì PE, PP, HDPE, LDPE (Dạng Tấm, Cuộn, Túi)",,'0906840378',Ms. Nguyễn Thị Hồng Hảo,,female,,khanhtoanphu@gmail.com,https://www.yellowpages.vn/lgs/1187883318/cong-ty-tnhh-bao-bi-khanh-toan-phu.html
Cơ Sở Sản Xuất Hạt Nhựa Tái Sinh Thái Hoa,"KCN Trực Hùng, H. Trực Ninh,","Dây Đai Pet__Dây Đai Nhựa__Túi Nilon PE, Túi PP, Túi HDPE,.__Bao Bì PE, PP, HDPE, LDPE (Dạng Tấm, Cuộn, Túi)__Dây Đai PP",,'0912769350__0986014458',Đặng Quang Cường,,,Chủ Cơ Sở,cuonghips@gmall.com,https://www.yellowpages.vn/lgs/1187753406/co-so-san-xuat-hat-nhua-tai-sinh-thai-hoa.html
Công Ty Cổ Phần Nhựa OPEC - Chi Nhánh HCM,"47 Đường 55A, P. Tân Tạo, Q. Bình Tân,","Túi PP Dệt__Hạt Nhựa ABS__Hạt Nhựa HDPE__Hạt Nhựa PS (HIPS, GPPS)__Hạt Nhựa PVC__Túi Nilon PE, Túi PP, Túi HDPE,.__Bao Bì PE, PP, HDPE, LDPE (Dạng Tấm, Cuộn, Túi)__Hạt Nhựa PET__Hạt Nhựa LDPE__Hạt Nhựa PP__Hạt Nhựa, Hạt Nhựa Nguyên Sinh",www.opec.vn,'0989198158',Ms. Nhi,,female,Nhân Viên Kinh Doanh,nhi.le@opec.vn,https://www.yellowpages.vn/lgs/1187714703/cong-ty-co-phan-nhua-opec-chi-nhanh-hcm.html
Công Ty TNHH WorldChemical,"CCN Hương Canh, H. Bình Xuyên,","Màng Co PE, LDPE, PVC, POF,.__Màng Phủ Nông Nghiệp, Ngư Nghiệp__Màng PE, Màng Chít - Nhà Sản Xuất__Bao Bì PE, PP, HDPE, LDPE (Dạng Tấm, Cuộn, Túi)",www.worldchemical.vn,'02113592539__01676646563',Mr Nguyễn Trung Đức,,male,Nhân Viên Kinh Doanh,trungduc.worldchemical@gmail.com,https://www.yellowpages.vn/lgs/1187784615/cong-ty-tnhh-worldchemical.html
Bao Bì Đại Đại Phát - Công Ty TNHH Bao Bì Đại Đại Phát,"151/12 Đường Liên Khu 4-5, P. Bình Hưng Hòa B, Q. Bình Tân,","Bao Bì PE, PP, HDPE, LDPE (Dạng Tấm, Cuộn, Túi)__Bao Bì Nhựa",www.baobidaidaiphat.com,'0903323316__02837501054',Ông Lê Phúc Duy,,male,,baobidaidaiphat@yahoo.com.vn,https://www.yellowpages.vn/lgs/1187750952/bao-bi-dai-dai-phat-cong-ty-tnhh-bao-bi-dai-dai-phat.html
Chi nhánh Bình Dương - Công Ty Cổ Phần Sơn Hải Việt,"7/41 Đại Lộ Bình Dương, P. Bình Hòa, TP. Thuận An,","Mốp Xốp - Xốp EPS (Dạng Hạt, Tấm, Block, Định Hình)__In Bao Bì Nhựa, In Màng Co, Màng Ghép, In ống Đồng__Xốp Hơi, Màng Xốp Hơi__Bao Bì PE, PP, HDPE, LDPE (Dạng Tấm, Cuộn, Túi)",www.mopxopcachnhiet.vn,'0933826846',Mr. Hưng,,male,,toncachnhiet91@gmail.com,https://www.yellowpages.vn/lgs/738675/chi-nhanh-binh-duong-cong-ty-co-phan-son-hai-viet.html
Công Ty TNHH Hà Dũng,"Số 168, Ngõ 208 Nguyễn Văn Cừ, Long Biên,","Phụ Gia Thức Ăn Chăn Nuôi Gia Súc, Gia Cầm, Thủy Sản__Bao Bì PE, PP, HDPE, LDPE (Dạng Tấm, Cuộn, Túi)__Túi Vải Không Dệt__Nông Sản__Bao Bì - Nhà Sản Xuất và Kinh Doanh",www.hadung.vn,'0941662299__02432161558',Nhân sự,,,,info@hadung.vn,https://www.yellowpages.vn/lgs/1187842602/cong-ty-tnhh-ha-dung.html
Công Ty TNHH Bao Bì Ánh Dương Việt Nam,"Lô 55 khu công nghiệp Cái Lân, TP Hạ Long,","Bao Bì PE, PP, HDPE, LDPE (Dạng Tấm, Cuộn, Túi)__Bao Bì Nhựa__Bao Bì Giấy__Màng Co PE, LDPE, PVC, POF,.__Bao Bì - Nhà Sản Xuất và Kinh Doanh",,'0915410482',Nguyễn Thị Hòa,,,Nhân viên kinh doanh,haihoahl@gmail.com,https://www.yellowpages.vn/lgs/1187788965/cong-ty-tnhh-bao-bi-anh-duong-viet-nam.html
Công Ty Cổ Phần Truyền Thông Và Phát Triển Công Nghệ VIETOPEN,"829 La Thành, Ngọc Khánh, Ba Đình,","In Túi Nilon, In Túi Xốp__Túi Nilon PE, Túi PP, Túi HDPE,.__Bao Bì PE, PP, HDPE, LDPE (Dạng Tấm, Cuộn, Túi)",www.intuidep.com,'0988345546__02485887184',Mr. Dũng,,male,,intuidep@gmail.com,https://www.yellowpages.vn/lgs/1187723919/cong-ty-co-phan-truyen-thong-va-phat-trien-cong-nghe-vietopen.html
Công Ty TNHH Sản Xuất Thương Mại Bao Bì Nhựa Gia Phát,"262-264 Nguyễn Thị Tú, KP. 2, P. Bình Hưng Hòa B, Q. Bình Tân,","Vật Liệu Đóng Gói__Băng Keo, Băng Dính__Bao Bì PE, PP, HDPE, LDPE (Dạng Tấm, Cuộn, Túi)__Bao Bì Nhựa",,'0902988139__02854280722',Trần Thị Yến,,,TP. Kinh Doanh,giaphatbaobinhua@gmail.com,https://www.yellowpages.vn/lgs/1187756403/cong-ty-tnhh-san-xuat-thuong-mai-bao-bi-nhua-gia-phat.html
Công Ty Cổ Phần Sản Xuất Kinh Doanh Bao Bì Việt Hưng,"Lô 23, KCN Quảng Phú, P. Quảng Phú, TP. Quảng Ngãi,","Bao Bì PE, PP, HDPE, LDPE (Dạng Tấm, Cuộn, Túi)__Bao Bì Carton",www.baobiviethung.com,'02553811349__0985241215',Mr. Trần Đình Sơn,,male,TP. KHTT,sontran.viethungpackaging@gmail.com,https://www.yellowpages.vn/lgs/1187922045/cong-ty-co-phan-san-xuat-kinh-doanh-bao-bi-viet-hung.html
Công Ty TNHH Sản Xuất Thương Mại Dịch Vụ Hạnh Chung,"321A Hà Đặc, KP 3, P. Trung Mỹ Tây, Q. 12,","Bao Bì Màng Ghép, Bao Bì Màng Phức Hợp__Túi Nhôm__Bao Bì Nông Nghiệp__In Bao Bì Nhựa, In Màng Co, Màng Ghép, In ống Đồng__Màng CPP, Màng MCPP__Bao Bì PE, PP, HDPE, LDPE (Dạng Tấm, Cuộn, Túi)__Túi, Bao Zipper, Ziplock__In Bao Bì Giấy (In Túi Giấy, Thùng Giấy, Hộp Giấy)__Bao Bì Thực Phẩm",www.baobihanhchung.com,'02862661804__0938498882__0908558920',Mr. Chung,,male,,congtybaobihanhchung@gmail.com,https://www.yellowpages.vn/lgs/1187803041/cong-ty-tnhh-san-xuat-thuong-mai-dich-vu-hanh-chung.html
Bao Bì Ngọc Thanh Phước - Công Ty TNHH Bao Bì Ngọc Thanh Phước,"Lô 1 - 11 Khu Công Nghiệp Hố Nai, X. Hố Nai 3 , H. Trảng Bom,","Màng Phủ Nông Nghiệp, Ngư Nghiệp__Túi Nilon PE, Túi PP, Túi HDPE,.__Bao Bì PE, PP, HDPE, LDPE (Dạng Tấm, Cuộn, Túi)__Túi, Bao Zipper, Ziplock__Bao Bì May Mặc__Túi Đựng Rác (Túi Đựng Rác y Tế, Công Nghiệp, Màu Đen, Dạng Cuộn)",www.nhuangocthanhphuoc.com,'0918599979',Hotline,X,,,sales@nhuangocthanhphuoc.com,https://www.yellowpages.vn/lgs/1187768514/bao-bi-ngoc-thanh-phuoc-cong-ty-tnhh-bao-bi-ngoc-thanh-phuoc.html
Công Ty TNHH Thương Mại & Sản Xuất Bao Bì Lai Trường Sơn,"Số 36, Đường ấp 7B, Xã Mỹ Yên, Huyện Bến Lức,","Bao Bì Màng Ghép, Bao Bì Màng Phức Hợp__In Bao Bì - Công Ty Thiết Kế và In ấn Bao Bì__Bao Bì - Nhà Sản Xuất và Kinh Doanh__Bao Bì PE, PP, HDPE, LDPE (Dạng Tấm, Cuộn, Túi)",www.baobilaitruongson.com.vn,'0906908660',Mrs. Nguyễn Thùy Đoan Trang,,,NVKD,doantrang16041998@gmail.com,https://www.yellowpages.vn/lgs/1187925036/cong-ty-tnhh-thuong-mai---san-xuat-bao-bi-lai-truong-son.html
Bao Bì Đồng Nai - Công Ty Cổ Phần Bao Bì Đồng Nai,"456E KP 5, P. Long Bình, TP Biên Hòa, Tỉnh Đồng Nai.","In Bao Bì Nhựa, In Màng Co, Màng Ghép, In ống Đồng__Bao PP Dệt__Bao Bì PE, PP, HDPE, LDPE (Dạng Tấm, Cuộn, Túi)__Bao Bì Nhựa",,'0813931999__01273931999__02513924999',Hotline,X,,,,https://www.yellowpages.vn/lgs/1187693625/bao-bi-dong-nai-cong-ty-co-phan-bao-bi-dong-nai.html
