company,address,industry,website,phone,contact_person,is_hotline,gender,position,email,url
Chi nhánh Công Ty TNHH KJ Glove,"54/9 Tô Ngọc Vân, P. Thạnh Xuân, Q.12,","Găng Tay Công Nghiệp (Len, Sợi, Vải) -  Sản Xuất Và Kinh Doanh__Khăn Bông - Sản Xuất và Bán Buôn Khăn Bông__Bảo Hộ Lao Động",,'0938044883__0934044883',Chị Nguyễn Thị Tuyết,,,TPKD,nthtkj@gmail.com,https://www.yellowpages.vn/lgs/968259/chi-nhanh-cong-ty-tnhh-kj-glove.html
Cơ Sở Minh Tuấn,"38B16 Đường Cây Keo, Phường Tam Phú, Quận Thủ Đức,","Găng Tay Công Nghiệp (Len, Sợi, Vải) -  Sản Xuất Và Kinh Doanh__Khẩu Trang Y Tế - Sản Xuất Và Bán Buôn__Khẩu Trang Vải, Khẩu Trang Than Hoạt Tính - Sản Xuất và Bán Buôn",,'',,,,,,https://www.yellowpages.vn/lgs/1187828442/co-so-minh-tuan.html
Công Ty TNHH MTV Nguyên Tài Phát,"Tổ 8A, KP 3, P. Trảng Dài, Tp. Biên Hòa,","Găng Tay Công Nghiệp (Len, Sợi, Vải) -  Sản Xuất Và Kinh Doanh__Găng Tay Bảo Hộ Lao Động__Băng Keo OPP (Trong, Đục và Màu), Băng Keo Dán Thùng__Phòng Cháy Chữa Cháy - Thiết Bị Phòng Cháy Chữa Cháy",,'02518875153__0933454688',Ông Nguyễn Viết Văn,,male,Kế Toán,taiphat688@gmail.com,https://www.yellowpages.vn/lgs/1187737968/cong-ty-tnhh-mtv-nguyen-tai-phat.html
Cơ Sở Sản Xuất Găng Tay Bảo Hộ Bảo Minh,"Khu 7, Vĩnh Lại, Lâm Thao,","Găng Tay Công Nghiệp (Len, Sợi, Vải) -  Sản Xuất Và Kinh Doanh__Găng Tay Bảo Hộ Lao Động",,'0976367246',Lê Thị Huệ,,,,Xuanvu34@gmail.com,https://www.yellowpages.vn/lgs/1187799540/co-so-san-xuat-gang-tay-bao-ho-bao-minh.html
Cơ Sở Sản Xuất Găng Tay Bảo Hộ Lao Động Tâm Việt,"E 833 KP 5A , P. Long Bình, Tp. Biên Hòa,","Găng Tay Công Nghiệp (Len, Sợi, Vải) -  Sản Xuất Và Kinh Doanh__Găng Tay Cao Su - Nhà Sản Xuất__Găng Tay Bảo Hộ Lao Động",,'0904422141__0972076599',Bà Trần Thị Yến,,female,,,https://www.yellowpages.vn/lgs/1187769336/co-so-san-xuat-gang-tay-bao-ho-lao-dong-tam-viet.html
