company,address,industry,website,phone,contact_person,is_hotline,gender,position,email,url
Viet Metal Hard Ware,"158/C34 Phan Anh, Phường Tân Thới Hòa, Quận Tân Phú,","Phụ Kiện Cửa (Cửa Kính, Nhựa, Gỗ,.)__Lò Xo, Lò Xo Công Nghiệp__Phụ Kiện Ngành Gỗ, Phụ Kiện Nội Thất - Sản Xuất và Cung Cấp__Lưới Thép - Sản Xuất và Kinh Doanh Lưới Thép",www.vietmetalhardware.com/,'0903060459',Hotline,X,,,viet.metalhardware@gmail.com,https://www.yellowpages.vn/lgs/1187932623/viet-metal-hard-ware.html
Công Ty TNHH Vũ Hoàng,"656 Điện Biên Phủ, P. Thanh Khê Tây, Q. Thanh Khê,","Ván ép Nội Thất - Sản Xuất và Cung Cấp__Phụ Kiện Ngành Gỗ, Phụ Kiện Nội Thất - Sản Xuất và Cung Cấp__Ván ép - Sản Xuất và Cung Cấp Ván ép__Gỗ Ghép, Ván Ghép (Ghép Thanh, Gỗ Ghép Thông, Cao Su, Tràm,.)",www.vanepvuhoang.com,'0943035036__02363811543',Văn phòng,,,,vuhoangcompany656@gmail.com,https://www.yellowpages.vn/lgs/1036335/cong-ty-tnhh-vu-hoang.html
Công Ty TNHH Phụ Kiện Nội Thất Bách Tùng,"461/1B Đường Âu Cơ, Phường Phú Trung, Quận Tân Phú,","Cầu Thang, Lan Can__Phụ Kiện Ngành Gỗ, Phụ Kiện Nội Thất - Sản Xuất và Cung Cấp__Keo Nến, Keo Silicone - Sản Xuất Và Cung Cấp__Phụ Kiện Phòng Tắm (Bằng Sứ, Nhựa, Inox, Nhôm)__Vách Ngăn - Cung Cấp Và Thi Công",www.phukiennhomkinhbachtung.vn__www.phukienkinhgiare.vn,'0975400234__0909750177',Mr. Trần Thanh Tùng,,male,,bachtungsilicone@gmail.com,https://www.yellowpages.vn/lgs/1187803890/cong-ty-tnhh-phu-kien-noi-that-bach-tung.html
Công Ty TNHH Hoàng Quân Nguyễn,"85 Nguyễn Đình Chiểu, P. Đông Hòa, TP. Dĩ An,","Xi Lanh Thủy Lực__ốc, Vít, Bù Loong__Phụ Kiện Ngành Gỗ, Phụ Kiện Nội Thất - Sản Xuất và Cung Cấp__Xi Lanh Khí Nén",,'0975871501__02746544335',Mr. Quân,,male,,hoangquannguyen.coltd@gmail.com,https://www.yellowpages.vn/lgs/1187908053/cong-ty-tnhh-hoang-quan-nguyen.html
Đồ Nội Thất QT - Công Ty TNHH Đầu Tư Sản Xuất QT,"79 Hoàng Sa, Phường Đa Kao, Quận 1,","Quà Tặng Bằng Gỗ__Đồ Nội Thất - Thiết Kế Và Sản Xuất, Lắp Đặt Đồ Nội Thất__Đồ Gỗ Nội Thất - Sản Xuất và Kinh Doanh Đồ Gỗ Nội Thất__Phụ Kiện Ngành Gỗ, Phụ Kiện Nội Thất - Sản Xuất và Cung Cấp",www.qt-furniture.com,'0934367685__0939985058',Mrs. Lê Nhật Diễm Hoài,,,,lolitale@qt-furniture.com,https://www.yellowpages.vn/lgs/1187849442/do-noi-that-qt-cong-ty-tnhh-dau-tu-san-xuat-qt.html
Công Ty TNHH Ngũ Kim Cường Phát,"Số 752 Đường Phú Lợi, Kp. 9, P. Phú Hòa, Tp. Thủ Dầu Một,","Phụ Kiện Ngành Gỗ, Phụ Kiện Nội Thất - Sản Xuất và Cung Cấp",,'0868407234',,,,,,https://www.yellowpages.vn/lgs/1187864124/cong-ty-tnhh-ngu-kim-cuong-phat.html
Cửa Hàng Việt Phát Vít,"TP. Quy Nhơn,","Phụ Kiện Ngành Gỗ, Phụ Kiện Nội Thất - Sản Xuất và Cung Cấp__Công nghiệp - Vật Tư và Thiết Bị Công Nghiệp",,'02563641224',,,,,,https://www.yellowpages.vn/lgs/1187687103/cua-hang-viet-phat-vit.html
Cửa Hàng Khóa Cửa Thành Đạt,"1248 Lạc Long Quân, P. 8, Q. Tân Bình,","Phụ Kiện Ngành Gỗ, Phụ Kiện Nội Thất - Sản Xuất và Cung Cấp",www.phukienmocthanhdat.com,'0903880246',,,,,,https://www.yellowpages.vn/lgs/1187869350/cua-hang-khoa-cua-thanh-dat.html
Công Ty TNHH MTV Khởi Nam,"B10, Tổ 4, Kp1, Đồng Khởi, P. Trảng Dài, Tp. Biên Hòa,","ốc, Vít, Bù Loong__Phụ Kiện Ngành Gỗ, Phụ Kiện Nội Thất - Sản Xuất và Cung Cấp",www.anhduyngukim.ticc.vn,'02516254569__0916856285',Ms Nguyễn Thị Hồng Tiến,,female,Nhân Viên,anhduyhardware@yahoo.com.vn,https://www.yellowpages.vn/lgs/1187770389/cong-ty-tnhh-mtv-khoi-nam.html
Công Ty TNHH TM DV Sản Xuất Gia Công Thịnh Hưng,"Số 137/12 Đường Bình Long, P. Bình Hưng Hòa A, Q. Bình Tân,","Phụ Kiện Cửa (Cửa Kính, Nhựa, Gỗ,.)__Phụ Kiện Ngành Gỗ, Phụ Kiện Nội Thất - Sản Xuất và Cung Cấp",,'0983166623__0280983166623',Ông Đỗ Tâm Ngọc,,male,,,https://www.yellowpages.vn/lgs/1187721963/cong-ty-tnhh-tm-dv-san-xuat-gia-cong-thinh-hung.html
Phong Cách Mới - Công Ty TNHH Xây Dựng & Thương Mại Phong Cách Mới,"Lô 2, BT1, Khu Đô Thị Mới Văn Phú, Hà Đông, ","Thanh Nhựa uPVC, Thanh Nhựa Profile__Ván Sàn Gỗ Công Nghiệp__Sàn Gỗ, Ván Sàn Gỗ - Công Ty Phân Phối, Sản Xuất và Kinh Doanh__Phụ Kiện Ngành Gỗ, Phụ Kiện Nội Thất - Sản Xuất và Cung Cấp",www.queenviet.com,'0433553018__0862646969',,,,,,https://www.yellowpages.vn/lgs/1391415/phong-cach-moi-cong-ty-tnhh-xay-dung---thuong-mai-phong-cach-moi.html
Công Ty TNHH Blum,"R302A, Housinco 256 Lương Thế Vinh, Thanh Xuân,","Phụ Kiện Ngành Gỗ, Phụ Kiện Nội Thất - Sản Xuất và Cung Cấp",www.blum.net.vn,'0934570009',Ms Phượng,,female,,nhabepblum2017@gmail.com,https://www.yellowpages.vn/lgs/1187792469/cong-ty-tnhh-blum.html
Công Ty TNHH MTV Thương Mại Dịch Vụ Kỳ Hân,"925/10/38 Tổ 33, Khu Phố Tân Long, P.Tân Đông Hiệp, TX.Dĩ An,","Phụ Kiện Ngành Gỗ, Phụ Kiện Nội Thất - Sản Xuất và Cung Cấp",,'0286502818__02746502818',Hotline,X,,,kyhan886@gmail.com,https://www.yellowpages.vn/lgs/1187799090/cong-ty-tnhh-mtv-thuong-mai-dich-vu-ky-han.html
"Guangzhou Young Trading Co.,Ltd","P812, Số 668 Đường Shatai, Q. Baiyun, TP. Quảng Châu,","Phụ Kiện Ngành Gỗ, Phụ Kiện Nội Thất - Sản Xuất và Cung Cấp__Gỗ Công Nghiệp, Gỗ MDF (Ván MDF, HDF, HMR)",www.guangzhouyoung.com,'021262837788',Ms Mandy,,female,,young@guangzhouyoung.com,"https://www.yellowpages.vn/lgs/1187778441/guangzhou-young-trading-co.,ltd.html"
Nguyên Mậu - Công Ty TNHH Nguyên Mậu,"Số 47/31, Đường 120, Khu phố 2, Phường Tân Phú, Quận 9,","Dụng Cụ Cầm Tay__Phụ Kiện Ngành Gỗ, Phụ Kiện Nội Thất - Sản Xuất và Cung Cấp",www.nguyenmau.znn.vn,'0907482075__02837360147',Anh Trung,,,,nguyenmau.kd@gmail.com,https://www.yellowpages.vn/lgs/1228275/nguyen-mau-cong-ty-tnhh-nguyen-mau.html
Công Ty TNHH Gripwell Fastening & Engineering,"242H Minh Khai, Q. Hai Bà Trưng,","Phụ Kiện Ngành Gỗ, Phụ Kiện Nội Thất - Sản Xuất và Cung Cấp",,'02436249330',,,,,,https://www.yellowpages.vn/lgs/1187684643/cong-ty-tnhh-gripwell-fastening---engineering.html
Công Ty TNHH Dịch Vụ Và Thương Mại Tùng Lâm,"Liên Trung, Đan Phượng,","Cho Thuê Xe Du Lịch__Đồ Gỗ Nội Thất - Sản Xuất và Kinh Doanh Đồ Gỗ Nội Thất__Phụ Kiện Ngành Gỗ, Phụ Kiện Nội Thất - Sản Xuất và Cung Cấp",,'02433255009',,,,,,https://www.yellowpages.vn/lgs/1187697462/cong-ty-tnhh-dich-vu-va-thuong-mai-tung-lam.html
Cơ Sở Sản Xuất Đồ Gỗ Mộc Gia Minh,"184 Việt Kiều 2, ấp Việt Kiều, X. Xuân Hiệp, H. Xuân Lộc,","Keo Dán và Chất Dính__Đồ Gỗ Nội Thất - Sản Xuất và Kinh Doanh Đồ Gỗ Nội Thất__Phụ Kiện Ngành Gỗ, Phụ Kiện Nội Thất - Sản Xuất và Cung Cấp",,'0904900746',Mr. Đức,,male,,trinhdoan910@gmail.com,https://www.yellowpages.vn/lgs/1187828274/co-so-san-xuat-do-go-moc-gia-minh.html
Công Ty TNHH TM-XD-TTNT Cường Thịnh,"Số 3, Đường. 10, KP. 6, P. Hiệp Bình Chánh, Q. Thủ Đức,","Thiết Bị Nhà Bếp Gia Đình (Nồi Cơm, Máy Hút Mùi, Máy Xay..)__Phụ Kiện Cửa (Cửa Kính, Nhựa, Gỗ,.)__Phụ Kiện Ngành Gỗ, Phụ Kiện Nội Thất - Sản Xuất và Cung Cấp__Vật Liệu Trang Trí Nội Thất__Phụ Kiện Phòng Tắm (Bằng Sứ, Nhựa, Inox, Nhôm)",www.nhabepchauau.net,'0906968377',Mr. Nguyễn Hải Đường,,male,TP. Kinh doanh,haiduongvinhomes@gmail.com,https://www.yellowpages.vn/lgs/1187808321/cong-ty-tnhh-tm-xd-ttnt-cuong-thinh.html
Đông Triều - Công Ty TNHH Xây Dựng Đông Triều,"Khu Cầu Cấm,TT. Đông Triều, H. Đông Triều,","Gỗ Xẻ__Gỗ Nguyên Liệu__Phụ Kiện Ngành Gỗ, Phụ Kiện Nội Thất - Sản Xuất và Cung Cấp__Xây Dựng - Quản Lý và Giám Sát",,'02033870170',,,,,,https://www.yellowpages.vn/lgs/1287783/dong-trieu-cong-ty-tnhh-xay-dung-dong-trieu.html
Cơ Sở Càn Phát Bao Bì,"119A Văn Thân, P. 8, Q. 6,","Phụ Kiện Ngành Gỗ, Phụ Kiện Nội Thất - Sản Xuất và Cung Cấp__Khuôn Mẫu",,'02838582654__0903622686',,,,,,https://www.yellowpages.vn/lgs/994029/co-so-can-phat-bao-bi.html
Công Ty TNHH Thương Mại Dịch Vụ Hợp Trường Phát,"Số 3 Đường 12, KP4, P. Linh Trung, Q. Thủ Đức,","Phụ Kiện Ngành Gỗ, Phụ Kiện Nội Thất - Sản Xuất và Cung Cấp",www.hoptruongphat.com,'02837246828__0979716328',Ông Phún A Ky,,male,,,https://www.yellowpages.vn/lgs/1187736171/cong-ty-tnhh-thuong-mai-dich-vu-hop-truong-phat.html
Công Ty TNHH MTV Thương Mại Dịch Vụ Hải Tinh,"26/16/7 Tân Thới Nhất 5, P. Tân Thới Nhất, Q. 12,","Cửa Nhôm, Cửa Nhôm Kính__Phụ Kiện Ngành Gỗ, Phụ Kiện Nội Thất - Sản Xuất và Cung Cấp",,'0903730513',Ông Nguyễn Tấn Thành,,male,,gennariko@gmail.com,https://www.yellowpages.vn/lgs/1187742387/cong-ty-tnhh-mtv-thuong-mai-dich-vu-hai-tinh.html
Công Ty TNHH Great Hill Việt Nam,"Lô A-3B- CN, KCN Mỹ Phước 3, P. Chánh Phú Hòa, TX. Bến Cát,","Máy May - Phụ Tùng, Phụ Kiện__Phụ Kiện Ngành Gỗ, Phụ Kiện Nội Thất - Sản Xuất và Cung Cấp__Cắt Gọt CNC - Dịch Vụ Cắt Gọt CNC (Plasma, Oxy - Gas,.)",www.greathillprecison.com,'01699306405__02743803243',Ms. Quỳnh Giao,,female,,Quynhgiao2610@gmail.com,https://www.yellowpages.vn/lgs/1187815716/cong-ty-tnhh-great-hill-viet-nam.html
Công Ty TNHH Một Thành Viên Kim Lê Hưng,"ấp 5, X. Bình Lợi, H. Vĩnh Cửu,","ốc, Vít, Bù Loong__Phụ Kiện Ngành Gỗ, Phụ Kiện Nội Thất - Sản Xuất và Cung Cấp",www.ocvitlehung.com__www.lehunghardware.com,'01234546549__02513970068',Ông Lê Duy Hiển,,male,,lehungngukim@gmail.com,https://www.yellowpages.vn/lgs/1187696067/cong-ty-tnhh-mot-thanh-vien-kim-le-hung.html
Công Ty TNHH Dịch Vụ Và Thương Mại Tùng Lâm,"Liên Trung, Đan Phượng,","Cho Thuê Xe Du Lịch__Đồ Gỗ Nội Thất - Sản Xuất và Kinh Doanh Đồ Gỗ Nội Thất__Phụ Kiện Ngành Gỗ, Phụ Kiện Nội Thất - Sản Xuất và Cung Cấp",,'02433255009',,,,,,https://www.yellowpages.vn/lgs/1187697462/cong-ty-tnhh-dich-vu-va-thuong-mai-tung-lam.html
Công Ty TNHH MTV Thương Mại Thế Mạo,"Số C12, KDC. Đồng An, KP. Đồng An 2, P. Bình Hòa, Tx. Thuận An,","Phụ Kiện Ngành Gỗ, Phụ Kiện Nội Thất - Sản Xuất và Cung Cấp__Vật Liệu Trang Trí Nội Thất",,'02743766252',,,,,,https://www.yellowpages.vn/lgs/1187798856/cong-ty-tnhh-mtv-thuong-mai-the-mao.html
An Tây - Công Ty TNHH Sản Xuất Thương Mại An Tây,"ấp 2, X. An Tây, H. Bến Cát,","Gỗ Xẻ__Phụ Kiện Ngành Gỗ, Phụ Kiện Nội Thất - Sản Xuất và Cung Cấp__Đồ Gỗ Nội Thất - Sản Xuất và Kinh Doanh Đồ Gỗ Nội Thất__Gỗ Tự Nhiên (Gỗ Tần Bì, Trắc, Mun, óc Chó,..) - Nhập Khẩu Và Cung Cấp__Gỗ Xẻ Sấy",,'02743580613',,,,,,https://www.yellowpages.vn/lgs/1091880/an-tay-cong-ty-tnhh-san-xuat-thuong-mai-an-tay.html
Công Ty TNHH Thương Mại Dịch Vụ Hợp Trường Phát,"Số 3 Đường 12, KP4, P. Linh Trung, Q. Thủ Đức,","Phụ Kiện Ngành Gỗ, Phụ Kiện Nội Thất - Sản Xuất và Cung Cấp",www.hoptruongphat.com,'02837246828__0979716328',Ông Phún A Ky,,male,,,https://www.yellowpages.vn/lgs/1187736171/cong-ty-tnhh-thuong-mai-dich-vu-hop-truong-phat.html
Công Ty TNHH Một Thành Viên Thế Thành Phát,"24/04A Tân Phước, Tân Bình, Dĩ An,","Keo dán gỗ (Keo Ghép Ngang, Ghép Dọc, Dán Veneer)__Gỗ - Vật Tư Ngành Gỗ__Phụ Kiện Ngành Gỗ, Phụ Kiện Nội Thất - Sản Xuất và Cung Cấp__Hóa Chất Ngành Gỗ, Hóa Chất Ngâm Tẩm Gỗ",,'0973881705__0962870364',Bà Đoàn Thúy,,female,Thư Ký,hongtrang1401@gmail.com,https://www.yellowpages.vn/lgs/1187788650/cong-ty-tnhh-mot-thanh-vien-the-thanh-phat.html
Công Ty TNHH Thương Mại Kim Mộc Phát,"47/1 Đường 27, Khu Phố 9, P. Hiệp Bình Chánh, Q. Thủ Đức,","Phụ Kiện Ngành Gỗ, Phụ Kiện Nội Thất - Sản Xuất và Cung Cấp",www.kimmocphat.com,'02835079618__0917636155',Lê Thanh Phương,,,Giám Đốc,kimmocphat@gmail.com,https://www.yellowpages.vn/lgs/1187713098/cong-ty-tnhh-thuong-mai-kim-moc-phat.html
Công Ty TNHH Thương Mại Dịch Vụ Kim Quyền Phát,"Số 56B/18, KP. Bình Phước A, P. Bình Chuẩn, TX. Thuận An","ốc, Vít, Bù Loong__Phụ Kiện Ngành Gỗ, Phụ Kiện Nội Thất - Sản Xuất và Cung Cấp",,'0963900437__02743721997',Mr. Sáng,,male,,kimquyenphat@gmail.com,https://www.yellowpages.vn/lgs/1187753457/cong-ty-tnhh-thuong-mai-dich-vu-kim-quyen-phat.html
HafeleShop,"68 Lê Văn Lơng Kéo Dài, Thanh Xuân,","Thiết Bị Nhà Bếp Gia Đình (Nồi Cơm, Máy Hút Mùi, Máy Xay..)__Phụ Kiện Ngành Gỗ, Phụ Kiện Nội Thất - Sản Xuất và Cung Cấp",www.hafele-shop.vn,'0934568100',Ông Nguyễn Thái Bình,,male,,nhabeppblum@gmail.com,https://www.yellowpages.vn/lgs/1187766426/hafeleshop.html
Công Ty TNHH Great Hill Việt Nam,"Lô A-3B- CN, KCN Mỹ Phước 3, P. Chánh Phú Hòa, TX. Bến Cát,","Máy May - Phụ Tùng, Phụ Kiện__Phụ Kiện Ngành Gỗ, Phụ Kiện Nội Thất - Sản Xuất và Cung Cấp__Cắt Gọt CNC - Dịch Vụ Cắt Gọt CNC (Plasma, Oxy - Gas,.)",www.greathillprecison.com,'01699306405__02743803243',Ms. Quỳnh Giao,,female,,Quynhgiao2610@gmail.com,https://www.yellowpages.vn/lgs/1187815716/cong-ty-tnhh-great-hill-viet-nam.html
Công Ty TNHH Dịch Vụ Quảng Cáo Thương Mại P&N,"371 Sư Vạn Hạnh, P. 12, Q. 10,","Phụ Kiện Cửa (Cửa Kính, Nhựa, Gỗ,.)__Phụ Kiện Ngành Gỗ, Phụ Kiện Nội Thất - Sản Xuất và Cung Cấp",www.pncompany.com.vn,'02838620181',Ông Hoàng Nam,,male,,nam.hoang@pncompany.com.vn,https://www.yellowpages.vn/lgs/696567/cong-ty-tnhh-dich-vu-quang-cao-thuong-mai-p-n.html
Công Ty TNHH MTV Thương Mại Dịch Vụ Tấn Thuận Phát,"KP. Bình Phước A, X. Bình Chuẩn, H. Thuận An,","Phụ Kiện Ngành Gỗ, Phụ Kiện Nội Thất - Sản Xuất và Cung Cấp",,'0985023966__02743798921',Bà Cao Thị Mỹ,,female,,tanthuanphat15@gmail.com,https://www.yellowpages.vn/lgs/1187773257/cong-ty-tnhh-mtv-thuong-mai-dich-vu-tan-thuan-phat.html
