company,address,industry,website,phone,contact_person,is_hotline,gender,position,email,url
Công Ty CP TM Phụ Kiện Ngành Gỗ HTC,"Lô A3-1-22, Đường Số 2, KDC 3/2, KP. 1A, P. An Phú, TP. Thuận An,","Phụ Kiện Ngành Gỗ, Phụ Kiện Nội Thất - Sản Xuất và Cung Cấp",www.rayhtc.vn,'0898188779',Mr. Phạm Huy Long,,male,,steven.rayhtc@gmail.com,https://www.yellowpages.vn/lgs/1187891736/cong-ty-cp-tm-phu-kien-nganh-go-htc.html
Công Ty TNHH Giải Pháp Hải Anh,"346A Tỉnh Lộ 2, ấp 2, Xã Phước Vĩnh An, Củ Chi,","Sơn - Công Ty Sản Xuất và Cung Cấp Sơn__Phụ Kiện Ngành Gỗ, Phụ Kiện Nội Thất - Sản Xuất và Cung Cấp__Công nghiệp - Vật Tư và Thiết Bị Công Nghiệp",www.haianhgroup.com,'0908405189',Hotline,X,,,trankhacthu1977@gmail.com,https://www.yellowpages.vn/lgs/1187860023/cong-ty-tnhh-giai-phap-hai-anh.html
Công Ty TNHH MTV Trình Bang,"Thửa Đất Số 189, Tờ Bản Đồ Số 15, KP. Khánh Long, P. Tân Phước Khánh, TX. Tân Uyên,","Phụ Kiện Ngành Gỗ, Phụ Kiện Nội Thất - Sản Xuất và Cung Cấp",www.ngukimtrinhbang.com,'0909821688__02743658042__01286495788',Hotline,X,,,cbwj2016@yeah.net,https://www.yellowpages.vn/lgs/1187892039/cong-ty-tnhh-mtv-trinh-bang.html
Công Ty TNHH Thương Mại Dịch Vụ Nguyễn Ngọc,"46-48 Trịnh Hoài Đức, P. 13, Q. 5,","Phụ Kiện Ngành Gỗ, Phụ Kiện Nội Thất - Sản Xuất và Cung Cấp__Công nghiệp - Vật Tư và Thiết Bị Công Nghiệp",www.nguyenngocltdco.com,'02838537497__0938261126',Mr. Nhựt,,male,,ngocnhut0612@yahoo.com,https://www.yellowpages.vn/lgs/1187730804/cong-ty-tnhh-thuong-mai-dich-vu-nguyen-ngoc.html
Công Ty TNHH MTV Sản Xuất Thương Mại Hào Phát,"Thửa Đất Số 1348, Tờ Bản Đồ 22, X. Vĩnh Tân, TX. Tân Uyên,","Gỗ - Vật Tư Ngành Gỗ__Phụ Kiện Ngành Gỗ, Phụ Kiện Nội Thất - Sản Xuất và Cung Cấp",www.vattugohaophat.com,'0974214607',Mr. Trần Sơn,,male,,admin@vattugohaophat.com,https://www.yellowpages.vn/lgs/1187891442/cong-ty-tnhh-mtv-san-xuat-thuong-mai-hao-phat.html
Công ty TNHH MTV Ngũ Kim Hoàng Trần,"ấp Hòa Nhựt, xã Tân Vĩnh Hiệp, TX. Tân Uyên,","Phụ Kiện Ngành Gỗ, Phụ Kiện Nội Thất - Sản Xuất và Cung Cấp",,'0982273602',Ms. Liên,,female,,tranlien260888@gmail.com,https://www.yellowpages.vn/lgs/1187760984/cong-ty-tnhh-mtv-ngu-kim-hoang-tran.html
Gỗ Gia Khang - Công Ty TNHH MTV Xây Dựng Thương Mại Gia Khang,"153-155-157-159 Thới An 28, KP. 2, P. Thới An, Q. 12,","Phụ Kiện Ngành Gỗ, Phụ Kiện Nội Thất - Sản Xuất và Cung Cấp__Ván MDF Chống ẩm__Gỗ Ghép, Ván Ghép (Ghép Thanh, Gỗ Ghép Thông, Cao Su, Tràm,.)__Ván ép - Sản Xuất và Cung Cấp Ván ép__Ván MFC__Gỗ Công Nghiệp, Gỗ MDF (Ván MDF, HDF, HMR)",www.gkg.vn,'0909023496__02837190276',Mr. Khang,,male,,gokhanggia@gmail.com,https://www.yellowpages.vn/lgs/1187754975/go-gia-khang-cong-ty-tnhh-mtv-xay-dung-thuong-mai-gia-khang.html
Công Ty TNHH Sản Xuất Thương Mại Kỹ Thuật Cơ Khí Lê Huy Bảo,"439/24 TTH21, KP. 1A, P. Tân Thới Hiệp, Q. 12,","Phụ Kiện Cửa (Cửa Kính, Nhựa, Gỗ,.)__Phụ Kiện Ngành Gỗ, Phụ Kiện Nội Thất - Sản Xuất và Cung Cấp",,'02862566639__0986652917',Hotline,X,,,lehuybao9999@gmail.com,https://www.yellowpages.vn/lgs/1187713455/cong-ty-tnhh-san-xuat-thuong-mai-ky-thuat-co-khi-le-huy-bao.html
Gỗ Ghép Duy Hà - Công Ty TNHH Sản Xuất Và Thương Mại Duy Hà,"Thôn Cầu Liêu, Xã Thạch Xá, Huyện Thạch Thất,","Phụ Kiện Ngành Gỗ, Phụ Kiện Nội Thất - Sản Xuất và Cung Cấp__Tấm ốp Nhôm Nhựa, Tấm Aluminium__Ván Veneer, Ván Công Nghiệp Phủ Veneer__Gỗ Ghép, Ván Ghép (Ghép Thanh, Gỗ Ghép Thông, Cao Su, Tràm,.)__Gỗ - Chế Biến Và Cung Cấp (Gỗ Xẻ Sấy, Phôi, Dăm,..)__Ván ép Coppha (Ván ép Phủ Phim, Ván ép Chịu Nước, Phủ Keo,.)__Gỗ Công Nghiệp, Gỗ MDF (Ván MDF, HDF, HMR)",www.goduyha.com,'02432066992__0963207604__0975257992',Ms. Nguyễn Thị Hằng Hà,,female,Phó Giám Đốc,nguyenhangha2016@gmail.com,https://www.yellowpages.vn/lgs/1187906889/go-ghep-duy-ha-cong-ty-tnhh-san-xuat-va-thuong-mai-duy-ha.html
Công Ty TNHH Thương Mại Và Dịch Vụ úc á Liên Kết,"4E Lạc Long Quân, P. 5, Q. 11,","Phụ Kiện Ngành Gỗ, Phụ Kiện Nội Thất - Sản Xuất và Cung Cấp",,'02862643138',Hotline,X,,,huong@ausasia.vn,https://www.yellowpages.vn/lgs/1187750403/cong-ty-tnhh-thuong-mai-va-dich-vu-uc-a-lien-ket.html
Công ty TNHH DOOSY,"2023 Huỳnh Tấn Phát, KP. 6, TT. Nhà Bè, H. Nhà Bè,","Đèn Chiếu Sáng (Đèn Pha, Cao áp, Huỳnh Quang,..) - Kinh Doanh Và Phân Phối__Phụ Kiện Ngành Gỗ, Phụ Kiện Nội Thất - Sản Xuất và Cung Cấp__Thiết Bị Vệ Sinh - Phân Phối và Kinh Doanh",www.homextra.vn,'02862963963__0966366899',Mr. Thiện,,male,,doosy@doosy.vn-cskh@homextra.vn,https://www.yellowpages.vn/lgs/1187753121/cong-ty-tnhh-doosy.html
Công Ty TNHH Một Thành Viên Long Nhật,"Ô 33, Lô C10, Đường 72, KP 2, P. Phú Tân, Tp. Thủ Dầu Một,","Cơ Khí Công Nghiệp (Băng Chuyền, Đường ống, Bồn Khuấy,..)__Phụ Kiện Ngành Gỗ, Phụ Kiện Nội Thất - Sản Xuất và Cung Cấp__Cơ Khí - Gia Công Cơ Khí Theo Yêu Cầu",,'0918222334',Mr. Hoàng Minh Long,,male,Giám Đốc,long.hoang@mekong-furniture.com,https://www.yellowpages.vn/lgs/1187748318/cong-ty-tnhh-mot-thanh-vien-long-nhat.html
Công Ty TNHH MTV Thương Mại An Phú Cường,"Số 4 Đường Số 4, Khu Z756, Số 118 đường 3 Tháng 2, P.12, Q.10,","Hóa Chất Ngành Sơn, Mực In, Keo (Phụ Gia Ngành Sơn, Nhựa Alkyd, Titan dioxit,..)__Phụ Kiện Ngành Gỗ, Phụ Kiện Nội Thất - Sản Xuất và Cung Cấp",,'02862997682__0908393632',Mrs. Nguyễn Thị Thùy Châu,,,Giám Đốc,anne@anphucuong.com,https://www.yellowpages.vn/lgs/1166214/cong-ty-tnhh-mtv-thuong-mai-an-phu-cuong.html
Công Ty TNHH TM - XNK Minh Đạt,"71-73 Phan Văn Trị, P. 4, Q. Bình Thạnh,","Phụ Kiện Ngành Gỗ, Phụ Kiện Nội Thất - Sản Xuất và Cung Cấp",www.midaco.com.vn,'02838602916__0979747467',Hotline,X,,,sale@midaco.com.vn,https://www.yellowpages.vn/lgs/1187813175/cong-ty-tnhh-tm-xnk-minh-dat.html
Công Ty TNHH MTA & Czech Việt Nam,"Số 50/22/4, Đường 45, P. 14, Q. Gò Vấp,","Phụ Kiện Cửa (Cửa Kính, Nhựa, Gỗ,.)__Phụ Kiện Ngành Gỗ, Phụ Kiện Nội Thất - Sản Xuất và Cung Cấp",www.vinhomevn.com,'0909804052__0903901345',Hotline,X,,,ngoc@vinhomevn.com.vn,https://www.yellowpages.vn/lgs/1187928780/cong-ty-tnhh-mta---czech-viet-nam.html
Chi Nhánh Công Ty TNHH Thương Mại Và Dịch Vụ Cường Lực Kính,"38 Hùng Vương, TT Nam Phước, Duy Xuyên,		","Nhôm Kính -  Công Ty Sản Xuất và Kinh Doanh Nhôm Kính__Nhôm Định Hình, Thanh Nhôm Định Hình__Phụ Kiện Cửa (Cửa Kính, Nhựa, Gỗ,.)__Phụ Kiện Ngành Gỗ, Phụ Kiện Nội Thất - Sản Xuất và Cung Cấp",,'0935127147',Ms. Nga,,female,,thanhnga86dn@gmail.com,https://www.yellowpages.vn/lgs/1187820267/chi-nhanh-cong-ty-tnhh-thuong-mai-va-dich-vu-cuong-luc-kinh.html
Công Nghiệp TAI-TECH - Công Ty TNHH Công Nghiệp TAI-TECH,"Đường Số 2, Khu Công Nghiệp Nhơn Trạch 1, Huyện Nhơn Trạch,","Phụ Tùng Xe Máy, Linh Phụ Kiện Xe Máy__Phụ Kiện Ngành Gỗ, Phụ Kiện Nội Thất - Sản Xuất và Cung Cấp__Phụ Kiện Đường ống - Tê, Co, Giảm, Cút,..Thép, Gang, Đồng, Nhôm, Kim Loại__Cơ Khí Chính Xác - Gia Công Chi Tiết, Linh Kiện, Phụ Tùng Theo Yêu Cầu__Cơ Khí - Gia Công Cơ Khí Theo Yêu Cầu__Rèn, Dập Nóng - Chi Tiết, Linh Kiện Chính Xác Theo Yêu Cầu__Bếp Gas - Linh, Phụ Kiện Bếp Gas",www.taitechforge.com,'02513560188__0798379930',Ms. Linh,,female,,production@taitechforge.com,https://www.yellowpages.vn/lgs/1018143/cong-nghiep-tai-tech-cong-ty-tnhh-cong-nghiep-tai-tech.html
Công Ty TNHH Đầu Tư Thương Mại Flexhouse,"C27 Park Riverside, 101 Bưng Ông Thoàn, P. Phú Hữu, Q. 9,","Inox Gia Dụng - Đồ Gia Dụng Bằng Inox__Đồ Gia Dụng - Sản Xuất và Bán Buôn__Tủ Inox (Tủ Bếp Inox, Tủ Đựng Thức Ăn Inox)__Phụ Kiện Ngành Gỗ, Phụ Kiện Nội Thất - Sản Xuất và Cung Cấp",www.flexhouse.vn,'0937942255__0937912255',Ms. Nguyễn Thị Sâm,,female,Kế toán,contact@flexhouse.vn,https://www.yellowpages.vn/lgs/1187885604/cong-ty-tnhh-dau-tu-thuong-mai-flexhouse.html
Công Ty TNHH Sản Xuất Thương Mại Nguyên Việt,"Số 44 Đường 24B, P. An Phú, Q. 2,","Giàn Phơi Thông Minh, Giàn Phơi__Phụ Kiện Ngành Gỗ, Phụ Kiện Nội Thất - Sản Xuất và Cung Cấp",www.gianphoithongminh.net.vn,'0907850818',Mr. Nguyễn Việt Trí,,male,Giám Đốc,gianphoi.nguyenviet@gmail.com,https://www.yellowpages.vn/lgs/1187900532/cong-ty-tnhh-san-xuat-thuong-mai-nguyen-viet.html
Phụ Kiện Ngành Gỗ Thanh Dung,"KP. Hòa Lân, P. Thuận Giao, TP. Thuận An,","Phụ Kiện Ngành Gỗ, Phụ Kiện Nội Thất - Sản Xuất và Cung Cấp",www.phukienthanhdung.com,'0937733503__0963733503',Mr. Dung,,male,Giám Đốc,phukienthanhdung@gmail.com,https://www.yellowpages.vn/lgs/1187931366/phu-kien-nganh-go-thanh-dung.html
Công Ty TNHH Ngũ Kim Phú Hưng,"Thửa Đất Số 957, Tờ Bản Đồ Số 20,  Ấp Hóa Nhựt, X. Tân Vĩnh Hiệp, TX. Tân Uyên,","Cơ Khí -  Gia Công và Chế Tạo__Phụ Kiện Ngành Gỗ, Phụ Kiện Nội Thất - Sản Xuất và Cung Cấp__Kim Loại - Các Loại",,'0372556533',Mr. Lê Việt Dũng,,male,,ngukimphuhung@gmail.com,https://www.yellowpages.vn/lgs/1187888643/cong-ty-tnhh-ngu-kim-phu-hung.html
Cơ Sở Sản Xuất Gia Công Bản Lề,"Liễu Ngoại, Khánh Hà, Thường Tín,","Phụ Kiện Ngành Gỗ, Phụ Kiện Nội Thất - Sản Xuất và Cung Cấp",,'0974701288',Mr. Tươi,,male,,anhtuoi01293315288@gmail.com,https://www.yellowpages.vn/lgs/1187839365/co-so-san-xuat-gia-cong-ban-le.html
Công Ty TNHH Thương Mại Chính Hồng,"Thửa Đất Số 983, Tờ Bản Đồ Số 7, Ấp Tân Hóa, X. Tân Vĩnh Hiệp, TX. Tân Uyên,","Phụ Kiện Ngành Gỗ, Phụ Kiện Nội Thất - Sản Xuất và Cung Cấp",,'02742461827__0971588802',Mr. Jiang Hui,,male,Phó GĐ,chinhhong2018.ch@gmail.com,https://www.yellowpages.vn/lgs/1187872521/cong-ty-tnhh-thuong-mai-chinh-hong.html
Công Ty TNHH Tản Viên,"KCN. Bình Phú, X. Bình Phú, H. Thạch Thất,","Phụ Kiện Ngành Gỗ, Phụ Kiện Nội Thất - Sản Xuất và Cung Cấp__Keo dán gỗ (Keo Ghép Ngang, Ghép Dọc, Dán Veneer)__Ván Lạng, Gỗ Veneer__Gỗ Tự Nhiên (Gỗ Tần Bì, Trắc, Mun, óc Chó,..) - Nhập Khẩu Và Cung Cấp__Gỗ Công Nghiệp, Gỗ MDF (Ván MDF, HDF, HMR)",www.tanviendeco.vn,'0981254692__0985092378__0981464299__02433674777__0981034533',Ms Nhung,,female,,banhang.tanvien@gmail.com,https://www.yellowpages.vn/lgs/742116/cong-ty-tnhh-tan-vien.html
Công Ty Nội Thất Hoàng Phúc,"17/84 Phan Đăng Lưu, P9, TP Tuy Hòa","Ván Sàn Gỗ Công Nghiệp__Phụ Kiện Ngành Gỗ, Phụ Kiện Nội Thất - Sản Xuất và Cung Cấp__Tủ Bếp (Tủ Bếp Gỗ, Tủ Bếp Nhôm Kính,..các loại)__Thiết Bị Điện Dân Dụng__Đồ Nội Thất Gia Đình",www.noithathoangphuc.com,'01676838879__0906595063',Hotline,X,,,tubephoangphuc@gmail.com,https://www.yellowpages.vn/lgs/1187859816/cong-ty-noi-that-hoang-phuc.html
Công Ty TNHH Sản Xuất Thương Mại Và Dịch Vụ Kim Minh Tường,"93/1 Bình Phước A, Bình Chuẩn, Thuận An,","Phụ Kiện Ngành Gỗ, Phụ Kiện Nội Thất - Sản Xuất và Cung Cấp",,'02743719217',Văn Phòng,,,,,https://www.yellowpages.vn/lgs/1187683377/cong-ty-tnhh-san-xuat-thuong-mai-va-dich-vu-kim-minh-tuong.html
Phụ Kiện Cửa Hải Tiến - Cửa Hàng Phụ Kiện Hải Tiến,"Số 29 đường 3C KDC Vĩnh Lộc B (kế bên CO.OPMART), X. Vĩnh Lộc B, H. Bình Chánh,","Phụ Kiện Nhôm Kính__Phụ Kiện Cửa (Cửa Kính, Nhựa, Gỗ,.)__Phụ Kiện Ngành Gỗ, Phụ Kiện Nội Thất - Sản Xuất và Cung Cấp",www.phukienhaitien.bizz.vn,'02862685305',Ông Vũ Văn Tiến,,male,,,https://www.yellowpages.vn/lgs/119354577/phu-kien-cua-hai-tien-cua-hang-phu-kien-hai-tien.html
Vách Ngăn IVN - Công Ty TNHH Xuất Nhập Khẩu Thương Mại Và Xây Dựng Tôi Việt Nam,"55/4G Phạm Văn Chiêu, P. 9, Q. Gò Vấp,","Vách Ngăn Nhà Vệ Sinh, Vách Ngăn Toilet - Cung Cấp Và Thi Công__Phụ Kiện Ngành Gỗ, Phụ Kiện Nội Thất - Sản Xuất và Cung Cấp__Nội Thất Bệnh Viện__Vật Liệu Trang Trí Nội Thất__Mành Rèm, Màn Rèm - Sản Xuất và Kinh Doanh__Vách Ngăn Composite, Vách Ngăn Nhựa (Compact, PVC,..)__Vách Ngăn Phòng, Vách Ngăn Di Động__Vách Ngăn Văn Phòng (Bằng Gỗ Nỉ, Nhựa, Mica,..)__Vách Ngăn - Cung Cấp Và Thi Công",www.ivn.com.vn__www.vach-ngan-di-dong.com.vn,'0939462268__0862968789',Mr. Trần Minh Ân,,male,Giám Đốc,minhantran2012@gmail.com,https://www.yellowpages.vn/lgs/1187869872/vach-ngan-ivn-cong-ty-tnhh-xuat-nhap-khau-thuong-mai-va-xay-dung-toi-viet-nam.html
Công Ty TNHH MTV DV SX TM Ngũ Kim Thành Nghĩa,"Số 7, Đường Lý Thường Kiệt, P. Dĩ An, TX. Dĩ An,","ốc, Vít, Bù Loong__Phụ Kiện Cửa (Cửa Kính, Nhựa, Gỗ,.)__Phụ Kiện Ngành Gỗ, Phụ Kiện Nội Thất - Sản Xuất và Cung Cấp",,'0987125136__0966978950__0975038004',Mr. Lê Văn Tình,,male,NV KT,anhthanhnghia123@gmail.com,https://www.yellowpages.vn/lgs/1187838387/cong-ty-tnhh-mtv-dv-sx-tm-ngu-kim-thanh-nghia.html
Công Ty TNHH Ngũ Kim An Phúc,"Lô A1, KCN Đất Cuốc, Khu B, Xã Đất Cuốc, Huyện Bắc Tân Uyên,","Phụ Kiện Ngành Gỗ, Phụ Kiện Nội Thất - Sản Xuất và Cung Cấp__Mạ Kim Loại, Xi Mạ Kim Loại__Xi Mạ Vàng -  Nhận Mạ Vàng__Xi Mạ - Công Ty Xi Mạ__Mạ Niken, Xi Mạ Niken__Mạ Đồng, Xi Mạ Đồng",www.ngukimanphuc.bizz.vn,'0939255499__0967778198',Ông Tsần A Nam,,male,,anphuc102@gmail.com,https://www.yellowpages.vn/lgs/1187790168/cong-ty-tnhh-ngu-kim-an-phuc.html
Công Ty TNHH Alphaco,"57A Cao Văn Ngọc, Phú Thạnh, Q. Tân Phú,","Phụ Kiện Ngành Gỗ, Phụ Kiện Nội Thất - Sản Xuất và Cung Cấp",,'0902365055__0961946555',Mr. Nguyễn Nguyên Ngọc,,male,,nguyenngoc.alphaco@gmail.com,https://www.yellowpages.vn/lgs/1187881812/cong-ty-tnhh-alphaco.html
Phụ Kiện Nội Thất  Ngũ Kim Vilubi - Công Ty TNHH VILUBI,"19/9 Đường Cây Đa, Kp. Tân Phú 2, P. Bình Tân, Dĩ An,","Inox - Sản Xuất Và Gia Công Inox__Cơ Khí - Gia Công Cơ Khí Theo Yêu Cầu__Phụ Kiện Ngành Gỗ, Phụ Kiện Nội Thất - Sản Xuất và Cung Cấp",www.vilubi.com,'0792434242__0931200095',Mr. Đạt,,male,Giám Đốc,info.vilubi@gmail.com,https://www.yellowpages.vn/lgs/1187788503/phu-kien-noi-that--ngu-kim-vilubi-cong-ty-tnhh-vilubi.html
S.A.M Lock - Công Ty TNHH S.A.M Vietnam,"Số 215/67 Nguyễn Xí, P. 13, Q. Bình Thạnh,","Khóa - Nhập Khẩu Và Phân Phối Khóa__Phụ Kiện Cửa (Cửa Kính, Nhựa, Gỗ,.)__Phụ Kiện Ngành Gỗ, Phụ Kiện Nội Thất - Sản Xuất và Cung Cấp",www.samvnlock.vn,'0901381004',Hotline,X,,,samvnlock@gmail.com,https://www.yellowpages.vn/lgs/1187920722/s.a.m-lock-cong-ty-tnhh-s.a.m-vietnam.html
Công Ty TNHH MTV Thương Mại An Phú Cường,"Số 4 Đường Số 4, Khu Z756, Số 118 đường 3 Tháng 2, P.12, Q.10,","Hóa Chất Ngành Sơn, Mực In, Keo (Phụ Gia Ngành Sơn, Nhựa Alkyd, Titan dioxit,..)__Phụ Kiện Ngành Gỗ, Phụ Kiện Nội Thất - Sản Xuất và Cung Cấp",,'02862997682__0908393632',Mrs. Nguyễn Thị Thùy Châu,,,Giám Đốc,anne@anphucuong.com,https://www.yellowpages.vn/lgs/1166214/cong-ty-tnhh-mtv-thuong-mai-an-phu-cuong.html
ốc vít bulong An Bình Dương - Công Ty TNHH TM DV An Bình Dương,"Số 288/64/5/9 Huỳnh Văn Lũy, Khu 7, Phường Phú Lợi, Tp. Thủ Dầu Một,","Phụ Kiện Ngành Gỗ, Phụ Kiện Nội Thất - Sản Xuất và Cung Cấp__ốc, Vít, Bù Loong__Vòng Đệm, Long Đền__Bulong Nở, Vít Nở, Tắc Kê__Đai Treo ống (Hình Tròn, Quả Bí, Omega,..)__Đai ốc, E Cu, Tán__Thanh Ren, Ty Ren, Guzong",www.anbinhduong.com__www.ngukimanbinhduong.com,'02746518616__0907281077__0985355435',Hotline,X,,,ngukim.abd@gmail.com,https://www.yellowpages.vn/lgs/1187863041/oc-vit-bulong-an-binh-duong-cong-ty-tnhh-tm-dv-an-binh-duong.html
Công Ty TNHH MTV Thương Mại Dịch Vụ Cơ Khí Nhân Hiệp Phát,"Khu Phố Khánh Lộc, Phường Khánh Bình, Huyện Tân Uyên,","Phụ Kiện Ngành Gỗ, Phụ Kiện Nội Thất - Sản Xuất và Cung Cấp",,'0937033111',Ông Nguyễn Văn Hai,,male,,nhanhiepphat@gmail.com,https://www.yellowpages.vn/lgs/1187746722/cong-ty-tnhh-mtv-thuong-mai-dich-vu-co-khi-nhan-hiep-phat.html
Kim Khí Zhi Jie - Công Ty TNHH Sản Xuất Và Nhập Khẩu Kim Khí Zhi Jie,"Số Nhà 14, Ngách 252/16 Ngõ 252, Tổ 11, P. Ngọc Thụy, Q. Long Biên,","Phụ Kiện Ngành Gỗ, Phụ Kiện Nội Thất - Sản Xuất và Cung Cấp__Bulong Inox, ốc Inox, Vít Inox__ốc, Vít, Bù Loong__Vòng Đệm, Long Đền__Bulong Nở, Vít Nở, Tắc Kê__Đai ốc, E Cu, Tán__Đinh Rút, Đinh Tán, Rive Nhôm, Rive Inox__Thanh Ren, Ty Ren, Guzong__Vít Bắn Tôn, Vít Tự Khoan, Vít Thạch Cao,..Các Loại",www.kimkhitrangtrung.com,'0979519188__008613737132178',Bà Lương Thục Trang,,female,,,https://www.yellowpages.vn/lgs/1187889612/kim-khi-zhi-jie-cong-ty-tnhh-san-xuat-va-nhap-khau-kim-khi-zhi-jie.html
Green Interio,"Tòa Nhà Ocean Park, Số 1 Đào Duy Anh, Q. Đống Đa,","Đồ Nội Thất - Kinh Doanh Và Phân Phối__Phụ Kiện Ngành Gỗ, Phụ Kiện Nội Thất - Sản Xuất và Cung Cấp",www.greeniterio.com,,Kruti Aparnathi,,,Quản Lý Xuất khẩu,dev.brainpower@gmail.com,https://www.yellowpages.vn/lgs/1187904843/green-interio.html
ốc vít bulong An Bình Dương - Công Ty TNHH TM DV An Bình Dương,"Số 288/64/5/9 Huỳnh Văn Lũy, Khu 7, Phường Phú Lợi, Tp. Thủ Dầu Một,","Phụ Kiện Ngành Gỗ, Phụ Kiện Nội Thất - Sản Xuất và Cung Cấp__ốc, Vít, Bù Loong__Vòng Đệm, Long Đền__Bulong Nở, Vít Nở, Tắc Kê__Đai Treo ống (Hình Tròn, Quả Bí, Omega,..)__Đai ốc, E Cu, Tán__Thanh Ren, Ty Ren, Guzong",www.anbinhduong.com__www.ngukimanbinhduong.com,'02746518616__0907281077__0985355435',Hotline,X,,,ngukim.abd@gmail.com,https://www.yellowpages.vn/lgs/1187863041/oc-vit-bulong-an-binh-duong-cong-ty-tnhh-tm-dv-an-binh-duong.html
Công Ty TNHH Thiết Bị Nhập Khẩu Eurohomes Việt Nam,"Số 225 Nguyễn Trãi, P. Thượng Đình, P. Thanh Xuân Trung, Q. Thanh Xuân,","Khóa - Nhập Khẩu Và Phân Phối Khóa__Phụ Kiện Cửa (Cửa Kính, Nhựa, Gỗ,.)__Phụ Kiện Ngành Gỗ, Phụ Kiện Nội Thất - Sản Xuất và Cung Cấp__Đồ Gia Dụng - Sản Xuất và Bán Buôn",www.bepeu.vn,'0869282539__0868181536',Hotline,X,,,bepeurohomes@gmail.com,https://www.yellowpages.vn/lgs/1187920716/cong-ty-tnhh-thiet-bi-nhap-khau-eurohomes-viet-nam.html
Chi Nhánh Công Ty TNHH Thương Mại Và Dịch Vụ Cường Lực Kính,"38 Hùng Vương, TT Nam Phước, Duy Xuyên,		","Nhôm Kính -  Công Ty Sản Xuất và Kinh Doanh Nhôm Kính__Nhôm Định Hình, Thanh Nhôm Định Hình__Phụ Kiện Cửa (Cửa Kính, Nhựa, Gỗ,.)__Phụ Kiện Ngành Gỗ, Phụ Kiện Nội Thất - Sản Xuất và Cung Cấp",,'0935127147',Ms. Nga,,female,,thanhnga86dn@gmail.com,https://www.yellowpages.vn/lgs/1187820267/chi-nhanh-cong-ty-tnhh-thuong-mai-va-dich-vu-cuong-luc-kinh.html
Công Ty TNHH ĐT TM Và Xuất Nhập Khẩu Bảo Lâm,"Khu Đất Mới Tổ 7, P. Cự Khối, Long biên,","Keo dán gỗ (Keo Ghép Ngang, Ghép Dọc, Dán Veneer)__Phụ Kiện Ngành Gỗ, Phụ Kiện Nội Thất - Sản Xuất và Cung Cấp",www.phukienbaolam.com,'0975292588__0707999197',Ms. Vy Thanh Quế,,female,Giám Đốc,,https://www.yellowpages.vn/lgs/1187909355/cong-ty-tnhh-dt-tm-va-xuat-nhap-khau-bao-lam.html
Cơ Sở Sản Xuất Gia Công Bản Lề,"Liễu Ngoại, Khánh Hà, Thường Tín,","Phụ Kiện Ngành Gỗ, Phụ Kiện Nội Thất - Sản Xuất và Cung Cấp",,'0974701288',Mr. Tươi,,male,,anhtuoi01293315288@gmail.com,https://www.yellowpages.vn/lgs/1187839365/co-so-san-xuat-gia-cong-ban-le.html
Công Ty TNHH Đầu Tư Thương Mại Dịch Vụ Nguyên Đức,"407/12 Sư Vạn Hạnh, P. 12, Q. 10,","Ván ép Coppha (Ván ép Phủ Phim, Ván ép Chịu Nước, Phủ Keo,.)__Ván ép Nội Thất - Sản Xuất và Cung Cấp__Phụ Kiện Ngành Gỗ, Phụ Kiện Nội Thất - Sản Xuất và Cung Cấp",www.vanepnguyenduc.com,'0935238789__02866795464__0913944789',Mr. Nguyễn Văn Tạ,,male,,ctynguyenducsg@gmail.com,https://www.yellowpages.vn/lgs/1187924109/cong-ty-tnhh-dau-tu-thuong-mai-dich-vu-nguyen-duc.html
Công Ty TNHH Sản Xuất Thương Mại Dịch Vụ Ngũ Kim Diệp Trâm Phát,"G7 đường Thành Thái, KP. Tân Cang, P. Phước Tân, TP. Biên Hòa,","Phụ Kiện Ngành Gỗ, Phụ Kiện Nội Thất - Sản Xuất và Cung Cấp",,'0367107888__0972530974',Ms. Chinh,,female,CN Đồng Nai,,https://www.yellowpages.vn/lgs/1187903487/cong-ty-tnhh-san-xuat-thuong-mai-dich-vu-ngu-kim-diep-tram-phat.html
Công Ty Nội Thất Hoàng Phúc,"17/84 Phan Đăng Lưu, P9, TP Tuy Hòa","Ván Sàn Gỗ Công Nghiệp__Phụ Kiện Ngành Gỗ, Phụ Kiện Nội Thất - Sản Xuất và Cung Cấp__Tủ Bếp (Tủ Bếp Gỗ, Tủ Bếp Nhôm Kính,..các loại)__Thiết Bị Điện Dân Dụng__Đồ Nội Thất Gia Đình",www.noithathoangphuc.com,'01676838879__0906595063',Hotline,X,,,tubephoangphuc@gmail.com,https://www.yellowpages.vn/lgs/1187859816/cong-ty-noi-that-hoang-phuc.html
Chi Nhánh - Công Ty TNHH Ngũ Kim Đồng Tâm,"Số 4, Vũ Huy Tấn, Phường Quang Trung, TP. Quy Nhơn,","Xi Mạ - Công Ty Xi Mạ__Mạ Niken, Xi Mạ Niken__Phụ Kiện Ngành Gỗ, Phụ Kiện Nội Thất - Sản Xuất và Cung Cấp__Mạ Kim Loại, Xi Mạ Kim Loại",www.ximadongtam.bizz.vn,'0906502917',Mr. Lực,,male,Kinh Doanh,lucvlltt@gmail.com,https://www.yellowpages.vn/lgs/1187932440/chi-nhanh-cong-ty-tnhh-ngu-kim-dong-tam.html
Cơ Sở Hưng Nghị,"276/20 Đường Trần Hưng Đạo, Kp. Đông B, P. Đông Hòa, Tx. Dĩ An ,","Phụ Kiện Ngành Gỗ, Phụ Kiện Nội Thất - Sản Xuất và Cung Cấp__May Mặc - Nguyên, Phụ Liệu May Mặc__Giày - Vật Tư Và Phụ Liệu",,'0908666261__02743737888',Ms. Huỳnh Huệ Mi,,female,,hsinyi0168@gmail.com,https://www.yellowpages.vn/lgs/1187863527/co-so-hung-nghi.html
Công Ty TNHH Sản Xuất Thương Mại Dịch Vụ Kỹ Thuật Nam Khang,"Số 442D Nguyễn Sơn, P. Phú Thọ Hòa, Q. Tân Phú,","Sắt Mỹ Thuật, Sắt Mỹ Nghệ (Cổng, Cửa, Bàn Ghế, Sắt Uốn Mỹ Thuật)__Phụ Kiện Cửa (Cửa Kính, Nhựa, Gỗ,.)__Phụ Kiện Ngành Gỗ, Phụ Kiện Nội Thất - Sản Xuất và Cung Cấp",www.fhomenamkhang.com,'0901186997__0901196992',Hotline,X,,,fhomenamkhang@gmail.com,https://www.yellowpages.vn/lgs/1187884506/cong-ty-tnhh-san-xuat-thuong-mai-dich-vu-ky-thuat-nam-khang.html
Công Ty TNHH Cơ Khí Và Xây Dựng Nam Thành Phương,"Kp. 4, P. Trảng Dài, TP. Biên Hòa,","Cơ Khí Xây Dựng (Vì Kèo Thép, Nhà Khung Thép, Kết Cấu Nhà Xưởng,..)__Phụ Kiện Ngành Gỗ, Phụ Kiện Nội Thất - Sản Xuất và Cung Cấp",,'0975238013',,,,,,https://www.yellowpages.vn/lgs/1187868795/cong-ty-tnhh-co-khi-va-xay-dung-nam-thanh-phuong.html
Khóa Cửa Và Phụ Kiện Tủ Bếp Phúc Hương,"359 Phú Lợi, P. Phú Lợi, TP. Thủ Dầu Một,","Phụ Kiện Ngành Gỗ, Phụ Kiện Nội Thất - Sản Xuất và Cung Cấp",www.khoacuabinhduong.vn,'0901696566__0901233889',,,,,,https://www.yellowpages.vn/lgs/1187869347/khoa-cua-va-phu-kien-tu-bep-phuc-huong.html
Công Ty TNHH Sản Xuất Thương Mại Dịch Vụ Đại Hồng Minh,"Thửa đất số 167, Tờ bản đồ số 8, Khu phố Phước Hải, P.Thái Hòa, TX. Tân Uyên,","Phụ Kiện Ngành Gỗ, Phụ Kiện Nội Thất - Sản Xuất và Cung Cấp",,'01686286087',,,,,,https://www.yellowpages.vn/lgs/1187797533/cong-ty-tnhh-san-xuat-thuong-mai-dich-vu-dai-hong-minh.html
Cơ Sở Sản Xuất Trung Long,"G16/ 108F Trần Đại Nghĩa, ấp 7, X. Lê Minh Xuân, H. Bình Chánh,","Phụ Kiện Ngành Gỗ, Phụ Kiện Nội Thất - Sản Xuất và Cung Cấp",,'0931774924',Mr. Long,,male,,Danghonglong3000@yahoo.com,https://www.yellowpages.vn/lgs/1187910006/co-so-san-xuat-trung-long.html
Đồ Gỗ Nội Thất Cát Thành Ngọc - Công Ty TNHH MTV Thương Mại Cát Thành Ngọc,"Số 44, Đường Bùi Trọng Nghĩa, KP. 3, P. Trảng Dài, TP. Biên Hoà,","Đồ Gỗ Nội Thất - Sản Xuất và Kinh Doanh Đồ Gỗ Nội Thất__Phụ Kiện Ngành Gỗ, Phụ Kiện Nội Thất - Sản Xuất và Cung Cấp",,'0888075768__0967902566',Bà Mai Thị Kim Sa,,female,,sakimmai@gmail.com,https://www.yellowpages.vn/lgs/1187880063/do-go-noi-that-cat-thanh-ngoc-cong-ty-tnhh-mtv-thuong-mai-cat-thanh-ngoc.html
