company,address,industry,website,phone,contact_person,is_hotline,gender,position,email,url
Công Ty TNHH Cơ Khí Vinh Lập ( Công Ty Vạn Phong ),"1A187/1 Vĩnh Lộc, ấp 1, X. Phạm Văn Hai, H. Bình Chánh,","Phụ Kiện Ngành Gỗ, Phụ Kiện Nội Thất - Sản Xuất và Cung Cấp__Kim Khí - Vật Tư Và Phụ Kiện",www.vinhlap.com,'0903839928__02837663656',Ông Văn Chấn Sáng,,male,Giám Đốc,,https://www.yellowpages.vn/lgs/1187704257/cong-ty-tnhh-co-khi-vinh-lap---cong-ty-van-phong--.html
Phụ Kiện Ngành Gỗ Hoa Đạt - Công Ty TNHH SX XNK Hoa Đạt,"Số 520, QL. 13, Hiệp Bình Phước, Q. Thủ Đức,","Cơ Khí -  Gia Công và Chế Tạo__Phụ Kiện Ngành Gỗ, Phụ Kiện Nội Thất - Sản Xuất và Cung Cấp__Dụng Cụ Cơ Khí__Đinh Công Nghiệp - Sản Xuất và Phân Phối__Công nghiệp - Vật Tư và Thiết Bị Công Nghiệp",www.phukiennganhgo.com,'0902407828__02743799446',Bùi Thị Mỹ Thảo,,,Giám đốc,kinhdoanh@phukiennganhgo.com.vn,https://www.yellowpages.vn/lgs/1187859771/phu-kien-nganh-go-hoa-dat-cong-ty-tnhh-sx-xnk-hoa-dat.html
Phụ Kiện Ngành Gỗ ROXANA - Công Ty TNHH Sản Xuất Thương Mại Dịch Vụ Cường Thịnh ROXANA,"Thửa đất số 660, Tờ bản đồ số 8, KP. Khánh Hòa, P. Tân Phước Khánh, TX. Tân Uyên,","Gia Công ép Nhựa, Gia Công ép Nhựa Theo Yêu Cầu__Gỗ - Vật Tư Ngành Gỗ__Phụ Kiện Ngành Gỗ, Phụ Kiện Nội Thất - Sản Xuất và Cung Cấp__ốc, Vít, Bù Loong__Bàn Chải Công Nghiệp, Bánh Cước",www.ngukimgo.com,'0982915850',Mr. Trần Anh Hùng,,male,,ngukimchinhthuan168@gmail.com,https://www.yellowpages.vn/lgs/1187812407/phu-kien-nganh-go-roxana-cong-ty-tnhh-san-xuat-thuong-mai-dich-vu-cuong-thinh-roxana.html
Phụ Kiện Ngành Gỗ Hiệp Đạt Đồng Nai - Công Ty CP Hiệp Đạt Đồng Nai,"Khu 2, Ấp Bình Thạch, X. Bình Hòa, H. Vĩnh Cửu,","ốc, Vít, Bù Loong__Đinh Công Nghiệp - Sản Xuất và Phân Phối__Phụ Kiện Ngành Gỗ, Phụ Kiện Nội Thất - Sản Xuất và Cung Cấp__Bulong Inox, ốc Inox, Vít Inox",www.hiepdatdongnai.com,'0909931867__02513965454',Hotline,X,,,hiepdatdn@gmail.com,https://www.yellowpages.vn/lgs/999711/phu-kien-nganh-go-hiep-dat-dong-nai-cong-ty-cp-hiep-dat-dong-nai.html
Phụ Kiện Ngành Gỗ Sacom - Công Ty TNHH Thương Mại Dịch Vụ Quốc Tế Sacom,"8/1/22 Đường Số 1, Kp. 5, P. Hiệp Bình Phước, Q. Thủ Đức,","Gỗ - Vật Tư Ngành Gỗ__Phụ Kiện Ngành Gỗ, Phụ Kiện Nội Thất - Sản Xuất và Cung Cấp__Dụng Cụ Cầm Tay",www.phukiengogiare.com,'0916251966__02743802291',Bà Nguyễn Thị Xuân,,female,,nhuxuan.nguyen96@gmail.com,https://www.yellowpages.vn/lgs/1187867604/phu-kien-nganh-go-sacom-cong-ty-tnhh-thuong-mai-dich-vu-quoc-te-sacom.html
Phụ Kiện Ngành Gỗ Cao Đạt - Công Ty TNHH Một Thành Viên Dịch Vụ Thương Mại XNK Cao Đạt,"496/32/3C Dương Quảng Hàm, P. 6, Q. Gò Vấp,","Bulong Neo, Bulong Móng, Bulong Lục Giác,..Các Loại__Phụ Kiện Ngành Gỗ, Phụ Kiện Nội Thất - Sản Xuất và Cung Cấp__Bulong Inox, ốc Inox, Vít Inox__Vòng Đệm, Long Đền__Đai ốc, E Cu, Tán__Kim Khí - Vật Tư Và Phụ Kiện",www.phutronganhgo.com__www.ngukimcaodat.com,'02837655463__0903710750__0903862047',Mr. Hồ Hoàn Kiếm,,male,,kiem_caodat@yahoo.com,https://www.yellowpages.vn/lgs/1153323/phu-kien-nganh-go-cao-dat-cong-ty-tnhh-mot-thanh-vien-dich-vu-thuong-mai-xnk-cao-dat.html
Phụ Kiện Ngành Gỗ Đại Phúc Tuấn - Công Ty TNHH Đại Phúc Tuấn,"18/ P1, KP. 1, P. Long Bình Tân, TP. Biên Hòa,","Guzong__Phụ Kiện Ngành Gỗ, Phụ Kiện Nội Thất - Sản Xuất và Cung Cấp__Bulong Inox, ốc Inox, Vít Inox__ốc, Vít, Bù Loong__Vòng Đệm, Long Đền__Bulong Nở, Vít Nở, Tắc Kê__Đai ốc, E Cu, Tán",www.ngukimdaiphuctuan.bizz.vn,'0913792158__02516294757',Mr. Nguyễn Sỹ Tiếp,,male,,ngukim.dpt@gmail.com,https://www.yellowpages.vn/lgs/3779217/phu-kien-nganh-go-dai-phuc-tuan-cong-ty-tnhh-dai-phuc-tuan.html
Phụ Kiện Nội Thất Kim Thiên Phú - Công Ty TNHH Sản Xuất Thương Mại Kim Thiên Phú,"Thửa Đất 1634, Tờ Bản Đồ 15, KP. Tân Phước, P. Tân Bình, TX. Dĩ An,","Phụ Kiện Cửa (Cửa Kính, Nhựa, Gỗ,.)__Gỗ - Vật Tư Ngành Gỗ__Phụ Kiện Ngành Gỗ, Phụ Kiện Nội Thất - Sản Xuất và Cung Cấp__Kim Khí - Vật Tư Và Phụ Kiện",www.kimthienphu.bizz.vn,'0914220788__0903342666',Hotline,X,,,kimthienphu38@gmail.com,https://www.yellowpages.vn/lgs/1187889795/phu-kien-noi-that-kim-thien-phu-cong-ty-tnhh-san-xuat-thuong-mai-kim-thien-phu.html
Phụ Kiện Gỗ Ngọc Hương Phát - Công Ty TNHH Ngọc Hương Phát,"Thửa Đất Số 457, Tờ Bản Đồ Số 33, KP. Long Bình, P. Khánh Bình, TX. Tân Uyên,","Bulong Neo, Bulong Móng, Bulong Lục Giác,..Các Loại__Phụ Kiện Ngành Gỗ, Phụ Kiện Nội Thất - Sản Xuất và Cung Cấp__Bulong Inox, ốc Inox, Vít Inox__ốc, Vít, Bù Loong__Vòng Đệm, Long Đền__Đai ốc, E Cu, Tán",www.ngukimgiare.com,'0933570891__0983102939',Mr. Hậu,,male,,howard762424@gmail.com,https://www.yellowpages.vn/lgs/1187841234/phu-kien-go-ngoc-huong-phat-cong-ty-tnhh-ngoc-huong-phat.html
Phụ Kiện Gỗ Đông Hưng - Công Ty Cổ Phần Thương Mại Kỹ Thuật Đông Hưng,"Số 30/8C, Hai Bà Trưng, KP. Đông Tác, P. Tân Đông Hiệp, TX. Dĩ An,","Guzong__Phụ Kiện Cửa (Cửa Kính, Nhựa, Gỗ,.)__Chốt Gỗ, Tay Nắm Gỗ__Phụ Kiện Ngành Gỗ, Phụ Kiện Nội Thất - Sản Xuất và Cung Cấp__ốc, Vít, Bù Loong__Thanh Ren, Ty Ren, Guzong",www.hardware.bizz.vn__www.donghung.vn,'02871007879__0984022099__0933034768',Ông Hà Xuân Nam,,male,,binhduongtinh@yahoo.com,https://www.yellowpages.vn/lgs/1187760981/phu-kien-go-dong-hung-cong-ty-co-phan-thuong-mai-ky-thuat-dong-hung.html
Phụ Kiện Nội Thất Kim Hưng Hòa Phát - Công Ty TNHH MTV Kim Hưng Hòa Phát,"Số 653, Tổ 11, KP. Hương Phước, P. Phước Tân, TP. Biên Hòa,","Phụ Kiện Cửa (Cửa Kính, Nhựa, Gỗ,.)__Phụ Kiện Ngành Gỗ, Phụ Kiện Nội Thất - Sản Xuất và Cung Cấp__ốc, Vít, Bù Loong__Vòng Đệm, Long Đền__Đai ốc, E Cu, Tán__Thanh Ren, Ty Ren, Guzong",www.ngukimhoaphat.bizz.vn,'0987232188',Mr. Đỗ Văn Hân,,male,,kimhunghoaphat@gmail.com,https://www.yellowpages.vn/lgs/1187803668/phu-kien-noi-that-kim-hung-hoa-phat-cong-ty-tnhh-mtv-kim-hung-hoa-phat.html
Phụ Kiện Nội Thất Thanh Ngọc - Công Ty TNHH SX TM Xuất Nhập Khẩu Thanh Ngọc,"33D, KP. 6, P. Trường Thọ, Q. Thủ Đức,","Phụ Kiện Ngành Gỗ, Phụ Kiện Nội Thất - Sản Xuất và Cung Cấp__Bàn Ghế - Bàn Ghế Nội Thất",www.thanhngoc.vn,'0907979779__02513510666__0907786778',Mr. Nguyễn Mạnh Hưng,,male,Giám Đốc,thanhngoc779@gmail.com,https://www.yellowpages.vn/lgs/695448/phu-kien-noi-that-thanh-ngoc-cong-ty-tnhh-sx-tm-xuat-nhap-khau-thanh-ngoc.html
Phụ Kiện Ngành Gỗ Hiền Kiệm - Công Ty TNHH Thương Mại Dịch Vụ Xuất Nhập Khẩu Hiền Kiệm,"35KDC Đại Quang, KP. Tân Phú 1, P. Tân Bình, TP. Dĩ An,","Phụ Kiện Cửa (Cửa Kính, Nhựa, Gỗ,.)__Phụ Kiện Ngành Gỗ, Phụ Kiện Nội Thất - Sản Xuất và Cung Cấp__ốc, Vít, Bù Loong__Bánh Xe Cao Su, Bánh Xe Chịu Lực__Thanh Ren, Ty Ren, Guzong",www.phanphoiphukiennganhgo.com,'0812923596__0837552793__0765825082',Nguyễn Thị Hồng Thắm,,,,,https://www.yellowpages.vn/lgs/1187927109/phu-kien-nganh-go-hien-kiem-cong-ty-tnhh-thuong-mai-dich-vu-xuat-nhap-khau-hien-kiem.html
Vật Tư Ngành Gỗ Thành Lợi Phát - Công Ty TNHH TM-DV XD Thành Lợi Phát,"Đường D3 KDC Rạch Bắp, Xã An Điền, Thị Xã Bến Cát,","Vật Tư Ngành Nước, Phụ Kiện Ngành Nước__Gỗ - Vật Tư Ngành Gỗ__Phụ Kiện Ngành Gỗ, Phụ Kiện Nội Thất - Sản Xuất và Cung Cấp__Thiết Bị Điện - Nhập Khẩu và Phân Phối Thiết Bị Điện",www.thanhloiphat.bizz.vn,'0982132648__0989007721',Mr. Nguyễn Thanh,,male,Giám Đốc,thanhloiphatbc@gmail.com,https://www.yellowpages.vn/lgs/1187916093/vat-tu-nganh-go-thanh-loi-phat-cong-ty-tnhh-tm-dv-xd-thanh-loi-phat.html
Phụ Kiện Ngành Gỗ Đắc Thiên Mã - Công Ty TNHH Đắc Thiên Mã,"961 Đường ĐT 743, KP. Tân Long, P. Tân Đông Hiệp, TX. Dĩ An,","ốc, Vít, Bù Loong__Phụ Kiện Ngành Gỗ, Phụ Kiện Nội Thất - Sản Xuất và Cung Cấp__Thanh Ren, Ty Ren, Guzong",www.dacthienma.com,'0968177899__02743776889',Liên hệ,,,,dacthienma@gmail.com,https://www.yellowpages.vn/lgs/1187843061/phu-kien-nganh-go-dac-thien-ma-cong-ty-tnhh-dac-thien-ma.html
Phụ Kiện Ngành Gỗ Ho Shin Precision - Công Ty TNHH Ho Shin Precision,"KP. Bình Phước A, P. Bình Chuẩn, TX. Thuận An,","Phụ Kiện Cửa (Cửa Kính, Nhựa, Gỗ,.)__Phụ Tùng Xe Đạp, Phụ Kiện Xe Đạp__Phụ Kiện Ngành Gỗ, Phụ Kiện Nội Thất - Sản Xuất và Cung Cấp",www.hoshinvn.com,'02743732560',Mr. Lai Ming Tung,,male,Giám Đốc,hoshincty@gmail.com,https://www.yellowpages.vn/lgs/1187812650/phu-kien-nganh-go-ho-shin-precision-cong-ty-tnhh-ho-shin-precision.html
Công Ty Cổ Phần Kim Gia Phạm,"656 Sư Vạn Hạnh, P. 12, Q. 10,","Khóa - Nhập Khẩu Và Phân Phối Khóa__Phụ Kiện Cửa (Cửa Kính, Nhựa, Gỗ,.)__Phụ Kiện Ngành Gỗ, Phụ Kiện Nội Thất - Sản Xuất và Cung Cấp__Khóa Điện Tử__Khóa Khách Sạn",www.vickini.com__www.ivanhardware.com,'0977799959',Mr. Phạm Văn Hiệp,,male,TGĐ,hiep.pv@ivanhardware.com,https://www.yellowpages.vn/lgs/1187859747/cong-ty-co-phan-kim-gia-pham.html
Phụ Kiện Ngành Gỗ An Thành Trung - Công Ty TNHH MTV An Thành Trung,"38/13 DT743, KP. Bình Phước B, P. Bình Chuẩn, TX. Thuận An,","Đồ Nội Thất - Kinh Doanh Và Phân Phối__ốc, Vít, Bù Loong__Phụ Kiện Ngành Gỗ, Phụ Kiện Nội Thất - Sản Xuất và Cung Cấp",www.anthanhtrung.bizz.vn/,'02743798294__0974145295',Bà Đào Thị Phương Huyền,,female,Giám Đốc,phuonghuyen2606@gmail.com,https://www.yellowpages.vn/lgs/1187718414/phu-kien-nganh-go-an-thanh-trung-cong-ty-tnhh-mtv-an-thanh-trung.html
Ngũ Kim Kim Xương Huy - Công Ty TNHH MTV Kim Xương Huy,"Thửa Đất Số 230, Tờ Bản Đồ Số 6, KP. Tân Hội, P. Tân Hiệp, TX. Tân Uyên,","Cơ Khí - Dịch Vụ Gia Công Cắt, Chấn, Đột Dập Cơ Khí__Phụ Kiện Ngành Gỗ, Phụ Kiện Nội Thất - Sản Xuất và Cung Cấp__Bulong Inox, ốc Inox, Vít Inox__ốc, Vít, Bù Loong__Khuôn Dập (Dập Nóng, Lạnh, Vuốt, Liên Hoàn)__Cơ Khí - Gia Công Cơ Khí Theo Yêu Cầu__Khuôn Mẫu__Kim Khí - Vật Tư Và Phụ Kiện",www.mamxoay.com.vn__www.ngukimxuonghuy.com.vn,'0913424262',Mr Toàn,,male,,hardwarexuonghuy@gmail.com,https://www.yellowpages.vn/lgs/119346663/ngu-kim-kim-xuong-huy-cong-ty-tnhh-mtv-kim-xuong-huy.html
Công Ty TNHH Sản Xuất Thương Mại Minh Ngọc Phát,"Thửa Đất Số Lô PC  - Ô 26 , Tờ Bản Đồ Số C8 - KTĐC Phú Chánh, P. Phú Tân, TP. Thủ Dầu Một,","Vải Simili, Vải Giả Da PU, Vải Giả Da PVC__Phụ Kiện Ngành Gỗ, Phụ Kiện Nội Thất - Sản Xuất và Cung Cấp",www.minhngocphat.bizz.vn,'0979249483',Mr. Hồng Thiên Minh,,male,,minhngocphat89@gmail.com,https://www.yellowpages.vn/lgs/1187826582/cong-ty-tnhh-san-xuat-thuong-mai-minh-ngoc-phat.html
Gỗ Nguyên Liệu Bảo Thịnh An - Công Ty TNHH MTV Thương Mại Dịch Vụ Bảo Thịnh An,"Số 333B/27, KP. Nội Hòa 1, P. Bình An, TX. Dĩ An,","Củi Trấu, Viên Nén Gỗ, Dăm Gỗ, Mùn Cưa__Phụ Kiện Ngành Gỗ, Phụ Kiện Nội Thất - Sản Xuất và Cung Cấp__Phôi Gỗ, Phôi Gỗ Pallet__Gỗ Nguyên Liệu__Đồ Gỗ Nội Thất - Sản Xuất và Kinh Doanh Đồ Gỗ Nội Thất",www.baothinhan.com,'0908758686',Ông Trần Hồng Hải,,male,,honghai.tran26@gmail.com,https://www.yellowpages.vn/lgs/1187768910/go-nguyen-lieu-bao-thinh-an-cong-ty-tnhh-mtv-thuong-mai-dich-vu-bao-thinh-an.html
Phụ Kiện Ngành Gỗ K.C.S - Công Ty TNHH MTV  Sản Xuất Thương Mại Dịch Vụ K.C.S,"D7/203B, Ấp 4, X. Phong Phú, H. Bình Chánh,","Đinh Công Nghiệp - Sản Xuất và Phân Phối__Phụ Kiện Ngành Gỗ, Phụ Kiện Nội Thất - Sản Xuất và Cung Cấp",www.kcs.vn,'0903683231__02854303399',Hotline,X,,,sales@kcs.com.vn,https://www.yellowpages.vn/lgs/698073/phu-kien-nganh-go-k.c.s-cong-ty-tnhh-mtv--san-xuat-thuong-mai-dich-vu-k.c.s.html
Chi Nhánh Phụ Kiện Gỗ Đông Hưng - Công Ty Cổ Phần Thương Mại Kỹ Thuật Đông Hưng,"A7-50, Đường số 12, KĐT Tây Bắc, P. Vĩnh Thanh, TP. Rạch Giá,","Phụ Kiện Ngành Gỗ, Phụ Kiện Nội Thất - Sản Xuất và Cung Cấp",www.donghung.vn,'0984022099__02871007879__0933034768',Ông Hà Xuân Nam,,male,,binhduongtinh@yahoo.com,https://www.yellowpages.vn/lgs/1187933001/chi-nhanh-phu-kien-go-dong-hung-cong-ty-co-phan-thuong-mai-ky-thuat-dong-hung.html
Inox Chang Hong - Công Ty TNHH Đúc Chính Xác Chang Hong,"KP. Mỹ Hiệp, P. Thái Hòa, TX. Tân Uyên,","Phụ Kiện Ngành Gỗ, Phụ Kiện Nội Thất - Sản Xuất và Cung Cấp__Inox Cuộn__Phụ Kiện Inox (Tê, Co, Côn, Cút,..)__Mặt Bích - Mặt Bích Thép, Mặt Bích Inox__Inox Tấm__Inox, Thép Không Gỉ",www.changhong.bizz.vn,'0389944131__0908007449__02743625388',Bà Tsai Chiao Fang,,female,Giám Đốc,trosabel@gmail.com,https://www.yellowpages.vn/lgs/1025940/inox-chang-hong-cong-ty-tnhh-duc-chinh-xac-chang-hong.html
Bulong ốc Vít Kiến Đạt - Công Ty TNHH Công Nghiệp Kiến Đạt,"Lô C6, Đường 7, KCN Long Bình, Tp. Biên Hòa,","Phụ Tùng Xe Máy, Linh Phụ Kiện Xe Máy__Phụ Kiện Ngành Gỗ, Phụ Kiện Nội Thất - Sản Xuất và Cung Cấp__ốc, Vít, Bù Loong__Vòng Đệm, Long Đền__Đai ốc, E Cu, Tán__Xi Mạ - Công Ty Xi Mạ__Xử Lý Nhiệt - Gia Công Xử Lý Nhiệt (Chân Không, Tôi Cứng, Thấm Carbon,.)",www.chientabolt.com,'0772962878__02513993888',Ms. Tiên,,female,P. Kinh Doanh,sales@chientabolt.com,https://www.yellowpages.vn/lgs/1097625/bulong-oc-vit-kien-dat-cong-ty-tnhh-cong-nghiep-kien-dat.html
Gỗ Đại Thành Phát - Công Ty TNHH Sản Xuất Gỗ Đại Thành Phát,"288/86/56 Huỳnh Văn Lũy, Khu Phố 7, P. Phú Lợi, Tp. Thủ Dầu Một,","Chi Tiết Gỗ - Gia Công Tiện, Uốn Cong, Chạm, Chuốt,..__Phụ Kiện Ngành Gỗ, Phụ Kiện Nội Thất - Sản Xuất và Cung Cấp__Chốt Gỗ, Tay Nắm Gỗ",www.chotgo.vn,'0919876777__02743856939',Mr. Phan Văn Tâm,,male,,phantam.daithanhphat@gmail.com,https://www.yellowpages.vn/lgs/1187748924/go-dai-thanh-phat-cong-ty-tnhh-san-xuat-go-dai-thanh-phat.html
Keo Xây Dựng Bảo Lâm - Công Ty Đầu Tư TM XNK Bảo Lâm,"Khu Đất Mới, Tổ 7, P. Cự Khối, Q. Long Biên,","Phụ Kiện Ngành Gỗ, Phụ Kiện Nội Thất - Sản Xuất và Cung Cấp__Vải Simili, Vải Giả Da PU, Vải Giả Da PVC__Lò Xo, Lò Xo Công Nghiệp__Dụng Cụ Cầm Tay__Đinh Công Nghiệp - Sản Xuất và Phân Phối__Keo Xây Dựng (Keo Dán Gạch, Đá, Chà Ron, Keo Cấy Thép,.)",www.keobaolam.com__www.phukienbaolam.com,'0966292588__0975292588',Ông Vy Văn Quế,,male,,phukienbaolam@gmail.com,https://www.yellowpages.vn/lgs/1187896371/keo-xay-dung-bao-lam-cong-ty-dau-tu-tm-xnk-bao-lam.html
Máy Chế Biến Gỗ Thượng Nguyên - Công Ty TNHH Máy Chế Biến Gỗ Thượng Nguyên,"Thửa Đất Số 59, 60, 70 Tờ Bản Đồ Số 1, KP. Phước Thái, P. Thái Hòa, TX. Tân Uyên,","Phụ Kiện Ngành Gỗ, Phụ Kiện Nội Thất - Sản Xuất và Cung Cấp__Máy Phay Gỗ__Máy Dán Cạnh__Máy Chế Biến Gỗ__Máy Chà Nhám__Máy Bào Gỗ__Máy Khoan Gỗ__Máy Mài Dao__Máy Chế Biến Gỗ Cũ, Đã Qua Sử Dụng__Máy Cưa Gỗ",,'0902985898__02743777558',Hotline,X,,,it@thuongnguyen.vn,https://www.yellowpages.vn/lgs/3749715/may-che-bien-go-thuong-nguyen-cong-ty-tnhh-may-che-bien-go-thuong-nguyen.html
Kinh Thuận - Công Ty TNHH Kinh Thuận,"T1/19M Tổ 1, KP. Bình Thuận 2, P. Thuận Giao, TX. Thuận An,","ốc, Vít, Bù Loong__Phụ Kiện Ngành Gỗ, Phụ Kiện Nội Thất - Sản Xuất và Cung Cấp__Đai ốc, E Cu, Tán",www.kinhthuan.bizz.vn,'0932668163__02743719142',Mr. Hoàng,,male,,ctykinhthuanbinhduong@gmail.com,https://www.yellowpages.vn/lgs/3749247/kinh-thuan-cong-ty-tnhh-kinh-thuan.html
Phụ Kiện Ngành Gỗ Kim Thành Phú - Công Ty TNHH Một Thành Viên Kim Thành Phú,"Số 69E/1, KP. 1A, P. An Phú, TX. Thuận An,","Phụ Kiện Cửa (Cửa Kính, Nhựa, Gỗ,.)__Phụ Kiện Ngành Gỗ, Phụ Kiện Nội Thất - Sản Xuất và Cung Cấp",www.kimthanhphu.com__www.ngukim.net,'02473796490__0937753892',Bà Bùi Thị Nguyệt,,female,,kimthanhocvit@yahoo.com.vn,https://www.yellowpages.vn/lgs/1187891751/phu-kien-nganh-go-kim-thanh-phu-cong-ty-tnhh-mot-thanh-vien-kim-thanh-phu.html
Vật Tư Ngành Gỗ Thịnh Dũng - Công Ty TNHH MTV XNK TM Thịnh Dũng,"10/1 KP. Bình - Phước, P. Bình Chuẩn, TX. Thuận An,","Máy Chà Nhám__Gỗ - Vật Tư Ngành Gỗ__Phụ Kiện Ngành Gỗ, Phụ Kiện Nội Thất - Sản Xuất và Cung Cấp",www.ngukimthinhdung.bizz.vn,'02743626613__0933396088',Ms. Lê Thị Triều,,female,,trieuthinhdung@gmail.com,https://www.yellowpages.vn/lgs/1187822406/vat-tu-nganh-go-thinh-dung-cong-ty-tnhh-mtv-xnk-tm-thinh-dung.html
ốc Vít Buloong Hải Phương - Công Ty TNHH Hải Phương,"Cụm 3, X. Liên Hiệp, H. Phúc Thọ,","Bulong Neo, Bulong Móng, Bulong Lục Giác,..Các Loại__Phụ Kiện Ngành Gỗ, Phụ Kiện Nội Thất - Sản Xuất và Cung Cấp__Bulong Inox, ốc Inox, Vít Inox__ốc, Vít, Bù Loong__Đai ốc, E Cu, Tán__Thanh Ren, Ty Ren, Guzong__Xi Mạ - Công Ty Xi Mạ",www.haiphuonggroup.com,'02433648292__0978986928',Mrs. Phương,,,Phó Giám Đốc,haiphuong.vn@gmail.com,https://www.yellowpages.vn/lgs/1187719719/oc-vit-buloong-hai-phuong-cong-ty-tnhh-hai-phuong.html
Bulong ốc Vít Toàn Tâm - Công Ty TNHH Công Nghiệp Toàn Tâm,"3C98/1 Ấp 3, X. Phạm Văn Hai, H. Bình Chánh,","Bulong Neo, Bulong Móng, Bulong Lục Giác,..Các Loại__Phụ Kiện Ngành Gỗ, Phụ Kiện Nội Thất - Sản Xuất và Cung Cấp__Bulong Inox, ốc Inox, Vít Inox__ốc, Vít, Bù Loong__Vòng Đệm, Long Đền__Đai ốc, E Cu, Tán__Thanh Ren, Ty Ren, Guzong__Đinh Rút, Đinh Tán, Rive Nhôm, Rive Inox__Vít Bắn Tôn, Vít Tự Khoan, Vít Thạch Cao,..Các Loại__Bulong Cường Độ Cao",www.ocvittoantam.com,'02836204428__0974925335__0898899269',Ông Nguyễn Chí Tâm,,male,,sales@ocvittoantam.com,https://www.yellowpages.vn/lgs/1187841225/bulong-oc-vit-toan-tam-cong-ty-tnhh-cong-nghiep-toan-tam.html
Bulong ốc Vít Tuấn Tín Thành  - Công Ty TNHH Tuấn Tín Thành,"38/11 Đường DT743, KP. Bình Phước A, P. Bình Chuẩn, Thuận An,","Bulong Neo, Bulong Móng, Bulong Lục Giác,..Các Loại__Phụ Kiện Ngành Gỗ, Phụ Kiện Nội Thất - Sản Xuất và Cung Cấp__Bulong Inox, ốc Inox, Vít Inox__ốc, Vít, Bù Loong__Thanh Ren, Ty Ren, Guzong",www.tuantinthanh.bizz.vn,'0913629600',Ông Phạm Anh Tuấn,,male,,tuanvtbd2000@yahoo.com.vn,https://www.yellowpages.vn/lgs/1187754123/bulong-oc-vit-tuan-tin-thanh--cong-ty-tnhh-tuan-tin-thanh.html
Tiện Gỗ Thiên Hùng Mạnh - Công Ty TNHH MTV Thiên Hùng Mạnh,"Số 19/1A, Khu phố Đông Chiêu, Phường Tân Đông Hiệp, Thành phố Dĩ An","Chốt Gỗ, Tay Nắm Gỗ__Chi Tiết Gỗ - Gia Công Tiện, Uốn Cong, Chạm, Chuốt,..__Phụ Kiện Ngành Gỗ, Phụ Kiện Nội Thất - Sản Xuất và Cung Cấp",www.tiengothienhungmanh.bizz.vn,'0973622277__0972610367__02746262686',Ông Đinh Bá Mạnh,,male,,thienhungmanh@gmail.com,https://www.yellowpages.vn/lgs/1187776524/tien-go-thien-hung-manh-cong-ty-tnhh-mtv-thien-hung-manh.html
Phụ Kiện Ngành Gỗ Thúy Hằng - Hệ Thống Phân Phối Sỉ Và Lẻ Giá Gốc Thúy Hằng,"244 Bùi Văn Ngữ, Tổ 47, KP.7, P. Hiệp Thành, Q. 12,","Khóa - Nhập Khẩu Và Phân Phối Khóa__ốc, Vít, Bù Loong__Phụ Kiện Ngành Gỗ, Phụ Kiện Nội Thất - Sản Xuất và Cung Cấp",,'0937321769',Hotline,X,,,,https://www.yellowpages.vn/lgs/1187868354/phu-kien-nganh-go-thuy-hang-he-thong-phan-phoi-si-va-le-gia-goc-thuy-hang.html
Phụ Kiện Ngành Gỗ  VinaHardware - Công Ty TNHH Sản Xuất Xuất Nhập Khẩu VinaHardware,"24/14 Đường Vĩnh Phú 21, Thuận An,","Khóa - Nhập Khẩu Và Phân Phối Khóa__Cơ Khí -  Gia Công và Chế Tạo__Khóa - Nhà Sản Xuất Khóa__Phụ Kiện Cửa (Cửa Kính, Nhựa, Gỗ,.)__Phụ Kiện Ngành Gỗ, Phụ Kiện Nội Thất - Sản Xuất và Cung Cấp__Chốt Gỗ, Tay Nắm Gỗ__ốc, Vít, Bù Loong__Máy Móc Cơ Khí, Thiết Bị Cơ Khí__Dụng Cụ Điện Cầm Tay",www.vinahardware.com,'0902604828__02862723023',Ms. Nghĩa,,female,,sales@vinahardware.com,https://www.yellowpages.vn/lgs/1187715561/phu-kien-nganh-go--vinahardware-cong-ty-tnhh-san-xuat-xuat-nhap-khau-vinahardware.html
Ngũ Kim Hoàng Phúc - Công Ty TNHH MTV Ngũ Kim Hoàng Phúc,"1133/11B, Đường Lê Hồng Phong, KP. Đông Thành, P. Tân Đông Hiệp, Dĩ An,","ốc, Vít, Bù Loong__Phụ Kiện Ngành Gỗ, Phụ Kiện Nội Thất - Sản Xuất và Cung Cấp",www.ngukimhoangphuc.bizz.vn,'0978445269__02743776335',Ông Vũ Thành Nam,X,male,Hotline,ngukimhoangphuc@gmail.com,https://www.yellowpages.vn/lgs/1187771979/ngu-kim-hoang-phuc-cong-ty-tnhh-mtv-ngu-kim-hoang-phuc.html
Vật Tư Ngành Gỗ Polymay - Công Ty TNHH Vật Liệu Mới Polymay,"238/2,  KP. Bình Phú, P. Bình Chuẩn, TP. Thuận An,","Gỗ - Vật Tư Ngành Gỗ__Phụ Kiện Ngành Gỗ, Phụ Kiện Nội Thất - Sản Xuất và Cung Cấp__Máy Chế Biến Gỗ__Máy Phun Sơn__Dụng Cụ Cắt Gọt (Dao Phay, Dao tiện, Mũi Khoan, Mũi Taro,.)",,'0937015129__0988629008',Mr. Diệp Hoa Quyền,,male,Giám Đốc,huaquyen2008@gmail.com,https://www.yellowpages.vn/lgs/1187824218/vat-tu-nganh-go-polymay-cong-ty-tnhh-vat-lieu-moi-polymay.html
Phụ Kiện Nội Thất VILUBI - Công Ty TNHH VILUBI,"75 Trần Quang Diệu, Phường Tân Bình, Thị Xã Dĩ An,","Vải Nội Thất (Vải May Rèm, Chăn, Ga, Gối, Ghế,.)__Cơ Khí - Gia Công Cơ Khí Theo Yêu Cầu__Phụ Kiện Ngành Gỗ, Phụ Kiện Nội Thất - Sản Xuất và Cung Cấp__Kim Khí - Vật Tư Và Phụ Kiện",www.vilubi.com,'0937477066__0792434242__0785662699',Diễm VILUBI,,,Nhân Viên,sai1.vilubi@gmail.com,https://www.yellowpages.vn/lgs/1187931564/phu-kien-noi-that-vilubi-cong-ty-tnhh-vilubi.html
Phụ Kiện Ngành Gỗ Triển Đạt - Công Ty TNHH MTV Sản Xuất Thương Mại Dịch Vụ Triển Đạt,"532/28/5/7/2A Khu Phố 4, P. Bình Trị Đông, Q. Bình Tân,","Phụ Kiện Ngành Gỗ, Phụ Kiện Nội Thất - Sản Xuất và Cung Cấp",www.triendat.com,'02837509348',Văn Phòng,,,,triendat@gmail.com,https://www.yellowpages.vn/lgs/1187731293/phu-kien-nganh-go-trien-dat-cong-ty-tnhh-mtv-san-xuat-thuong-mai-dich-vu-trien-dat.html
Công Ty TNHH Hafele Việt Nam,"Tầng 3, Tòa nhà Ree Tower, Số 9 Đoàn Văn Bơ, P. 12, Q. 4,","Thiết Bị Nhà Bếp Gia Đình (Nồi Cơm, Máy Hút Mùi, Máy Xay..)__Phụ Kiện Cửa (Cửa Kính, Nhựa, Gỗ,.)__Phụ Kiện Ngành Gỗ, Phụ Kiện Nội Thất - Sản Xuất và Cung Cấp__Đồ Điện Gia Dụng - Kinh Doanh và Phân Phối",www.hafele.com.vn,'02839113113',Trung tâm chăm sóc khách hàng,,,,info@hafele.com.vn,https://www.yellowpages.vn/lgs/1187704134/cong-ty-tnhh-hafele-viet-nam.html
Công Ty TNHH MTV Hinh Nguyên Phong,"KP. Bình Hòa 1, TT. Tân Phước Khánh, TX. Tân Uyên,","Phụ Kiện Ngành Gỗ, Phụ Kiện Nội Thất - Sản Xuất và Cung Cấp",,'0903952546__02743712245',Ms. Lý Mỹ Hảo,,female,Trưởng Phòng Kinh Doanh,hinhnguyenphong@gmail.com,https://www.yellowpages.vn/lgs/3749031/cong-ty-tnhh-mtv-hinh-nguyen-phong.html
Phụ Kiện Nội Thất Lidovit - Công Ty CP Công Nghiệp Và Thương Mại Lidovit,"Lô D5, Đường Số 3, Khu Công Nghiệp Bình Chiểu, P. Bình Chiểu, Q. Thủ Đức,","Phụ Kiện Ngành Gỗ, Phụ Kiện Nội Thất - Sản Xuất và Cung Cấp__ốc, Vít, Bù Loong__Đai ốc, E Cu, Tán__Đinh Rút, Đinh Tán, Rive Nhôm, Rive Inox__Thanh Ren, Ty Ren, Guzong",www.lidovit.com.vn,'02837294183__0903693039',Mr. Trần Anh Vũ,,male,,tranvu@lidovit.com.vn,https://www.yellowpages.vn/lgs/1022190/phu-kien-noi-that-lidovit-cong-ty-cp-cong-nghiep-va-thuong-mai-lidovit.html
Công Ty TNHH MTV Thương Mại Dịch Vụ Bảo Châu,"Số Nhà 126, Đường DT 743B, KP. Tân An, P. Tân Đông Hiệp, TX. Dĩ An,","Phụ Kiện Ngành Gỗ, Phụ Kiện Nội Thất - Sản Xuất và Cung Cấp",www.ngukimnganhgo.com,'02743781755__0982112042',Ông Nguyễn Đình Thuyến,,male,Giám đốc,baobaochau11@gmail.com,https://www.yellowpages.vn/lgs/1187733648/cong-ty-tnhh-mtv-thuong-mai-dich-vu-bao-chau.html
Phụ Kiện Ngành Gỗ Vạn Nhất Thành - Công Ty TNHH MTV Vạn Nhất Thành,"253/8 Võ Thị Sáu, P. Đông Hòa, TX. Dĩ An,","Phụ Kiện Ngành Gỗ, Phụ Kiện Nội Thất - Sản Xuất và Cung Cấp",www.vnthardware.com,'02743795381__0969860606__0937842897',Hotline,X,,Kinh Doanh,vannhatthanhvn@gmail.com,https://www.yellowpages.vn/lgs/1187684193/phu-kien-nganh-go-van-nhat-thanh-cong-ty-tnhh-mtv-van-nhat-thanh.html
